beat,district,area_sq_mi,placename,population,category_name,total19,total20,total21,total22,last12mos,total_prior3years,avg_prior3years,inc_19to21,inc_19tolast12,inc_21tolast12,inc_prior3yearavgtolast12,rate19,rate20,rate21,rate_last12,rate_prior3years
23J40,23,3.03933481,Intercontinental Airport,0,Theft,3,2,2,0,1,7,2.3,-33.3,-66.7,-50,-57,NA,NA,NA,NA,NA
23J50,23,2.12389492,Intercontinental Airport,0,Theft,112,57,84,45,89,253,84.3,-25,-20.5,6,6,NA,NA,NA,NA,NA
1A10,1,1.74646692,Downtown Central Business District,17000,Theft,1507,883,936,491,1139,3326,1108.7,-37.9,-24.4,21.7,3,8864.7,5194.1,5505.9,6700,6521.8
1A20,1,2.44133075,"Fourth Ward, Avondale and Westmoreland",27000,Theft,2401,2056,2229,835,2072,6686,2228.7,-7.2,-13.7,-7,-7,8892.6,7614.8,8255.6,7674.1,8254.4
1A30,1,2.65916892,"Cherryhurst, Mandell Place and Montrose",27000,Theft,1920,1295,1122,581,1215,4337,1445.7,-41.6,-36.7,8.3,-16,7111.1,4796.3,4155.6,4500,5354.4
1A40,1,2.45016686,"Tall Timbers, Royden Oaks, River Oaks, Avalon Place and Oak Estates",7000,Theft,152,144,141,61,137,437,145.7,-7.2,-9.9,-2.8,-6,2171.4,2057.1,2014.3,1957.1,2081.4
1A50,1,3.04553452,"Post Oak Park, Afton Oaks, Highland Village, Weslayan, Greenway Plaza and The Compaq Center",26000,Theft,1517,1418,1368,748,1509,4303,1434.3,-9.8,-0.5,10.3,5,5834.6,5453.8,5261.5,5803.8,5516.5
2A10,2,3.30928608,Irvington and Ryon,18000,Theft,498,516,435,251,525,1449,483,-12.7,5.4,20.7,9,2766.7,2866.7,2416.7,2916.7,2683.3
2A20,2,1.8876461,"Sunset Heights, Brooksmith and Stude",11000,Theft,277,286,291,126,280,854,284.7,5.1,1.1,-3.8,-2,2518.2,2600,2645.5,2545.5,2588.2
2A30,2,4.65858171,"Houston Heights, Norhill and Studemont",31000,Theft,1200,833,955,434,1032,2988,996,-20.4,-14,8.1,4,3871,2687.1,3080.6,3329,3212.9
2A40,2,1.60546103,Old Sixth Ward and the First Ward,8000,Theft,548,535,526,221,526,1609,536.3,-4,-4,0,-2,6850,6687.5,6575,6575,6703.8
2A50,2,5.4659844,"Memorial Park, West End, Ashbury and Cottage Grove",29000,Theft,1711,1391,1326,606,1479,4428,1476,-22.5,-13.6,11.5,0,5900,4796.6,4572.4,5100,5089.7
2A60,2,4.67447346,"Westport, Holly Park, Lazy Brook, Citadel, Shady Acres and Timbergrove",21000,Theft,763,751,821,388,862,2335,778.3,7.6,13,5,11,3633.3,3576.2,3909.5,4104.8,3706.2
3B10,3,6.82068773,"Northwest Mall, Brookhollow, White Oak Acres, Oak Forest and Langwood",34000,Theft,1288,1270,1359,740,1605,3917,1305.7,5.5,24.6,18.1,23,3788.2,3735.3,3997.1,4720.6,3840.3
3B30,3,5.310372,"White Oak Acres, Brook Hollow, Oak Forest, Garden Oaks and Shepherd Park Plaza",23000,Theft,659,514,487,188,473,1660,553.3,-26.1,-28.2,-2.9,-15,2865.2,2234.8,2117.4,2056.5,2405.7
3B40,3,3.40013561,"Independence Heights, Melrose and Graceland",13000,Theft,493,484,471,223,503,1448,482.7,-4.5,2,6.8,4,3792.3,3723.1,3623.1,3869.2,3713.1
3B50,3,3.85259517,"Northline Mall, Stratton Place, Oakwood, Colonial Gardens, Lindale and Junction City",20000,Theft,1322,1282,862,345,827,3466,1155.3,-34.8,-37.4,-4.1,-28,6610,6410,4310,4135,5776.5
5F10,5,3.25978513,Afton Village and Pine Terrace,14000,Theft,541,644,555,288,624,1740,580,2.6,15.3,12.4,8,3864.3,4600,3964.3,4457.1,4142.9
5F30,5,8.70689439,"Fairbanks, Carverdale, Fawndale and Northwest Crossing",17000,Theft,1705,1464,1506,626,1577,4675,1558.3,-11.7,-7.5,4.7,1,10029.4,8611.8,8858.8,9276.5,9166.5
6B10,6,5.50084827,"York Plaza, Pembrook Place and Hawthorne Place",33000,Theft,725,795,633,288,672,2153,717.7,-12.7,-7.3,6.2,-6,2197,2409.1,1918.2,2036.4,2174.8
6B20,6,6.12869477,"Highland Heights, Oakdale and Melrose Gardens",18000,Theft,479,442,418,190,435,1339,446.3,-12.7,-9.2,4.1,-3,2661.1,2455.6,2322.2,2416.7,2479.4
6B30,6,7.2300685,"Woodland Trails, Oaks of Inwood, Bayou Bend, Cole Creek Manor and Inwood Forest",38000,Theft,661,678,628,253,648,1967,655.7,-5,-2,3.2,-1,1739.5,1784.2,1652.6,1705.3,1725.5
6B40,6,5.544689,"Highland Gardens, Highland Heights and North Plaza",20000,Theft,567,534,533,247,585,1634,544.7,-6,3.2,9.8,7,2835,2670,2665,2925,2723.5
22B30,22,2.8264671,Aldine and Imperial Valley,19000,Theft,514,606,581,248,572,1701,567,13,11.3,-1.5,1,2705.3,3189.5,3057.9,3010.5,2984.2
22B20,22,4.61158268,Greenspoint,24000,Theft,1048,1168,1344,604,1486,3560,1186.7,28.2,41.8,10.6,25,4366.7,4866.7,5600,6191.7,4944.6
7C10,7,3.47828324,"Fifth Ward, North Park and Pinecrest",13000,Theft,400,375,369,169,416,1144,381.3,-7.8,4,12.7,9,3076.9,2884.6,2838.5,3200,2933.1
7C20,7,7.08575157,"Huntington Place, Willshire Place, Kashmere Gardens and Liberty Gardens",21000,Theft,599,606,560,246,586,1765,588.3,-6.5,-2.2,4.6,-0,2852.4,2885.7,2666.7,2790.5,2801.4
7C30,7,4.51719841,"Camden Woods, Archers Acres and Croyden Gardens",18000,Theft,394,447,475,171,425,1316,438.7,20.6,7.9,-10.5,-3,2188.9,2483.3,2638.9,2361.1,2437.2
7C40,7,3.36786526,Keith-Weiss Park and Farrington Place,8000,Theft,224,174,193,90,209,591,197,-13.8,-6.7,8.3,6,2800,2175,2412.5,2612.5,2462.5
22B40,22,13.03325001,"Intercontinental Airport, Northwood, Lakeview Park and Glen Lee",11000,Theft,749,719,1069,540,1270,2537,845.7,42.7,69.6,18.8,50,6809.1,6536.4,9718.2,11545.5,7688.2
8C10,8,3.69037316,"Tidwell Park, Shady Oak and Buckingham Place",12000,Theft,507,473,348,143,354,1328,442.7,-31.4,-30.2,1.7,-20,4225,3941.7,2900,2950,3689.2
8C20,8,3.36154214,"Houston Gardens, Rosewood and Homestead",7000,Theft,144,173,156,61,148,473,157.7,8.3,2.8,-5.1,-6,2057.1,2471.4,2228.6,2114.3,2252.9
8C30,8,4.6258259,"Parkhurst, East Houston and Clairmont Place",11000,Theft,240,284,251,121,266,775,258.3,4.6,10.8,6,3,2181.8,2581.8,2281.8,2418.2,2348.2
8C40,8,4.97945551,"Lake Houston, Greenriver, Knoll and Lake Forest",8000,Theft,108,103,117,59,120,328,109.3,8.3,11.1,2.6,10,1350,1287.5,1462.5,1500,1366.2
8C50,8,3.31739498,"Park North, Forest Green, Kentshire Place, Glenwood Forest and Dorchester",8000,Theft,250,209,215,64,190,674,224.7,-14,-24,-11.6,-15,3125,2612.5,2687.5,2375,2808.8
8C60,8,5.79693312,"Edgeworth, Northwood Manor and Scenic Woods",19000,Theft,340,374,281,105,265,995,331.7,-17.4,-22.1,-5.7,-20,1789.5,1968.4,1478.9,1394.7,1745.8
9C10,9,5.21185619,"Port of Houston, Clinton Park, Pleasantville and Fidelity Manor",6000,Theft,90,76,86,49,95,252,84,-4.4,5.6,10.5,13,1500,1266.7,1433.3,1583.3,1400
9C20,9,7.5383173,Denver Harbor and Houston Harbor,16000,Theft,304,359,267,161,311,930,310,-12.2,2.3,16.5,0,1900,2243.8,1668.8,1943.8,1937.5
9C30,9,8.13353768,"City Park East, Wynnewood Acres and Wallisville Gardens",9000,Theft,521,434,392,203,456,1347,449,-24.8,-12.5,16.3,2,5788.9,4822.2,4355.6,5066.7,4988.9
9C40,9,10.42549456,"Greens Bayou Estates, Shady Brook, Northshore",23000,Theft,745,826,773,322,801,2344,781.3,3.8,7.5,3.6,3,3239.1,3591.3,3360.9,3482.6,3397
10H10,10,2.81830654,Oak Lawn and Ranger,11000,Theft,216,240,230,133,280,686,228.7,6.5,29.6,21.7,22,1963.6,2181.8,2090.9,2545.5,2079.1
10H20,10,1.75743169,Eastwood and Broadmoor,10000,Theft,290,257,202,94,212,749,249.7,-30.3,-26.9,5,-15,2900,2570,2020,2120,2497
10H30,10,1.02691154,Near East End,4000,Theft,674,430,498,264,600,1602,534,-26.1,-11,20.5,12,16850,10750,12450,15000,13350
10H40,10,0.99627062,Midtown,8000,Theft,1288,819,766,440,926,2873,957.7,-40.5,-28.1,20.9,-3,16100,10237.5,9575,11575,11971.2
10H50,10,2.30843079,the University of Houston area,13000,Theft,570,534,497,262,559,1601,533.7,-12.8,-1.9,12.5,5,4384.6,4107.7,3823.1,4300,4105.4
10H60,10,3.08931006,"University Oaks, Riverside Terrace and the Texas Southern University area",20000,Theft,555,559,665,250,655,1779,593,19.8,18,-1.5,10,2775,2795,3325,3275,2965
10H70,10,3.52217952,"Texas Medical Center, Hermann Park, Houston Zoo and Miller Outdoor Theatre",16000,Theft,1036,975,862,472,997,2873,957.7,-16.8,-3.8,15.7,4,6475,6093.8,5387.5,6231.2,5985.6
10H80,10,2.73862779,"Southampton, Rice University area, Shadow Lawn and Broad Acres",19000,Theft,700,515,501,279,582,1716,572,-28.4,-16.9,16.2,2,3684.2,2710.5,2636.8,3063.2,3010.5
11H10,11,5.31502815,"Mason Park, Forest Hill, Sunnyland and Central Park",28000,Theft,686,727,585,264,600,1998,666,-14.7,-12.5,2.6,-10,2450,2596.4,2089.3,2142.9,2378.6
11H20,11,3.9311161,"Harrisburg, Manchester and Pecan Park",18000,Theft,243,272,261,106,258,776,258.7,7.4,6.2,-1.1,-0,1350,1511.1,1450,1433.3,1437.2
11H30,11,2.84278059,Meadow Brook and Park Place,15000,Theft,396,509,293,132,285,1198,399.3,-26,-28,-2.7,-29,2640,3393.3,1953.3,1900,2662
11H40,11,6.14001938,Allendale and Oak Meadows,8000,Theft,98,130,102,33,78,330,110,4.1,-20.4,-23.5,-29,1225,1625,1275,975,1375
11H50,11,2.09534157,"Meadow Creek, Ferndale Addition and Glenbrook Industrial",8000,Theft,175,195,208,93,217,578,192.7,18.9,24,4.3,13,2187.5,2437.5,2600,2712.5,2408.8
12D10,12,8.55384717,"Almeda Mall, Southridge, Edgebrook and South Houston Gardens",44000,Theft,1182,1300,1224,572,1273,3706,1235.3,3.6,7.7,4,3,2686.4,2954.5,2781.8,2893.2,2807.5
12D20,12,3.83700574,Sage,22000,Theft,551,540,495,242,524,1586,528.7,-10.2,-4.9,5.9,-1,2504.5,2454.5,2250,2381.8,2403.2
12D30,12,3.99301158,Gulf Palms and Beamer,15000,Theft,245,245,222,109,228,712,237.3,-9.4,-6.9,2.7,-4,1633.3,1633.3,1480,1520,1582
12D40,12,9.68663455,Scarsdale and Ellington Field,11000,Theft,171,197,170,100,200,538,179.3,-0.6,17,17.6,12,1554.5,1790.9,1545.5,1818.2,1630
12D50,12,8.93327581,"Bay Glen, Bay Oaks, Brook Forest and Bay Forest",26000,Theft,177,136,120,46,120,433,144.3,-32.2,-32.2,0,-17,680.8,523.1,461.5,461.5,555
12D60,12,6.35832041,"NASA's Johnson Space Center, Meadow Green, Oakbrook West and Camino South",22000,Theft,237,265,234,102,244,736,245.3,-1.3,3,4.3,-1,1077.3,1204.5,1063.6,1109.1,1115
12D70,12,5.39156317,Baybrook Mall and Sterling Knoll,12000,Theft,934,863,901,418,991,2698,899.3,-3.5,6.1,10,10,7783.3,7191.7,7508.3,8258.3,7494.2
13D10,13,5.2433708,"Gulfgate Mall, Bay Forest, Riverview, Hampshire, Golfcrest and Barnett Stadium",23000,Theft,572,615,614,258,598,1801,600.3,7.3,4.5,-2.6,-0,2487,2673.9,2669.6,2600,2610
13D20,13,6.66870859,"Fairlawn, Garden Villas, Glenbrook Valley and Santa Rosa",36000,Theft,937,872,878,357,846,2687,895.7,-6.3,-9.7,-3.6,-6,2602.8,2422.2,2438.9,2350,2488.1
13D30,13,3.07402543,"Allen Farms, Airport Gardens and the Hobby Airport area",2000,Theft,52,71,59,29,67,182,60.7,13.5,28.8,13.6,10,2600,3550,2950,3350,3035
13D40,13,5.0688163,"Val Verde East, Gulf Meadows and Houston Skyscraper Shadows",13000,Theft,253,249,252,100,240,754,251.3,-0.4,-5.1,-4.8,-4,1946.2,1915.4,1938.5,1846.2,1933.1
14D10,14,3.66057918,McGregor Terrace and Riverside Terrace,17000,Theft,708,543,501,209,490,1752,584,-29.2,-30.8,-2.2,-16,4164.7,3194.1,2947.1,2882.4,3435.3
14D20,14,7.25646368,"Blueridge, Sunnyside, Brook Haven and Bayou Estates",28000,Theft,802,731,547,303,607,2080,693.3,-31.8,-24.3,11,-12,2864.3,2610.7,1953.6,2167.9,2476.1
14D30,14,4.20537595,"Crestmont, Edgewood, Bellfort Park, Inwood Terrace and Southpark",21000,Theft,334,319,268,104,258,921,307,-19.8,-22.8,-3.7,-16,1590.5,1519,1276.2,1228.6,1461.9
14D40,14,6.61224595,"South Acres, Shamrock Manor, Hillwood and Cloverland",21000,Theft,376,358,317,112,307,1051,350.3,-15.7,-18.4,-3.2,-12,1790.5,1704.8,1509.5,1461.9,1668.1
14D50,14,8.69627992,"Golden Glade Estates, Langston and Almeda Genoa",9000,Theft,186,173,144,73,148,503,167.7,-22.6,-20.4,2.8,-12,2066.7,1922.2,1600,1644.4,1863.3
15E10,15,4.34996776,"Meyerland Plaza, Robindell, Meyerland, Braeburn Terrace and Maplewood South",24000,Theft,654,680,524,228,529,1858,619.3,-19.9,-19.1,1,-15,2725,2833.3,2183.3,2204.2,2580.4
15E20,15,3.58384499,"Westbury, Park West and Willow Creek",18000,Theft,319,439,349,139,313,1107,369,9.4,-1.9,-10.3,-15,1772.2,2438.9,1938.9,1738.9,2050
15E30,15,6.29133294,"Meyer Park, Post Oak Manor, Westwood, Willow Bend and Linkwood",34000,Theft,997,873,763,366,803,2633,877.7,-23.5,-19.5,5.2,-9,2932.4,2567.6,2244.1,2361.8,2581.5
15E40,15,10.0079174,"The Astrodome, Six Flags Astroworld, Lakes at 610 and Plaza del Oro",30000,Theft,1639,1402,1560,902,1849,4601,1533.7,-4.8,12.8,18.5,21,5463.3,4673.3,5200,6163.3,5112.3
16E10,16,5.38940818,Canterbury Village and Monarch Estates,15000,Theft,315,228,209,109,253,752,250.7,-33.7,-19.7,21.1,1,2100,1520,1393.3,1686.7,1671.3
16E20,16,8.15202134,"Almeda Plaza, South Glen, Dumbarton Oaks and Briarwick",35000,Theft,579,453,529,261,587,1561,520.3,-8.6,1.4,11,13,1654.3,1294.3,1511.4,1677.1,1486.6
16E30,16,7.00932789,"Greenpark, Southwest Crossing and Windsor Village",22000,Theft,449,460,430,199,433,1339,446.3,-4.2,-3.6,0.7,-3,2040.9,2090.9,1954.5,1968.2,2028.6
16E40,16,7.49721482,"Chasewood, Willowpark, Briarwick, Ridgemont and Quail Run",35000,Theft,440,383,427,185,406,1250,416.7,-3,-7.7,-4.9,-3,1257.1,1094.3,1220,1160,1190.6
17E10,17,3.3104034,"Southwest Memorial Hospital, Burnett Bayland Park and Westmoreland",51000,Theft,1246,1091,1109,430,1106,3446,1148.7,-11,-11.2,-0.3,-4,2443.1,2139.2,2174.5,2168.6,2252.4
17E20,17,3.92767309,the Houston Baptist University area and Maplewood West,27000,Theft,478,529,459,206,478,1466,488.7,-4,0,4.1,-2,1770.4,1959.3,1700,1770.4,1810
17E30,17,3.8060455,Braeburn Valley West and Glenshire,21000,Theft,516,704,548,273,550,1768,589.3,6.2,6.6,0.4,-7,2457.1,3352.4,2609.5,2619,2806.2
17E40,17,4.70920035,"Creekbend, Southwood and Fondren Southwest",46000,Theft,922,950,892,330,866,2764,921.3,-3.3,-6.1,-2.9,-6,2004.3,2065.2,1939.1,1882.6,2002.8
18F10,18,1.95881352,"Saddlebrook, Bayou Woods and Sherwood Forest",7000,Theft,167,179,183,88,206,529,176.3,9.6,23.4,12.6,17,2385.7,2557.1,2614.3,2942.9,2518.6
18F20,18,3.51641691,"The Galleria, Tanglewood, Riverway and Post Oak",24000,Theft,1969,1889,2060,1000,2238,5918,1972.7,4.6,13.7,8.6,13,8204.2,7870.8,8583.3,9325,8219.6
18F30,18,3.80008564,"The Richmond Strip, Briargrove, Post Oak Estates and Westhaven",36000,Theft,1309,1194,1387,656,1451,3890,1296.7,6,10.8,4.6,12,3636.1,3316.7,3852.8,4030.6,3601.9
18F40,18,2.9060249,"Rosewood General Hospital, Woodlake and Briarmeadow",35000,Theft,1352,1454,1469,613,1455,4275,1425,8.7,7.6,-1,2,3862.9,4154.3,4197.1,4157.1,4071.4
18F50,18,2.96939217,"Tanglewild, Sharpstown Mall and Regency Square",20000,Theft,891,891,1066,472,1108,2848,949.3,19.6,24.4,3.9,17,4455,4455,5330,5540,4746.5
18F60,18,3.62528697,Sharpstown Country Club and Southway Center,28000,Theft,633,631,663,293,714,1927,642.3,4.7,12.8,7.7,11,2260.7,2253.6,2367.9,2550,2293.9
19G10,19,2.74020376,Concourse South and Westwood Mall,31000,Theft,984,1232,1226,485,1195,3442,1147.3,24.6,21.4,-2.5,4,3174.2,3974.2,3954.8,3854.8,3701
19G20,19,3.29219023,"Catalina Square, Bellaire West, Imperial Point",25000,Theft,566,533,386,196,418,1485,495,-31.8,-26.1,8.3,-16,2264,2132,1544,1672,1980
19G30,19,2.49064202,"Rodeo Square, Wildflower Green, Braewood Glen",18000,Theft,309,317,272,86,230,898,299.3,-12,-25.6,-15.4,-23,1716.7,1761.1,1511.1,1277.8,1662.8
19G40,19,4.56425364,"Huntington Village, Wellington Park, Leawood, Keegans Glen",37000,Theft,656,679,544,244,571,1879,626.3,-17.1,-13,5,-9,1773,1835.1,1470.3,1543.2,1692.7
19G50,19,2.30578624,"Forum Park, Stancliff and Southwest Park",18000,Theft,406,580,525,194,500,1511,503.7,29.3,23.2,-4.8,-1,2255.6,3222.2,2916.7,2777.8,2798.3
20G10,20,3.06600809,"Westchase, Woodchase Village and Point West",29000,Theft,905,942,986,428,1046,2833,944.3,9,15.6,6.1,11,3120.7,3248.3,3400,3606.9,3256.2
20G20,20,3.27621655,"Lakeside Estates, City West Place, Rivercrest and Briargrove Park",18000,Theft,370,425,356,152,345,1151,383.7,-3.8,-6.8,-3.1,-10,2055.6,2361.1,1977.8,1916.7,2131.7
20G30,20,3.97953501,"West Houston Medical Center, Andrau Airport, Westchase and Westchase Mall",26000,Theft,1243,1123,1074,449,1115,3440,1146.7,-13.6,-10.3,3.8,-3,4780.8,4319.2,4130.8,4288.5,4410.4
20G40,20,4.16594899,"Lakeview Forest, Lakeside Place, Ashford Village and Southlake",28000,Theft,733,717,636,258,638,2086,695.3,-13.2,-13,0.3,-8,2617.9,2560.7,2271.4,2278.6,2483.2
20G70,20,2.38283582,Westpark Village and Ashford Point,21000,Theft,376,401,422,173,415,1199,399.7,12.2,10.4,-1.7,4,1790.5,1909.5,2009.5,1976.2,1903.3
20G80,20,25.33626534,City Limits,37000,Theft,837,791,868,377,918,2496,832,3.7,9.7,5.8,10,2262.2,2137.8,2345.9,2481.1,2248.6
21I10,21,0.00549966,Hobby Airport,0,Theft,258,133,165,82,177,556,185.3,-36,-31.4,7.3,-4,NA,NA,NA,NA,NA
21I20,21,0.01205019,Hobby Airport,0,Theft,3,0,6,1,3,9,3,100,0,-50,0,NA,NA,NA,NA,NA
21I30,21,0.01180375,Hobby Airport,0,Theft,7,2,2,0,2,11,3.7,-71.4,-71.4,0,-46,NA,NA,NA,NA,NA
21I40,21,0.00923163,Hobby Airport,0,Theft,15,6,2,2,3,23,7.7,-86.7,-80,50,-61,NA,NA,NA,NA,NA
21I50,21,14.61100076,Hobby Airport,0,Theft,333,166,241,142,307,740,246.7,-27.6,-7.8,27.4,24,NA,NA,NA,NA,NA
21I70,21,0.01945113,Hobby Airport,0,Theft,5,1,2,1,2,8,2.7,-60,-60,0,-26,NA,NA,NA,NA,NA
22B10,22,3.28874287,"Willowbrook, Willow Chase Park and Centerfield",8000,Theft,1384,1117,1407,653,1517,3908,1302.7,1.7,9.6,7.8,16,17300,13962.5,17587.5,18962.5,16283.8
5F20,5,5.94082911,Spring Branch and Schwartz Park,42000,Theft,668,722,697,304,711,2087,695.7,4.3,6.4,2,2,1590.5,1719,1659.5,1692.9,1656.4
4F10,4,4.13606469,"Timber Oaks, Shadow Oaks and Long Point Acres",23000,Theft,731,795,726,338,769,2252,750.7,-0.7,5.2,5.9,2,3178.3,3456.5,3156.5,3343.5,3263.9
20G50,20,5.88593521,"Nottingham, Yorkshire, Wilchester, Town and Country Village and Memorial City Shopping Center",30000,Theft,1422,1133,1103,568,1239,3658,1219.3,-22.4,-12.9,12.3,2,4740,3776.7,3676.7,4130,4064.3
4F20,4,5.85840284,"Claymore Park, Westbranch, Spring Shadows and Kempwood Forest",28000,Theft,580,510,559,274,625,1649,549.7,-3.6,7.8,11.8,14,2071.4,1821.4,1996.4,2232.1,1963.2
20G60,20,4.54207617,"Barkers Landing, Fleetwood, Thornwood and Darrel Tully Stadium",23000,Theft,709,670,690,300,723,2069,689.7,-2.7,2,4.8,5,3082.6,2913,3000,3143.5,2998.7
4F30,4,26.30690179,"Addicks Reservoir Area, Claymore Park, Brittmore Village, Park Ten Place and Mayde Creek Farms",18000,Theft,683,703,782,350,826,2168,722.7,14.5,20.9,5.6,14,3794.4,3905.6,4344.4,4588.9,4015
24C10,24,5.44044978,Kingwood,13000,Theft,194,172,152,68,160,518,172.7,-21.6,-17.5,5.3,-7,1492.3,1323.1,1169.2,1230.8,1328.5
24C20,24,6.8291794,Kingwood,18000,Theft,152,154,129,59,146,435,145,-15.1,-3.9,13.2,1,844.4,855.6,716.7,811.1,805.6
24C30,24,9.78735527,Kingwood,29000,Theft,195,173,156,94,181,524,174.7,-20,-7.2,16,4,672.4,596.6,537.9,624.1,602.4
24C40,24,35.7992771,Kingwood,6000,Theft,51,69,67,23,65,187,62.3,31.4,27.5,-3,4,850,1150,1116.7,1083.3,1038.3
24C50,24,7.51791807,Kingwood,5000,Theft,197,364,384,174,404,945,315,94.9,105.1,5.2,28,3940,7280,7680,8080,6300
24C60,24,4.86823328,Kingwood,21000,Theft,66,64,58,25,61,188,62.7,-12.1,-7.6,5.2,-3,314.3,304.8,276.2,290.5,298.6
21I60,21,0.01236886,Hobby Airport,0,Theft,40,22,16,6,17,78,26,-60,-57.5,6.2,-35,NA,NA,NA,NA,NA
HCC5,NA,NA,NA,NA,Theft,3,0,2,0,1,5,1.7,-33.3,-66.7,-50,-41,NA,NA,NA,NA,NA
HCC7,NA,NA,NA,NA,Theft,2,9,0,0,0,11,3.7,-100,-100,NA,-100,NA,NA,NA,NA,NA
HCSO,NA,NA,NA,NA,Theft,130,121,13,4,9,264,88,-90,-93.1,-30.8,-90,NA,NA,NA,NA,NA
OOJ,NA,NA,NA,NA,Theft,184,141,18,12,21,343,114.3,-90.2,-88.6,16.7,-82,NA,NA,NA,NA,NA
Unknown,NA,NA,NA,NA,Theft,35,23,9,9,17,67,22.3,-74.3,-51.4,88.9,-24,NA,NA,NA,NA,NA
