beat,district,area_sq_mi,placename,population,type,total19,total20,total21,total22,last12mos,total_prior3years,avg_prior3years,inc_19to21,inc_19tolast12,inc_21tolast12,inc_prior3yearavgtolast12,rate19,rate20,rate21,rate_last12,rate_prior3years
23J40,23,3.03933481,Intercontinental Airport,0,Violent,0,0,0,2,2,0,0,NA,NA,NA,NA,NA,NA,NA,NA,NA
23J50,23,2.12389492,Intercontinental Airport,0,Violent,20,18,23,12,26,61,20.3,15,30,13,28,NA,NA,NA,NA,NA
1A10,1,1.74646692,Downtown Central Business District,17359,Violent,851,596,697,200,727,2144,714.7,-18.1,-14.6,4.3,2,4902.4,3433.4,4015.2,4188,4117.2
1A20,1,2.44133075,"Fourth Ward, Avondale and Westmoreland",27449,Violent,647,573,704,248,722,1924,641.3,8.8,11.6,2.6,13,2357.1,2087.5,2564.8,2630.3,2336.3
1A30,1,2.65916892,"Cherryhurst, Mandell Place and Montrose",26972,Violent,388,361,302,106,315,1051,350.3,-22.2,-18.8,4.3,-10,1438.5,1338.4,1119.7,1167.9,1298.8
1A40,1,2.45016686,"Tall Timbers, Royden Oaks, River Oaks, Avalon Place and Oak Estates",6765,Violent,30,23,34,11,31,87,29,13.3,3.3,-8.8,7,443.5,340,502.6,458.2,428.7
1A50,1,3.04553452,"Post Oak Park, Afton Oaks, Highland Village, Weslayan, Greenway Plaza and The Compaq Center",26355,Violent,284,335,363,102,341,982,327.3,27.8,20.1,-6.1,4,1077.6,1271.1,1377.3,1293.9,1241.9
2A10,2,3.30928608,Irvington and Ryon,18357,Violent,743,702,579,187,585,2024,674.7,-22.1,-21.3,1,-13,4047.5,3824.2,3154.1,3186.8,3675.4
2A20,2,1.8876461,"Sunset Heights, Brooksmith and Stude",10730,Violent,286,309,233,67,233,828,276,-18.5,-18.5,0,-16,2665.4,2879.8,2171.5,2171.5,2572.2
2A30,2,4.65858171,"Houston Heights, Norhill and Studemont",30794,Violent,281,243,232,78,229,756,252,-17.4,-18.5,-1.3,-9,912.5,789.1,753.4,743.7,818.3
2A40,2,1.60546103,Old Sixth Ward and the First Ward,7770,Violent,121,126,128,43,137,375,125,5.8,13.2,7,10,1557.3,1621.6,1647.4,1763.2,1608.8
2A50,2,5.4659844,"Memorial Park, West End, Ashbury and Cottage Grove",28700,Violent,354,307,413,111,407,1074,358,16.7,15,-1.5,14,1233.4,1069.7,1439,1418.1,1247.4
2A60,2,4.67447346,"Westport, Holly Park, Lazy Brook, Citadel, Shady Acres and Timbergrove",21326,Violent,212,206,241,75,241,659,219.7,13.7,13.7,0,10,994.1,966,1130.1,1130.1,1030.2
3B10,3,6.82068773,"Northwest Mall, Brookhollow, White Oak Acres, Oak Forest and Langwood",33931,Violent,957,1055,1016,320,1014,3028,1009.3,6.2,6,-0.2,0,2820.4,3109.3,2994.3,2988.4,2974.6
3B30,3,5.310372,"White Oak Acres, Brook Hollow, Oak Forest, Garden Oaks and Shepherd Park Plaza",23113,Violent,221,230,227,71,233,678,226,2.7,5.4,2.6,3,956.2,995.1,982.1,1008.1,977.8
3B40,3,3.40013561,"Independence Heights, Melrose and Graceland",13257,Violent,651,659,619,157,589,1929,643,-4.9,-9.5,-4.8,-8,4910.6,4971,4669.2,4442.9,4850.3
3B50,3,3.85259517,"Northline Mall, Stratton Place, Oakwood, Colonial Gardens, Lindale and Junction City",19512,Violent,790,782,732,214,725,2304,768,-7.3,-8.2,-1,-6,4048.8,4007.8,3751.5,3715.7,3936
5F10,5,3.25978513,Afton Village and Pine Terrace,13902,Violent,292,248,287,99,317,827,275.7,-1.7,8.6,10.5,15,2100.4,1783.9,2064.5,2280.2,1983.2
5F30,5,8.70689439,"Fairbanks, Carverdale, Fawndale and Northwest Crossing",16828,Violent,686,719,737,234,751,2142,714,7.4,9.5,1.9,5,4076.5,4272.6,4379.6,4462.8,4242.9
6B10,6,5.50084827,"York Plaza, Pembrook Place and Hawthorne Place",33440,Violent,919,1001,1002,264,974,2922,974,9,6,-2.8,0,2748.2,2993.4,2996.4,2912.7,2912.7
6B20,6,6.12869477,"Highland Heights, Oakdale and Melrose Gardens",18199,Violent,783,822,669,208,658,2274,758,-14.6,-16,-1.6,-13,4302.4,4516.7,3676,3615.6,4165.1
6B30,6,7.2300685,"Woodland Trails, Oaks of Inwood, Bayou Bend, Cole Creek Manor and Inwood Forest",37617,Violent,1026,1071,887,274,862,2984,994.7,-13.5,-16,-2.8,-13,2727.5,2847.1,2358,2291.5,2644.3
6B40,6,5.544689,"Highland Gardens, Highland Heights and North Plaza",20476,Violent,914,1025,852,229,753,2791,930.3,-6.8,-17.6,-11.6,-19,4463.8,5005.9,4161,3677.5,4543.4
22B30,22,2.8264671,Aldine and Imperial Valley,18502,Violent,713,640,647,200,624,2000,666.7,-9.3,-12.5,-3.6,-6,3853.6,3459.1,3496.9,3372.6,3603.4
22B20,22,4.61158268,Greenspoint,24000,Violent,1488,1580,1388,400,1309,4456,1485.3,-6.7,-12,-5.7,-12,6200,6583.3,5783.3,5454.2,6188.8
7C10,7,3.47828324,"Fifth Ward, North Park and Pinecrest",12524,Violent,647,674,563,199,585,1884,628,-13,-9.6,3.9,-7,5166.1,5381.7,4495.4,4671,5014.4
7C20,7,7.08575157,"Huntington Place, Willshire Place, Kashmere Gardens and Liberty Gardens",21312,Violent,1437,1363,1250,390,1254,4050,1350,-13,-12.7,0.3,-7,6742.7,6395.5,5865.2,5884,6334.5
7C30,7,4.51719841,"Camden Woods, Archers Acres and Croyden Gardens",18012,Violent,697,770,800,181,708,2267,755.7,14.8,1.6,-11.5,-6,3869.6,4274.9,4441.5,3930.7,4195.5
7C40,7,3.36786526,Keith-Weiss Park and Farrington Place,8126,Violent,246,225,219,58,208,690,230,-11,-15.4,-5,-10,3027.3,2768.9,2695.1,2559.7,2830.4
22B40,22,13.03325001,"Intercontinental Airport, Northwood, Lakeview Park and Glen Lee",11438,Violent,373,385,490,152,487,1248,416,31.4,30.6,-0.6,17,3261.1,3366,4284,4257.7,3637
8C10,8,3.69037316,"Tidwell Park, Shady Oak and Buckingham Place",11828,Violent,761,817,711,249,749,2289,763,-6.6,-1.6,5.3,-2,6433.9,6907.3,6011.2,6332.4,6450.8
8C20,8,3.36154214,"Houston Gardens, Rosewood and Homestead",7247,Violent,281,312,297,82,273,890,296.7,5.7,-2.8,-8.1,-8,3877.5,4305.2,4098.2,3767.1,4094.1
8C30,8,4.6258259,"Parkhurst, East Houston and Clairmont Place",10545,Violent,378,499,419,115,394,1296,432,10.8,4.2,-6,-9,3584.6,4732.1,3973.4,3736.4,4096.7
8C40,8,4.97945551,"Lake Houston, Greenriver, Knoll and Lake Forest",7607,Violent,176,202,175,39,159,553,184.3,-0.6,-9.7,-9.1,-14,2313.7,2655.4,2300.5,2090.2,2422.8
8C50,8,3.31739498,"Park North, Forest Green, Kentshire Place, Glenwood Forest and Dorchester",8133,Violent,443,475,430,107,396,1348,449.3,-2.9,-10.6,-7.9,-12,5446.9,5840.4,5287.1,4869.1,5524.4
8C60,8,5.79693312,"Edgeworth, Northwood Manor and Scenic Woods",19229,Violent,639,713,545,164,541,1897,632.3,-14.7,-15.3,-0.7,-14,3323.1,3707.9,2834.3,2813.5,3288.3
9C10,9,5.21185619,"Port of Houston, Clinton Park, Pleasantville and Fidelity Manor",5597,Violent,180,216,171,36,154,567,189,-5,-14.4,-9.9,-19,3216,3859.2,3055.2,2751.5,3376.8
9C20,9,7.5383173,Denver Harbor and Houston Harbor,15752,Violent,402,447,348,114,342,1197,399,-13.4,-14.9,-1.7,-14,2552.1,2837.7,2209.2,2171.2,2533
9C30,9,8.13353768,"City Park East, Wynnewood Acres and Wallisville Gardens",9165,Violent,222,293,278,86,267,793,264.3,25.2,20.3,-4,1,2422.3,3196.9,3033.3,2913.3,2883.8
9C40,9,10.42549456,"Greens Bayou Estates, Shady Brook, Northshore",22769,Violent,766,764,696,184,667,2226,742,-9.1,-12.9,-4.2,-10,3364.2,3355.4,3056.8,2929.4,3258.8
10H10,10,2.81830654,Oak Lawn and Ranger,11304,Violent,315,271,259,71,245,845,281.7,-17.8,-22.2,-5.4,-13,2786.6,2397.4,2291.2,2167.4,2492
10H20,10,1.75743169,Eastwood and Broadmoor,10142,Violent,190,200,197,82,200,587,195.7,3.7,5.3,1.5,2,1873.4,1972,1942.4,1972,1929.6
10H30,10,1.02691154,Near East End,4160,Violent,171,158,173,52,167,502,167.3,1.2,-2.3,-3.5,-0,4110.6,3798.1,4158.7,4014.4,4021.6
10H40,10,0.99627062,Midtown,8194,Violent,751,638,567,192,575,1956,652,-24.5,-23.4,1.4,-12,9165.2,7786.2,6919.7,7017.3,7957
10H50,10,2.30843079,the University of Houston area,12867,Violent,753,691,609,205,600,2053,684.3,-19.1,-20.3,-1.5,-12,5852.2,5370.3,4733,4663.1,5318.3
10H60,10,3.08931006,"University Oaks, Riverside Terrace and the Texas Southern University area",20363,Violent,544,520,496,172,524,1560,520,-8.8,-3.7,5.6,1,2671.5,2553.7,2435.8,2573.3,2553.7
10H70,10,3.52217952,"Texas Medical Center, Hermann Park, Houston Zoo and Miller Outdoor Theatre",15650,Violent,421,435,458,136,453,1314,438,8.8,7.6,-1.1,3,2690.1,2779.6,2926.5,2894.6,2798.7
10H80,10,2.73862779,"Southampton, Rice University area, Shadow Lawn and Broad Acres",18584,Violent,120,97,98,31,106,315,105,-18.3,-11.7,8.2,1,645.7,522,527.3,570.4,565
11H10,11,5.31502815,"Mason Park, Forest Hill, Sunnyland and Central Park",27726,Violent,832,957,776,230,760,2565,855,-6.7,-8.7,-2.1,-11,3000.8,3451.6,2798.8,2741.1,3083.7
11H20,11,3.9311161,"Harrisburg, Manchester and Pecan Park",18100,Violent,430,416,432,106,391,1278,426,0.5,-9.1,-9.5,-8,2375.7,2298.3,2386.7,2160.2,2353.6
11H30,11,2.84278059,Meadow Brook and Park Place,15237,Violent,404,481,409,148,435,1294,431.3,1.2,7.7,6.4,1,2651.4,3156.8,2684.3,2854.9,2830.6
11H40,11,6.14001938,Allendale and Oak Meadows,8423,Violent,107,142,119,30,99,368,122.7,11.2,-7.5,-16.8,-19,1270.3,1685.9,1412.8,1175.4,1456.7
11H50,11,2.09534157,"Meadow Creek, Ferndale Addition and Glenbrook Industrial",7615,Violent,147,189,195,67,191,531,177,32.7,29.9,-2.1,8,1930.4,2481.9,2560.7,2508.2,2324.4
12D10,12,8.55384717,"Almeda Mall, Southridge, Edgebrook and South Houston Gardens",43826,Violent,1097,1337,1378,458,1405,3812,1270.7,25.6,28.1,2,11,2503.1,3050.7,3144.3,3205.9,2899.4
12D20,12,3.83700574,Sage,22428,Violent,359,427,375,121,383,1161,387,4.5,6.7,2.1,-1,1600.7,1903.9,1672,1707.7,1725.5
12D30,12,3.99301158,Gulf Palms and Beamer,14676,Violent,201,206,204,47,192,611,203.7,1.5,-4.5,-5.9,-6,1369.6,1403.7,1390,1308.3,1388
12D40,12,9.68663455,Scarsdale and Ellington Field,10667,Violent,252,272,244,77,232,768,256,-3.2,-7.9,-4.9,-9,2362.4,2549.9,2287.4,2174.9,2399.9
12D50,12,8.93327581,"Bay Glen, Bay Oaks, Brook Forest and Bay Forest",25606,Violent,96,80,94,29,91,270,90,-2.1,-5.2,-3.2,1,374.9,312.4,367.1,355.4,351.5
12D60,12,6.35832041,"NASA's Johnson Space Center, Meadow Green, Oakbrook West and Camino South",22499,Violent,199,269,242,69,245,710,236.7,21.6,23.1,1.2,4,884.5,1195.6,1075.6,1088.9,1052
12D70,12,5.39156317,Baybrook Mall and Sterling Knoll,11955,Violent,223,255,221,67,217,699,233,-0.9,-2.7,-1.8,-7,1865.3,2133,1848.6,1815.1,1949
13D10,13,5.2433708,"Gulfgate Mall, Bay Forest, Riverview, Hampshire, Golfcrest and Barnett Stadium",23207,Violent,677,668,592,209,616,1937,645.7,-12.6,-9,4.1,-5,2917.2,2878.4,2551,2654.4,2782.4
13D20,13,6.66870859,"Fairlawn, Garden Villas, Glenbrook Valley and Santa Rosa",36151,Violent,1149,1148,918,332,916,3215,1071.7,-20.1,-20.3,-0.2,-15,3178.3,3175.6,2539.3,2533.8,2964.5
13D30,13,3.07402543,"Allen Farms, Airport Gardens and the Hobby Airport area",1524,Violent,46,37,35,15,36,118,39.3,-23.9,-21.7,2.9,-8,3018.4,2427.8,2296.6,2362.2,2578.7
13D40,13,5.0688163,"Val Verde East, Gulf Meadows and Houston Skyscraper Shadows",13362,Violent,166,222,183,59,173,571,190.3,10.2,4.2,-5.5,-9,1242.3,1661.4,1369.6,1294.7,1424.2
14D10,14,3.66057918,McGregor Terrace and Riverside Terrace,17296,Violent,1038,1096,892,263,852,3026,1008.7,-14.1,-17.9,-4.5,-16,6001.4,6336.7,5157.3,4926,5832
14D20,14,7.25646368,"Blueridge, Sunnyside, Brook Haven and Bayou Estates",28038,Violent,1691,1763,1512,484,1468,4966,1655.3,-10.6,-13.2,-2.9,-11,6031.1,6287.9,5392.7,5235.8,5903.8
14D30,14,4.20537595,"Crestmont, Edgewood, Bellfort Park, Inwood Terrace and Southpark",20724,Violent,821,750,660,223,612,2231,743.7,-19.6,-25.5,-7.3,-18,3961.6,3619,3184.7,2953.1,3588.6
14D40,14,6.61224595,"South Acres, Shamrock Manor, Hillwood and Cloverland",20619,Violent,622,667,604,206,624,1893,631,-2.9,0.3,3.3,-1,3016.6,3234.9,2929.3,3026.3,3060.3
14D50,14,8.69627992,"Golden Glade Estates, Langston and Almeda Genoa",9247,Violent,196,247,245,88,254,688,229.3,25,29.6,3.7,11,2119.6,2671.1,2649.5,2746.8,2479.7
15E10,15,4.34996776,"Meyerland Plaza, Robindell, Meyerland, Braeburn Terrace and Maplewood South",24186,Violent,328,359,424,117,408,1111,370.3,29.3,24.4,-3.8,10,1356.2,1484.3,1753.1,1686.9,1531.1
15E20,15,3.58384499,"Westbury, Park West and Willow Creek",17754,Violent,265,323,244,71,218,832,277.3,-7.9,-17.7,-10.7,-21,1492.6,1819.3,1374.3,1227.9,1561.9
15E30,15,6.29133294,"Meyer Park, Post Oak Manor, Westwood, Willow Bend and Linkwood",34338,Violent,376,422,436,152,438,1234,411.3,16,16.5,0.5,6,1095,1229,1269.7,1275.6,1197.8
15E40,15,10.0079174,"The Astrodome, Six Flags Astroworld, Lakes at 610 and Plaza del Oro",30317,Violent,943,882,1052,342,1076,2877,959,11.6,14.1,2.3,12,3110.5,2909.3,3470,3549.2,3163.2
16E10,16,5.38940818,Canterbury Village and Monarch Estates,15009,Violent,220,226,202,56,181,648,216,-8.2,-17.7,-10.4,-16,1465.8,1505.8,1345.9,1205.9,1439.1
16E20,16,8.15202134,"Almeda Plaza, South Glen, Dumbarton Oaks and Briarwick",35118,Violent,623,687,675,211,647,1985,661.7,8.3,3.9,-4.1,-2,1774,1956.3,1922.1,1842.4,1884.2
16E30,16,7.00932789,"Greenpark, Southwest Crossing and Windsor Village",21532,Violent,498,491,451,145,448,1440,480,-9.4,-10,-0.7,-7,2312.8,2280.3,2094.6,2080.6,2229.2
16E40,16,7.49721482,"Chasewood, Willowpark, Briarwick, Ridgemont and Quail Run",35307,Violent,585,654,610,190,607,1849,616.3,4.3,3.8,-0.5,-2,1656.9,1852.3,1727.7,1719.2,1745.5
17E10,17,3.3104034,"Southwest Memorial Hospital, Burnett Bayland Park and Westmoreland",51281,Violent,1377,1498,1374,444,1376,4249,1416.3,-0.2,-0.1,0.1,-3,2685.2,2921.2,2679.4,2683.3,2761.8
17E20,17,3.92767309,the Houston Baptist University area and Maplewood West,26917,Violent,582,608,591,182,607,1781,593.7,1.5,4.3,2.7,2,2162.2,2258.8,2195.6,2255.1,2205.7
17E30,17,3.8060455,Braeburn Valley West and Glenshire,21251,Violent,620,748,556,193,557,1924,641.3,-10.3,-10.2,0.2,-13,2917.5,3519.8,2616.3,2621.1,3017.7
17E40,17,4.70920035,"Creekbend, Southwood and Fondren Southwest",45632,Violent,1352,1381,1304,410,1264,4037,1345.7,-3.6,-6.5,-3.1,-6,2962.8,3026.4,2857.6,2770,2949
18F10,18,1.95881352,"Saddlebrook, Bayou Woods and Sherwood Forest",7322,Violent,80,72,73,32,83,225,75,-8.8,3.8,13.7,11,1092.6,983.3,997,1133.6,1024.3
18F20,18,3.51641691,"The Galleria, Tanglewood, Riverway and Post Oak",23875,Violent,411,424,476,164,506,1311,437,15.8,23.1,6.3,16,1721.5,1775.9,1993.7,2119.4,1830.4
18F30,18,3.80008564,"The Richmond Strip, Briargrove, Post Oak Estates and Westhaven",35589,Violent,810,922,886,263,852,2618,872.7,9.4,5.2,-3.8,-2,2276,2590.7,2489.5,2394,2452.2
18F40,18,2.9060249,"Rosewood General Hospital, Woodlake and Briarmeadow",34762,Violent,879,1003,976,344,990,2858,952.7,11,12.6,1.4,4,2528.6,2885.3,2807.7,2847.9,2740.6
18F50,18,2.96939217,"Tanglewild, Sharpstown Mall and Regency Square",20389,Violent,690,710,810,259,805,2210,736.7,17.4,16.7,-0.6,9,3384.2,3482.3,3972.7,3948.2,3613.2
18F60,18,3.62528697,Sharpstown Country Club and Southway Center,27923,Violent,577,579,579,150,519,1735,578.3,0.3,-10.1,-10.4,-10,2066.4,2073.6,2073.6,1858.7,2071.1
19G10,19,2.74020376,Concourse South and Westwood Mall,30517,Violent,1231,1296,1237,418,1276,3764,1254.7,0.5,3.7,3.2,2,4033.8,4246.8,4053.5,4181.3,4111.5
19G20,19,3.29219023,"Catalina Square, Bellaire West, Imperial Point",24940,Violent,456,442,478,92,413,1376,458.7,4.8,-9.4,-13.6,-10,1828.4,1772.3,1916.6,1656,1839.2
19G30,19,2.49064202,"Rodeo Square, Wildflower Green, Braewood Glen",18412,Violent,308,282,308,87,284,898,299.3,0,-7.8,-7.8,-5,1672.8,1531.6,1672.8,1542.5,1625.6
19G40,19,4.56425364,"Huntington Village, Wellington Park, Leawood, Keegans Glen",37045,Violent,795,783,775,237,765,2353,784.3,-2.5,-3.8,-1.3,-2,2146,2113.6,2092.1,2065.1,2117.2
19G50,19,2.30578624,"Forum Park, Stancliff and Southwest Park",17516,Violent,695,649,644,175,603,1988,662.7,-7.3,-13.2,-6.4,-9,3967.8,3705.2,3676.6,3442.6,3783.4
20G10,20,3.06600809,"Westchase, Woodchase Village and Point West",28775,Violent,820,948,867,306,901,2635,878.3,5.7,9.9,3.9,3,2849.7,3294.5,3013,3131.2,3052.3
20G20,20,3.27621655,"Lakeside Estates, City West Place, Rivercrest and Briargrove Park",18353,Violent,274,305,260,72,233,839,279.7,-5.1,-15,-10.4,-17,1492.9,1661.9,1416.7,1269.5,1524
20G30,20,3.97953501,"West Houston Medical Center, Andrau Airport, Westchase and Westchase Mall",26103,Violent,781,850,792,287,806,2423,807.7,1.4,3.2,1.8,-0,2992,3256.3,3034.1,3087.8,3094.3
20G40,20,4.16594899,"Lakeview Forest, Lakeside Place, Ashford Village and Southlake",27946,Violent,573,523,594,212,641,1690,563.3,3.7,11.9,7.9,14,2050.4,1871.5,2125.5,2293.7,2015.7
20G70,20,2.38283582,Westpark Village and Ashford Point,20787,Violent,428,481,462,165,487,1371,457,7.9,13.8,5.4,7,2059,2313.9,2222.5,2342.8,2198.5
20G80,20,25.33626534,City Limits,37327,Violent,474,547,571,192,566,1592,530.7,20.5,19.4,-0.9,7,1269.9,1465.4,1529.7,1516.3,1421.8
21I10,21,0.00549966,Hobby Airport,0,Violent,17,9,29,5,24,55,18.3,70.6,41.2,-17.2,31,NA,NA,NA,NA,NA
21I20,21,0.01205019,Hobby Airport,0,Violent,0,0,0,1,1,0,0,NA,NA,NA,NA,NA,NA,NA,NA,NA
21I40,21,0.00923163,Hobby Airport,0,Violent,3,2,2,3,5,7,2.3,-33.3,66.7,150,117,NA,NA,NA,NA,NA
21I50,21,14.61100076,Hobby Airport,0,Violent,68,49,62,21,70,179,59.7,-8.8,2.9,12.9,17,NA,NA,NA,NA,NA
22B10,22,3.28874287,"Willowbrook, Willow Chase Park and Centerfield",8046,Violent,375,401,375,116,377,1151,383.7,0,0.5,0.5,-2,4660.7,4983.8,4660.7,4685.6,4768.8
5F20,5,5.94082911,Spring Branch and Schwartz Park,41925,Violent,795,874,871,215,805,2540,846.7,9.6,1.3,-7.6,-5,1896.2,2084.7,2077.5,1920.1,2019.6
4F10,4,4.13606469,"Timber Oaks, Shadow Oaks and Long Point Acres",22505,Violent,423,406,397,112,384,1226,408.7,-6.1,-9.2,-3.3,-6,1879.6,1804,1764.1,1706.3,1816
20G50,20,5.88593521,"Nottingham, Yorkshire, Wilchester, Town and Country Village and Memorial City Shopping Center",30070,Violent,214,207,235,59,210,656,218.7,9.8,-1.9,-10.6,-4,711.7,688.4,781.5,698.4,727.3
4F20,4,5.85840284,"Claymore Park, Westbranch, Spring Shadows and Kempwood Forest",27918,Violent,390,365,372,132,401,1127,375.7,-4.6,2.8,7.8,7,1396.9,1307.4,1332.5,1436.3,1345.7
20G60,20,4.54207617,"Barkers Landing, Fleetwood, Thornwood and Darrel Tully Stadium",22500,Violent,254,325,314,89,277,893,297.7,23.6,9.1,-11.8,-7,1128.9,1444.4,1395.6,1231.1,1323.1
4F30,4,26.30690179,"Addicks Reservoir Area, Claymore Park, Brittmore Village, Park Ten Place and Mayde Creek Farms",17589,Violent,274,307,316,76,277,897,299,15.3,1.1,-12.3,-7,1557.8,1745.4,1796.6,1574.8,1699.9
24C10,24,5.44044978,Kingwood,13401,Violent,105,141,106,36,107,352,117.3,1,1.9,0.9,-9,783.5,1052.2,791,798.4,875.3
24C20,24,6.8291794,Kingwood,17897,Violent,79,96,113,40,112,288,96,43,41.8,-0.9,17,441.4,536.4,631.4,625.8,536.4
24C30,24,9.78735527,Kingwood,28717,Violent,101,88,97,22,85,286,95.3,-4,-15.8,-12.4,-11,351.7,306.4,337.8,296,331.9
24C40,24,35.7992771,Kingwood,6374,Violent,59,64,78,24,83,201,67,32.2,40.7,6.4,24,925.6,1004.1,1223.7,1302.2,1051.1
24C50,24,7.51791807,Kingwood,5184,Violent,79,90,84,38,98,253,84.3,6.3,24.1,16.7,16,1523.9,1736.1,1620.4,1890.4,1626.2
24C60,24,4.86823328,Kingwood,21021,Violent,57,40,55,9,50,152,50.7,-3.5,-12.3,-9.1,-1,271.2,190.3,261.6,237.9,241.2
21I60,21,0.01236886,Hobby Airport,0,Violent,6,1,4,7,8,11,3.7,-33.3,33.3,100,116,NA,NA,NA,NA,NA
HCC1,NA,NA,NA,NA,Violent,0,1,0,0,0,1,0.3,NA,NA,NA,-100,NA,NA,NA,NA,NA
HCC5,NA,NA,NA,NA,Violent,1,0,0,0,0,1,0.3,-100,-100,NA,-100,NA,NA,NA,NA,NA
HCC7,NA,NA,NA,NA,Violent,1,10,0,0,0,11,3.7,-100,-100,NA,-100,NA,NA,NA,NA,NA
HCSO,NA,NA,NA,NA,Violent,162,156,18,7,9,336,112,-88.9,-94.4,-50,-92,NA,NA,NA,NA,NA
OOJ,NA,NA,NA,NA,Violent,216,169,24,7,15,409,136.3,-88.9,-93.1,-37.5,-89,NA,NA,NA,NA,NA
UH-3PD,NA,NA,NA,NA,Violent,0,1,1,0,0,2,0.7,NA,NA,-100,-100,NA,NA,NA,NA,NA
Unknown,NA,NA,NA,NA,Violent,14,10,5,3,6,29,9.7,-64.3,-57.1,20,-38,NA,NA,NA,NA,NA
