beat,district,area_sq_mi,placename,population,category_name,total19,total20,total21,total22,last12mos,total_prior3years,avg_prior3years,inc_19to21,inc_19tolast12,inc_21tolast12,inc_prior3yearavgtolast12,rate19,rate20,rate21,rate_last12,rate_prior3years
23J40,23,3.03933481,Ellington Field,0,Auto Theft,0,0,0,1,1,0,0,NA,NA,NA,NA,NA,NA,NA,NA,NA
23J50,23,2.12389492,Hobby Airport,0,Auto Theft,19,14,32,36,36,65,21.7,68.4,89.5,12.5,66,NA,NA,NA,NA,NA
1A10,1,1.74646692,Downtown Central Business District,17000,Auto Theft,155,146,237,290,308,538,179.3,52.9,98.7,30,72,911.8,858.8,1394.1,1811.8,1054.7
1A20,1,2.44133075,"Fourth Ward, Avondale and Westmoreland",27000,Auto Theft,179,199,264,390,404,642,214,47.5,125.7,53,89,663,737,977.8,1496.3,792.6
1A30,1,2.65916892,"Cherryhurst, Mandell Place and Montrose",27000,Auto Theft,66,97,121,195,205,284,94.7,83.3,210.6,69.4,116,244.4,359.3,448.1,759.3,350.7
1A40,1,2.45016686,"Tall Timbers, Royden Oaks, River Oaks, Avalon Place and Oak Estates",7000,Auto Theft,10,13,14,18,18,37,12.3,40,80,28.6,46,142.9,185.7,200,257.1,175.7
1A50,1,3.04553452,"Post Oak Park, Afton Oaks, Highland Village, Weslayan, Greenway Plaza and The Compaq Center",26000,Auto Theft,140,205,236,325,333,581,193.7,68.6,137.9,41.1,72,538.5,788.5,907.7,1280.8,745
2A10,2,3.30928608,Irvington and Ryon,18000,Auto Theft,70,104,151,108,114,325,108.3,115.7,62.9,-24.5,5,388.9,577.8,838.9,633.3,601.7
2A20,2,1.8876461,"Sunset Heights, Brooksmith and Stude",11000,Auto Theft,58,64,81,93,96,203,67.7,39.7,65.5,18.5,42,527.3,581.8,736.4,872.7,615.5
2A30,2,4.65858171,"Houston Heights, Norhill and Studemont",31000,Auto Theft,128,142,178,248,254,448,149.3,39.1,98.4,42.7,70,412.9,458.1,574.2,819.4,481.6
2A40,2,1.60546103,Old Sixth Ward and the First Ward,8000,Auto Theft,48,56,72,97,102,176,58.7,50,112.5,41.7,74,600,700,900,1275,733.8
2A50,2,5.4659844,"Memorial Park, West End, Ashbury and Cottage Grove",29000,Auto Theft,126,158,212,271,281,496,165.3,68.3,123,32.5,70,434.5,544.8,731,969,570
2A60,2,4.67447346,"Westport, Holly Park, Lazy Brook, Citadel, Shady Acres and Timbergrove",21000,Auto Theft,157,223,195,200,204,575,191.7,24.2,29.9,4.6,6,747.6,1061.9,928.6,971.4,912.9
3B10,3,6.82068773,"Northwest Mall, Brookhollow, White Oak Acres, Oak Forest and Langwood",34000,Auto Theft,360,327,326,388,400,1013,337.7,-9.4,11.1,22.7,18,1058.8,961.8,958.8,1176.5,993.2
3B30,3,5.310372,"White Oak Acres, Brook Hollow, Oak Forest, Garden Oaks and Shepherd Park Plaza",23000,Auto Theft,55,68,55,95,98,178,59.3,0,78.2,78.2,65,239.1,295.7,239.1,426.1,257.8
3B40,3,3.40013561,"Independence Heights, Melrose and Graceland",13000,Auto Theft,118,130,149,137,143,397,132.3,26.3,21.2,-4,8,907.7,1000,1146.2,1100,1017.7
3B50,3,3.85259517,"Northline Mall, Stratton Place, Oakwood, Colonial Gardens, Lindale and Junction City",20000,Auto Theft,209,196,247,245,255,652,217.3,18.2,22,3.2,17,1045,980,1235,1275,1086.5
5F10,5,3.25978513,Afton Village and Pine Terrace,14000,Auto Theft,100,112,94,96,102,306,102,-6,2,8.5,0,714.3,800,671.4,728.6,728.6
5F30,5,8.70689439,"Fairbanks, Carverdale, Fawndale and Northwest Crossing",17000,Auto Theft,293,317,289,278,296,899,299.7,-1.4,1,2.4,-1,1723.5,1864.7,1700,1741.2,1762.9
6B10,6,5.50084827,"York Plaza, Pembrook Place and Hawthorne Place",33000,Auto Theft,306,354,304,271,282,964,321.3,-0.7,-7.8,-7.2,-12,927.3,1072.7,921.2,854.5,973.6
6B20,6,6.12869477,"Highland Heights, Oakdale and Melrose Gardens",18000,Auto Theft,127,110,104,148,152,341,113.7,-18.1,19.7,46.2,34,705.6,611.1,577.8,844.4,631.7
6B30,6,7.2300685,"Woodland Trails, Oaks of Inwood, Bayou Bend, Cole Creek Manor and Inwood Forest",38000,Auto Theft,184,171,165,167,178,520,173.3,-10.3,-3.3,7.9,3,484.2,450,434.2,468.4,456.1
6B40,6,5.544689,"Highland Gardens, Highland Heights and North Plaza",20000,Auto Theft,194,148,169,135,148,511,170.3,-12.9,-23.7,-12.4,-13,970,740,845,740,851.5
22B30,22,2.8264671,Aldine and Imperial Valley,19000,Auto Theft,246,263,279,256,272,788,262.7,13.4,10.6,-2.5,4,1294.7,1384.2,1468.4,1431.6,1382.6
22B20,22,4.61158268,Greenspoint,24000,Auto Theft,321,304,346,312,327,971,323.7,7.8,1.9,-5.5,1,1337.5,1266.7,1441.7,1362.5,1348.8
7C10,7,3.47828324,"Fifth Ward, North Park and Pinecrest",13000,Auto Theft,92,101,70,120,122,263,87.7,-23.9,32.6,74.3,39,707.7,776.9,538.5,938.5,674.6
7C20,7,7.08575157,"Huntington Place, Willshire Place, Kashmere Gardens and Liberty Gardens",21000,Auto Theft,171,159,184,198,206,514,171.3,7.6,20.5,12,20,814.3,757.1,876.2,981,815.7
7C30,7,4.51719841,"Camden Woods, Archers Acres and Croyden Gardens",18000,Auto Theft,146,154,145,169,177,445,148.3,-0.7,21.2,22.1,19,811.1,855.6,805.6,983.3,823.9
7C40,7,3.36786526,Keith-Weiss Park and Farrington Place,8000,Auto Theft,106,114,109,167,169,329,109.7,2.8,59.4,55,54,1325,1425,1362.5,2112.5,1371.2
22B40,22,13.03325001,"Intercontinental Airport, Northwood, Lakeview Park and Glen Lee",11000,Auto Theft,192,253,265,346,361,710,236.7,38,88,36.2,53,1745.5,2300,2409.1,3281.8,2151.8
8C10,8,3.69037316,"Tidwell Park, Shady Oak and Buckingham Place",12000,Auto Theft,83,93,100,112,116,276,92,20.5,39.8,16,26,691.7,775,833.3,966.7,766.7
8C20,8,3.36154214,"Houston Gardens, Rosewood and Homestead",7000,Auto Theft,46,62,54,77,77,162,54,17.4,67.4,42.6,43,657.1,885.7,771.4,1100,771.4
8C30,8,4.6258259,"Parkhurst, East Houston and Clairmont Place",11000,Auto Theft,77,78,92,128,134,247,82.3,19.5,74,45.7,63,700,709.1,836.4,1218.2,748.2
8C40,8,4.97945551,"Lake Houston, Greenriver, Knoll and Lake Forest",8000,Auto Theft,42,32,42,52,54,116,38.7,0,28.6,28.6,40,525,400,525,675,483.8
8C50,8,3.31739498,"Park North, Forest Green, Kentshire Place, Glenwood Forest and Dorchester",8000,Auto Theft,43,57,61,71,73,161,53.7,41.9,69.8,19.7,36,537.5,712.5,762.5,912.5,671.3
8C60,8,5.79693312,"Edgeworth, Northwood Manor and Scenic Woods",19000,Auto Theft,80,131,101,79,80,312,104,26.2,0,-20.8,-23,421.1,689.5,531.6,421.1,547.4
9C10,9,5.21185619,"Port of Houston, Clinton Park, Pleasantville and Fidelity Manor",6000,Auto Theft,37,45,35,42,45,117,39,-5.4,21.6,28.6,15,616.7,750,583.3,750,650
9C20,9,7.5383173,Denver Harbor and Houston Harbor,16000,Auto Theft,107,103,85,103,108,295,98.3,-20.6,0.9,27.1,10,668.8,643.8,531.2,675,614.4
9C30,9,8.13353768,"City Park East, Wynnewood Acres and Wallisville Gardens",9000,Auto Theft,102,153,108,90,96,363,121,5.9,-5.9,-11.1,-21,1133.3,1700,1200,1066.7,1344.4
9C40,9,10.42549456,"Greens Bayou Estates, Shady Brook, Northshore",23000,Auto Theft,230,323,247,314,330,800,266.7,7.4,43.5,33.6,24,1000,1404.3,1073.9,1434.8,1159.6
10H10,10,2.81830654,Oak Lawn and Ranger,11000,Auto Theft,49,55,59,92,96,163,54.3,20.4,95.9,62.7,77,445.5,500,536.4,872.7,493.6
10H20,10,1.75743169,Eastwood and Broadmoor,10000,Auto Theft,42,55,47,42,43,144,48,11.9,2.4,-8.5,-10,420,550,470,430,480
10H30,10,1.02691154,Near East End,4000,Auto Theft,54,47,85,82,83,186,62,57.4,53.7,-2.4,34,1350,1175,2125,2075,1550
10H40,10,0.99627062,Midtown,8000,Auto Theft,86,77,111,119,122,274,91.3,29.1,41.9,9.9,34,1075,962.5,1387.5,1525,1141.2
10H50,10,2.30843079,the University of Houston area,13000,Auto Theft,65,54,64,77,80,183,61,-1.5,23.1,25,31,500,415.4,492.3,615.4,469.2
10H60,10,3.08931006,"University Oaks, Riverside Terrace and the Texas Southern University area",20000,Auto Theft,75,75,91,118,124,241,80.3,21.3,65.3,36.3,54,375,375,455,620,401.5
10H70,10,3.52217952,"Texas Medical Center, Hermann Park, Houston Zoo and Miller Outdoor Theatre",16000,Auto Theft,92,102,114,212,220,308,102.7,23.9,139.1,93,114,575,637.5,712.5,1375,641.9
10H80,10,2.73862779,"Southampton, Rice University area, Shadow Lawn and Broad Acres",19000,Auto Theft,51,46,79,121,124,176,58.7,54.9,143.1,57,111,268.4,242.1,415.8,652.6,308.9
11H10,11,5.31502815,"Mason Park, Forest Hill, Sunnyland and Central Park",28000,Auto Theft,216,207,232,164,169,655,218.3,7.4,-21.8,-27.2,-23,771.4,739.3,828.6,603.6,779.6
11H20,11,3.9311161,"Harrisburg, Manchester and Pecan Park",18000,Auto Theft,87,113,139,95,96,339,113,59.8,10.3,-30.9,-15,483.3,627.8,772.2,533.3,627.8
11H30,11,2.84278059,Meadow Brook and Park Place,15000,Auto Theft,144,157,188,105,111,489,163,30.6,-22.9,-41,-32,960,1046.7,1253.3,740,1086.7
11H40,11,6.14001938,Allendale and Oak Meadows,8000,Auto Theft,44,46,49,44,47,139,46.3,11.4,6.8,-4.1,2,550,575,612.5,587.5,578.7
11H50,11,2.09534157,"Meadow Creek, Ferndale Addition and Glenbrook Industrial",8000,Auto Theft,47,72,94,85,87,213,71,100,85.1,-7.4,23,587.5,900,1175,1087.5,887.5
12D10,12,8.55384717,"Almeda Mall, Southridge, Edgebrook and South Houston Gardens",44000,Auto Theft,422,450,485,508,528,1357,452.3,14.9,25.1,8.9,17,959.1,1022.7,1102.3,1200,1028
12D20,12,3.83700574,Sage,22000,Auto Theft,151,148,168,184,190,467,155.7,11.3,25.8,13.1,22,686.4,672.7,763.6,863.6,707.7
12D30,12,3.99301158,Gulf Palms and Beamer,15000,Auto Theft,70,92,93,99,105,255,85,32.9,50,12.9,24,466.7,613.3,620,700,566.7
12D40,12,9.68663455,Scarsdale and Ellington Field,11000,Auto Theft,76,93,85,71,73,254,84.7,11.8,-3.9,-14.1,-14,690.9,845.5,772.7,663.6,770
12D50,12,8.93327581,"Bay Glen, Bay Oaks, Brook Forest and Bay Forest",26000,Auto Theft,6,11,13,12,12,30,10,116.7,100,-7.7,20,23.1,42.3,50,46.2,38.5
12D60,12,6.35832041,"NASA's Johnson Space Center, Meadow Green, Oakbrook West and Camino South",22000,Auto Theft,30,74,57,52,53,161,53.7,90,76.7,-7,-1,136.4,336.4,259.1,240.9,244.1
12D70,12,5.39156317,Baybrook Mall and Sterling Knoll,12000,Auto Theft,111,131,215,182,206,457,152.3,93.7,85.6,-4.2,35,925,1091.7,1791.7,1716.7,1269.2
13D10,13,5.2433708,"Gulfgate Mall, Bay Forest, Riverview, Hampshire, Golfcrest and Barnett Stadium",23000,Auto Theft,289,279,274,266,282,842,280.7,-5.2,-2.4,2.9,0,1256.5,1213,1191.3,1226.1,1220.4
13D20,13,6.66870859,"Fairlawn, Garden Villas, Glenbrook Valley and Santa Rosa",36000,Auto Theft,262,351,321,295,302,934,311.3,22.5,15.3,-5.9,-3,727.8,975,891.7,838.9,864.7
13D30,13,3.07402543,"Allen Farms, Airport Gardens and the Hobby Airport area",2000,Auto Theft,64,41,68,38,38,173,57.7,6.2,-40.6,-44.1,-34,3200,2050,3400,1900,2885
13D40,13,5.0688163,"Val Verde East, Gulf Meadows and Houston Skyscraper Shadows",13000,Auto Theft,67,90,95,87,92,252,84,41.8,37.3,-3.2,10,515.4,692.3,730.8,707.7,646.2
14D10,14,3.66057918,McGregor Terrace and Riverside Terrace,17000,Auto Theft,119,94,105,116,121,318,106,-11.8,1.7,15.2,14,700,552.9,617.6,711.8,623.5
14D20,14,7.25646368,"Blueridge, Sunnyside, Brook Haven and Bayou Estates",28000,Auto Theft,150,160,132,181,190,442,147.3,-12,26.7,43.9,29,535.7,571.4,471.4,678.6,526.1
14D30,14,4.20537595,"Crestmont, Edgewood, Bellfort Park, Inwood Terrace and Southpark",21000,Auto Theft,76,102,82,110,113,260,86.7,7.9,48.7,37.8,30,361.9,485.7,390.5,538.1,412.9
14D40,14,6.61224595,"South Acres, Shamrock Manor, Hillwood and Cloverland",21000,Auto Theft,73,71,85,111,114,229,76.3,16.4,56.2,34.1,49,347.6,338.1,404.8,542.9,363.3
14D50,14,8.69627992,"Golden Glade Estates, Langston and Almeda Genoa",9000,Auto Theft,44,40,64,66,69,148,49.3,45.5,56.8,7.8,40,488.9,444.4,711.1,766.7,547.8
15E10,15,4.34996776,"Meyerland Plaza, Robindell, Meyerland, Braeburn Terrace and Maplewood South",24000,Auto Theft,73,61,65,73,75,199,66.3,-11,2.7,15.4,13,304.2,254.2,270.8,312.5,276.2
15E20,15,3.58384499,"Westbury, Park West and Willow Creek",18000,Auto Theft,62,51,55,56,63,168,56,-11.3,1.6,14.5,12,344.4,283.3,305.6,350,311.1
15E30,15,6.29133294,"Meyer Park, Post Oak Manor, Westwood, Willow Bend and Linkwood",34000,Auto Theft,112,159,128,162,163,399,133,14.3,45.5,27.3,23,329.4,467.6,376.5,479.4,391.2
15E40,15,10.0079174,"NRG Park, Astroworld, Lakes at 610 and Plaza del Oro",30000,Auto Theft,243,284,232,382,397,759,253,-4.5,63.4,71.1,57,810,946.7,773.3,1323.3,843.3
16E10,16,5.38940818,Canterbury Village and Monarch Estates,15000,Auto Theft,50,72,85,90,91,207,69,70,82,7.1,32,333.3,480,566.7,606.7,460
16E20,16,8.15202134,"Almeda Plaza, South Glen, Dumbarton Oaks and Briarwick",35000,Auto Theft,123,110,131,123,131,364,121.3,6.5,6.5,0,8,351.4,314.3,374.3,374.3,346.6
16E30,16,7.00932789,"Greenpark, Southwest Crossing and Windsor Village",22000,Auto Theft,81,116,83,89,94,280,93.3,2.5,16,13.3,1,368.2,527.3,377.3,427.3,424.1
16E40,16,7.49721482,"Chasewood, Willowpark, Briarwick, Ridgemont and Quail Run",35000,Auto Theft,88,96,122,91,92,306,102,38.6,4.5,-24.6,-10,251.4,274.3,348.6,262.9,291.4
17E10,17,3.3104034,"Southwest Memorial Hospital, Burnett Bayland Park and Westmoreland",51000,Auto Theft,353,363,382,362,379,1098,366,8.2,7.4,-0.8,4,692.2,711.8,749,743.1,717.6
17E20,17,3.92767309,the Houston Baptist University area and Maplewood West,27000,Auto Theft,143,112,108,132,135,363,121,-24.5,-5.6,25,12,529.6,414.8,400,500,448.1
17E30,17,3.8060455,Braeburn Valley West and Glenshire,21000,Auto Theft,166,188,170,172,183,524,174.7,2.4,10.2,7.6,5,790.5,895.2,809.5,871.4,831.9
17E40,17,4.70920035,"Creekbend, Southwood and Fondren Southwest",46000,Auto Theft,258,220,223,219,223,701,233.7,-13.6,-13.6,0,-5,560.9,478.3,484.8,484.8,508
18F10,18,1.95881352,"Saddlebrook, Bayou Woods and Sherwood Forest",7000,Auto Theft,31,35,44,41,46,110,36.7,41.9,48.4,4.5,25,442.9,500,628.6,657.1,524.3
18F20,18,3.51641691,"The Galleria, Tanglewood, Riverway and Post Oak",24000,Auto Theft,103,216,262,363,376,581,193.7,154.4,265,43.5,94,429.2,900,1091.7,1566.7,807.1
18F30,18,3.80008564,"The Richmond Strip, Briargrove, Post Oak Estates and Westhaven",36000,Auto Theft,191,186,298,281,300,675,225,56,57.1,0.7,33,530.6,516.7,827.8,833.3,625
18F40,18,2.9060249,"Rosewood General Hospital, Woodlake and Briarmeadow",35000,Auto Theft,196,208,288,267,286,692,230.7,46.9,45.9,-0.7,24,560,594.3,822.9,817.1,659.1
18F50,18,2.96939217,"Tanglewild, Sharpstown Mall and Regency Square",20000,Auto Theft,278,283,320,302,322,881,293.7,15.1,15.8,0.6,10,1390,1415,1600,1610,1468.5
18F60,18,3.62528697,Sharpstown Country Club and Southway Center,28000,Auto Theft,161,188,191,157,168,540,180,18.6,4.3,-12,-7,575,671.4,682.1,600,642.9
19G10,19,2.74020376,Concourse South and Westwood Mall,31000,Auto Theft,303,296,295,276,285,894,298,-2.6,-5.9,-3.4,-4,977.4,954.8,951.6,919.4,961.3
19G20,19,3.29219023,"Catalina Square, Bellaire West, Imperial Point",25000,Auto Theft,116,147,136,104,115,399,133,17.2,-0.9,-15.4,-14,464,588,544,460,532
19G30,19,2.49064202,"Rodeo Square, Wildflower Green, Braewood Glen",18000,Auto Theft,73,91,64,49,52,228,76,-12.3,-28.8,-18.8,-32,405.6,505.6,355.6,288.9,422.2
19G40,19,4.56425364,"Huntington Village, Wellington Park, Leawood, Keegans Glen",37000,Auto Theft,141,146,144,149,163,431,143.7,2.1,15.6,13.2,13,381.1,394.6,389.2,440.5,388.4
19G50,19,2.30578624,"Forum Park, Stancliff and Southwest Park",18000,Auto Theft,147,173,165,143,151,485,161.7,12.2,2.7,-8.5,-7,816.7,961.1,916.7,838.9,898.3
20G10,20,3.06600809,"Westchase, Woodchase Village and Point West",29000,Auto Theft,155,171,223,201,209,549,183,43.9,34.8,-6.3,14,534.5,589.7,769,720.7,631
20G20,20,3.27621655,"Lakeside Estates, City West Place, Rivercrest and Briargrove Park",18000,Auto Theft,65,69,67,63,65,201,67,3.1,0,-3,-3,361.1,383.3,372.2,361.1,372.2
20G30,20,3.97953501,"West Houston Medical Center, Andrau Airport, Westchase and Westchase Mall",26000,Auto Theft,129,138,143,164,173,410,136.7,10.9,34.1,21,27,496.2,530.8,550,665.4,525.8
20G40,20,4.16594899,"Lakeview Forest, Lakeside Place, Ashford Village and Southlake",28000,Auto Theft,79,107,108,90,93,294,98,36.7,17.7,-13.9,-5,282.1,382.1,385.7,332.1,350
20G70,20,2.38283582,Westpark Village and Ashford Point,21000,Auto Theft,59,79,66,105,109,204,68,11.9,84.7,65.2,60,281,376.2,314.3,519,323.8
20G80,20,25.33626534,City Limits,37000,Auto Theft,105,162,163,159,166,430,143.3,55.2,58.1,1.8,16,283.8,437.8,440.5,448.6,387.3
21I10,21,0.00549966,Intercontinental Airport,0,Auto Theft,0,7,20,19,20,27,9,NA,NA,0,122,NA,NA,NA,NA,NA
21I20,21,0.01205019,Intercontinental Airport,0,Auto Theft,0,0,3,1,1,3,1,NA,NA,-66.7,0,NA,NA,NA,NA,NA
21I30,21,0.01180375,Intercontinental Airport,0,Auto Theft,0,0,0,0,0,0,0,NA,NA,NA,NA,NA,NA,NA,NA,NA
21I40,21,0.00923163,Intercontinental Airport,0,Auto Theft,0,0,0,0,0,0,0,NA,NA,NA,NA,NA,NA,NA,NA,NA
21I50,21,14.61100076,Intercontinental Airport,0,Auto Theft,181,157,200,113,119,538,179.3,10.5,-34.3,-40.5,-34,NA,NA,NA,NA,NA
21I70,21,0.01945113,Intercontinental Airport,0,Auto Theft,0,0,0,0,0,0,0,NA,NA,NA,NA,NA,NA,NA,NA,NA
22B10,22,3.28874287,"Willowbrook, Willow Chase Park and Centerfield",8000,Auto Theft,165,185,137,163,173,487,162.3,-17,4.8,26.3,7,2062.5,2312.5,1712.5,2162.5,2028.8
5F20,5,5.94082911,Spring Branch and Schwartz Park,42000,Auto Theft,196,215,201,173,182,612,204,2.6,-7.1,-9.5,-11,466.7,511.9,478.6,433.3,485.7
4F10,4,4.13606469,"Timber Oaks, Shadow Oaks and Long Point Acres",23000,Auto Theft,141,162,177,160,172,480,160,25.5,22,-2.8,8,613,704.3,769.6,747.8,695.7
20G50,20,5.88593521,"Nottingham, Yorkshire, Wilchester, Town and Country Village and Memorial City Shopping Center",30000,Auto Theft,102,135,137,180,189,374,124.7,34.3,85.3,38,52,340,450,456.7,630,415.7
4F20,4,5.85840284,"Claymore Park, Westbranch, Spring Shadows and Kempwood Forest",28000,Auto Theft,77,108,115,151,158,300,100,49.4,105.2,37.4,58,275,385.7,410.7,564.3,357.1
20G60,20,4.54207617,"Barkers Landing, Fleetwood, Thornwood and Darrel Tully Stadium",22000,Auto Theft,77,108,125,106,110,310,103.3,62.3,42.9,-12,6,350,490.9,568.2,500,469.5
4F30,4,26.30690179,"Addicks Reservoir Area, Claymore Park, Brittmore Village, Park Ten Place and Mayde Creek Farms",18000,Auto Theft,92,141,136,152,156,369,123,47.8,69.6,14.7,27,511.1,783.3,755.6,866.7,683.3
24C10,24,5.44044978,Kingwood,13000,Auto Theft,21,22,27,32,37,70,23.3,28.6,76.2,37,59,161.5,169.2,207.7,284.6,179.2
24C20,24,6.8291794,Kingwood,18000,Auto Theft,18,22,28,19,21,68,22.7,55.6,16.7,-25,-7,100,122.2,155.6,116.7,126.1
24C30,24,9.78735527,Kingwood,29000,Auto Theft,18,22,22,14,15,62,20.7,22.2,-16.7,-31.8,-28,62.1,75.9,75.9,51.7,71.4
24C40,24,35.7992771,Kingwood,6000,Auto Theft,18,25,18,23,23,61,20.3,0,27.8,27.8,13,300,416.7,300,383.3,338.3
24C50,24,7.51791807,Kingwood,5000,Auto Theft,89,119,117,96,100,325,108.3,31.5,12.4,-14.5,-8,1780,2380,2340,2000,2166
24C60,24,4.86823328,Kingwood,21000,Auto Theft,13,14,17,9,12,44,14.7,30.8,-7.7,-29.4,-18,61.9,66.7,81,57.1,70
21I60,21,0.01236886,Intercontinental Airport,0,Auto Theft,0,0,0,0,0,0,0,NA,NA,NA,NA,NA,NA,NA,NA,NA
FTB4,NA,NA,NA,NA,Auto Theft,0,0,0,0,0,0,0,NA,NA,NA,NA,NA,NA,NA,NA,NA
HCC1,NA,NA,NA,NA,Auto Theft,0,0,0,0,0,0,0,NA,NA,NA,NA,NA,NA,NA,NA,NA
HCC4,NA,NA,NA,NA,Auto Theft,0,0,0,0,0,0,0,NA,NA,NA,NA,NA,NA,NA,NA,NA
HCC5,NA,NA,NA,NA,Auto Theft,0,1,0,0,0,1,0.3,NA,NA,NA,-100,NA,NA,NA,NA,NA
HCC7,NA,NA,NA,NA,Auto Theft,3,5,1,0,0,9,3,-66.7,-100,-100,-100,NA,NA,NA,NA,NA
HCSO,NA,NA,NA,NA,Auto Theft,32,35,6,14,15,73,24.3,-81.2,-53.1,150,-38,NA,NA,NA,NA,NA
OOJ,NA,NA,NA,NA,Auto Theft,31,36,16,21,21,83,27.7,-48.4,-32.3,31.2,-24,NA,NA,NA,NA,NA
UH-2PD,NA,NA,NA,NA,Auto Theft,0,0,0,0,0,0,0,NA,NA,NA,NA,NA,NA,NA,NA,NA
UH-3PD,NA,NA,NA,NA,Auto Theft,0,0,0,0,0,0,0,NA,NA,NA,NA,NA,NA,NA,NA,NA
Unknown,NA,NA,NA,NA,Auto Theft,2,4,0,4,4,6,2,-100,100,NA,100,NA,NA,NA,NA,NA
