beat,district,area_sq_mi,placename,population,category_name,total19,total20,total21,total22,total23,last12mos,total_prior4years,avg_prior4years,inc_19to22,inc_19tolast12,inc_22tolast12,inc_prior4yearavgtolast12,rate19,rate20,rate21,rate22,rate_last12,rate_prior4years
23J40,23,3.03933481,Ellington Field,0,Auto Theft,0,0,0,1,0,1,1,0.2,NA,NA,0,400,NA,NA,NA,NA,NA,NA
23J50,23,2.12389492,Hobby Airport,0,Auto Theft,19,14,32,39,7,33,104,26,105.3,73.7,-15.4,26.9,NA,NA,NA,NA,NA,NA
1A10,1,1.74646692,Downtown Central Business District,17000,Auto Theft,155,146,237,293,71,308,831,207.8,89,98.7,5.1,48.2,911.8,858.8,1394.1,1723.5,1811.8,1222.4
1A20,1,2.44133075,"Fourth Ward, Avondale and Westmoreland",27000,Auto Theft,179,199,264,378,128,428,1020,255,111.2,139.1,13.2,67.8,663,737,977.8,1400,1585.2,944.4
1A30,1,2.65916892,"Cherryhurst, Mandell Place and Montrose",27000,Auto Theft,66,97,121,195,68,232,479,119.8,195.5,251.5,19,93.7,244.4,359.3,448.1,722.2,859.3,443.7
1A40,1,2.45016686,"Tall Timbers, Royden Oaks, River Oaks, Avalon Place and Oak Estates",7000,Auto Theft,10,13,14,19,6,20,56,14,90,100,5.3,42.9,142.9,185.7,200,271.4,285.7,200
1A50,1,3.04553452,"Post Oak Park, Afton Oaks, Highland Village, Weslayan, Greenway Plaza and The Compaq Center",26000,Auto Theft,140,205,236,332,114,370,913,228.2,137.1,164.3,11.4,62.1,538.5,788.5,907.7,1276.9,1423.1,877.7
2A10,2,3.30928608,Irvington and Ryon,18000,Auto Theft,70,104,151,111,57,140,436,109,58.6,100,26.1,28.4,388.9,577.8,838.9,616.7,777.8,605.6
2A20,2,1.8876461,"Sunset Heights, Brooksmith and Stude",11000,Auto Theft,58,64,81,84,27,83,287,71.8,44.8,43.1,-1.2,15.6,527.3,581.8,736.4,763.6,754.5,652.7
2A30,2,4.65858171,"Houston Heights, Norhill and Studemont",31000,Auto Theft,128,142,178,241,79,260,689,172.2,88.3,103.1,7.9,51,412.9,458.1,574.2,777.4,838.7,555.5
2A40,2,1.60546103,Old Sixth Ward and the First Ward,8000,Auto Theft,48,56,72,96,59,135,272,68,100,181.2,40.6,98.5,600,700,900,1200,1687.5,850
2A50,2,5.4659844,"Memorial Park, West End, Ashbury and Cottage Grove",29000,Auto Theft,126,158,212,279,97,301,775,193.8,121.4,138.9,7.9,55.3,434.5,544.8,731,962.1,1037.9,668.3
2A60,2,4.67447346,"Westport, Holly Park, Lazy Brook, Citadel, Shady Acres and Timbergrove",21000,Auto Theft,157,223,195,193,70,212,768,192,22.9,35,9.8,10.4,747.6,1061.9,928.6,919,1009.5,914.3
3B10,3,6.82068773,"Northwest Mall, Brookhollow, White Oak Acres, Oak Forest and Langwood",34000,Auto Theft,360,327,326,389,151,446,1402,350.5,8.1,23.9,14.7,27.2,1058.8,961.8,958.8,1144.1,1311.8,1030.9
3B30,3,5.310372,"White Oak Acres, Brook Hollow, Oak Forest, Garden Oaks and Shepherd Park Plaza",23000,Auto Theft,55,68,55,89,24,90,267,66.8,61.8,63.6,1.1,34.7,239.1,295.7,239.1,387,391.3,290.4
3B40,3,3.40013561,"Independence Heights, Melrose and Graceland",13000,Auto Theft,118,130,149,149,39,155,546,136.5,26.3,31.4,4,13.6,907.7,1000,1146.2,1146.2,1192.3,1050
3B50,3,3.85259517,"Northline Mall, Stratton Place, Oakwood, Colonial Gardens, Lindale and Junction City",20000,Auto Theft,209,196,247,281,125,341,933,233.2,34.4,63.2,21.4,46.2,1045,980,1235,1405,1705,1166
5F10,5,3.25978513,Afton Village and Pine Terrace,14000,Auto Theft,100,112,94,95,49,118,401,100.2,-5,18,24.2,17.8,714.3,800,671.4,678.6,842.9,715.7
5F30,5,8.70689439,"Fairbanks, Carverdale, Fawndale and Northwest Crossing",17000,Auto Theft,293,317,289,295,94,306,1194,298.5,0.7,4.4,3.7,2.5,1723.5,1864.7,1700,1735.3,1800,1755.9
6B10,6,5.50084827,"York Plaza, Pembrook Place and Hawthorne Place",33000,Auto Theft,306,354,304,274,103,325,1238,309.5,-10.5,6.2,18.6,5,927.3,1072.7,921.2,830.3,984.8,937.9
6B20,6,6.12869477,"Highland Heights, Oakdale and Melrose Gardens",18000,Auto Theft,127,110,104,152,54,174,493,123.2,19.7,37,14.5,41.2,705.6,611.1,577.8,844.4,966.7,684.4
6B30,6,7.2300685,"Woodland Trails, Oaks of Inwood, Bayou Bend, Cole Creek Manor and Inwood Forest",38000,Auto Theft,184,171,165,160,64,179,680,170,-13,-2.7,11.9,5.3,484.2,450,434.2,421.1,471.1,447.4
6B40,6,5.544689,"Highland Gardens, Highland Heights and North Plaza",20000,Auto Theft,194,148,169,143,54,152,654,163.5,-26.3,-21.6,6.3,-7,970,740,845,715,760,817.5
22B30,22,2.8264671,Aldine and Imperial Valley,19000,Auto Theft,246,263,279,278,83,280,1066,266.5,13,13.8,0.7,5.1,1294.7,1384.2,1468.4,1463.2,1473.7,1402.6
22B20,22,4.61158268,Greenspoint,24000,Auto Theft,321,304,346,343,89,346,1314,328.5,6.9,7.8,0.9,5.3,1337.5,1266.7,1441.7,1429.2,1441.7,1368.8
7C10,7,3.47828324,"Fifth Ward, North Park and Pinecrest",13000,Auto Theft,92,101,70,122,24,115,385,96.2,32.6,25,-5.7,19.5,707.7,776.9,538.5,938.5,884.6,740
7C20,7,7.08575157,"Huntington Place, Willshire Place, Kashmere Gardens and Liberty Gardens",21000,Auto Theft,171,159,184,187,54,196,701,175.2,9.4,14.6,4.8,11.9,814.3,757.1,876.2,890.5,933.3,834.3
7C30,7,4.51719841,"Camden Woods, Archers Acres and Croyden Gardens",18000,Auto Theft,146,154,145,174,58,189,619,154.8,19.2,29.5,8.6,22.1,811.1,855.6,805.6,966.7,1050,860
7C40,7,3.36786526,Keith-Weiss Park and Farrington Place,8000,Auto Theft,106,114,109,162,60,179,491,122.8,52.8,68.9,10.5,45.8,1325,1425,1362.5,2025,2237.5,1535
22B40,22,13.03325001,"Intercontinental Airport, Northwood, Lakeview Park and Glen Lee",11000,Auto Theft,192,253,265,378,113,390,1088,272,96.9,103.1,3.2,43.4,1745.5,2300,2409.1,3436.4,3545.5,2472.7
8C10,8,3.69037316,"Tidwell Park, Shady Oak and Buckingham Place",12000,Auto Theft,83,93,100,106,39,113,382,95.5,27.7,36.1,6.6,18.3,691.7,775,833.3,883.3,941.7,795.8
8C20,8,3.36154214,"Houston Gardens, Rosewood and Homestead",7000,Auto Theft,46,62,54,78,17,75,240,60,69.6,63,-3.8,25,657.1,885.7,771.4,1114.3,1071.4,857.1
8C30,8,4.6258259,"Parkhurst, East Houston and Clairmont Place",11000,Auto Theft,77,78,92,130,36,139,377,94.2,68.8,80.5,6.9,47.6,700,709.1,836.4,1181.8,1263.6,856.4
8C40,8,4.97945551,"Lake Houston, Greenriver, Knoll and Lake Forest",8000,Auto Theft,42,32,42,53,18,59,169,42.2,26.2,40.5,11.3,39.8,525,400,525,662.5,737.5,527.5
8C50,8,3.31739498,"Park North, Forest Green, Kentshire Place, Glenwood Forest and Dorchester",8000,Auto Theft,43,57,61,69,24,72,230,57.5,60.5,67.4,4.3,25.2,537.5,712.5,762.5,862.5,900,718.8
8C60,8,5.79693312,"Edgeworth, Northwood Manor and Scenic Woods",19000,Auto Theft,80,131,101,85,41,98,397,99.2,6.2,22.5,15.3,-1.2,421.1,689.5,531.6,447.4,515.8,522.1
9C10,9,5.21185619,"Port of Houston, Clinton Park, Pleasantville and Fidelity Manor",6000,Auto Theft,37,45,35,44,10,45,161,40.2,18.9,21.6,2.3,11.9,616.7,750,583.3,733.3,750,670
9C20,9,7.5383173,Denver Harbor and Houston Harbor,16000,Auto Theft,107,103,85,93,36,112,388,97,-13.1,4.7,20.4,15.5,668.8,643.8,531.2,581.2,700,606.2
9C30,9,8.13353768,"City Park East, Wynnewood Acres and Wallisville Gardens",9000,Auto Theft,102,153,108,104,50,127,467,116.8,2,24.5,22.1,8.7,1133.3,1700,1200,1155.6,1411.1,1297.8
9C40,9,10.42549456,"Greens Bayou Estates, Shady Brook, Northshore",23000,Auto Theft,230,323,247,331,73,313,1131,282.8,43.9,36.1,-5.4,10.7,1000,1404.3,1073.9,1439.1,1360.9,1229.6
10H10,10,2.81830654,Oak Lawn and Ranger,11000,Auto Theft,49,55,59,100,13,87,263,65.8,104.1,77.6,-13,32.2,445.5,500,536.4,909.1,790.9,598.2
10H20,10,1.75743169,Eastwood and Broadmoor,10000,Auto Theft,42,55,47,47,19,57,191,47.8,11.9,35.7,21.3,19.2,420,550,470,470,570,478
10H30,10,1.02691154,Near East End,4000,Auto Theft,54,47,85,86,23,87,272,68,59.3,61.1,1.2,27.9,1350,1175,2125,2150,2175,1700
10H40,10,0.99627062,Midtown,8000,Auto Theft,86,77,111,124,28,125,398,99.5,44.2,45.3,0.8,25.6,1075,962.5,1387.5,1550,1562.5,1243.8
10H50,10,2.30843079,the University of Houston area,13000,Auto Theft,65,54,64,84,35,99,267,66.8,29.2,52.3,17.9,48.2,500,415.4,492.3,646.2,761.5,513.8
10H60,10,3.08931006,"University Oaks, Riverside Terrace and the Texas Southern University area",20000,Auto Theft,75,75,91,123,39,143,364,91,64,90.7,16.3,57.1,375,375,455,615,715,455
10H70,10,3.52217952,"Texas Medical Center, Hermann Park, Houston Zoo and Miller Outdoor Theatre",16000,Auto Theft,92,102,114,221,55,228,529,132.2,140.2,147.8,3.2,72.5,575,637.5,712.5,1381.2,1425,826.2
10H80,10,2.73862779,"Southampton, Rice University area, Shadow Lawn and Broad Acres",19000,Auto Theft,51,46,79,129,33,126,305,76.2,152.9,147.1,-2.3,65.4,268.4,242.1,415.8,678.9,663.2,401.1
11H10,11,5.31502815,"Mason Park, Forest Hill, Sunnyland and Central Park",28000,Auto Theft,216,207,232,174,44,163,829,207.2,-19.4,-24.5,-6.3,-21.3,771.4,739.3,828.6,621.4,582.1,740
11H20,11,3.9311161,"Harrisburg, Manchester and Pecan Park",18000,Auto Theft,87,113,139,106,21,98,445,111.2,21.8,12.6,-7.5,-11.9,483.3,627.8,772.2,588.9,544.4,617.8
11H30,11,2.84278059,Meadow Brook and Park Place,15000,Auto Theft,144,157,188,115,44,131,604,151,-20.1,-9,13.9,-13.2,960,1046.7,1253.3,766.7,873.3,1006.7
11H40,11,6.14001938,Allendale and Oak Meadows,8000,Auto Theft,44,46,49,47,13,52,186,46.5,6.8,18.2,10.6,11.8,550,575,612.5,587.5,650,581.2
11H50,11,2.09534157,"Meadow Creek, Ferndale Addition and Glenbrook Industrial",8000,Auto Theft,47,72,94,95,23,95,308,77,102.1,102.1,0,23.4,587.5,900,1175,1187.5,1187.5,962.5
12D10,12,8.55384717,"Almeda Mall, Southridge, Edgebrook and South Houston Gardens",44000,Auto Theft,422,450,485,558,139,571,1915,478.8,32.2,35.3,2.3,19.3,959.1,1022.7,1102.3,1268.2,1297.7,1088.2
12D20,12,3.83700574,Sage,22000,Auto Theft,151,148,168,197,46,198,664,166,30.5,31.1,0.5,19.3,686.4,672.7,763.6,895.5,900,754.5
12D30,12,3.99301158,Gulf Palms and Beamer,15000,Auto Theft,70,92,93,108,32,114,363,90.8,54.3,62.9,5.6,25.6,466.7,613.3,620,720,760,605.3
12D40,12,9.68663455,Scarsdale and Ellington Field,11000,Auto Theft,76,93,85,80,15,81,334,83.5,5.3,6.6,1.2,-3,690.9,845.5,772.7,727.3,736.4,759.1
12D50,12,8.93327581,"Bay Glen, Bay Oaks, Brook Forest and Bay Forest",26000,Auto Theft,6,11,13,14,6,17,44,11,133.3,183.3,21.4,54.5,23.1,42.3,50,53.8,65.4,42.3
12D60,12,6.35832041,"NASA's Johnson Space Center, Meadow Green, Oakbrook West and Camino South",22000,Auto Theft,30,74,57,55,18,59,216,54,83.3,96.7,7.3,9.3,136.4,336.4,259.1,250,268.2,245.5
12D70,12,5.39156317,Baybrook Mall and Sterling Knoll,12000,Auto Theft,111,131,215,197,44,186,654,163.5,77.5,67.6,-5.6,13.8,925,1091.7,1791.7,1641.7,1550,1362.5
13D10,13,5.2433708,"Gulfgate Mall, Bay Forest, Riverview, Hampshire, Golfcrest and Barnett Stadium",23000,Auto Theft,289,279,274,275,53,277,1117,279.2,-4.8,-4.2,0.7,-0.8,1256.5,1213,1191.3,1195.7,1204.3,1213.9
13D20,13,6.66870859,"Fairlawn, Garden Villas, Glenbrook Valley and Santa Rosa",36000,Auto Theft,262,351,321,316,77,329,1250,312.5,20.6,25.6,4.1,5.3,727.8,975,891.7,877.8,913.9,868.1
13D30,13,3.07402543,"Allen Farms, Airport Gardens and the Hobby Airport area",2000,Auto Theft,64,41,68,48,15,55,221,55.2,-25,-14.1,14.6,-0.4,3200,2050,3400,2400,2750,2760
13D40,13,5.0688163,"Val Verde East, Gulf Meadows and Houston Skyscraper Shadows",13000,Auto Theft,67,90,95,88,21,87,340,85,31.3,29.9,-1.1,2.4,515.4,692.3,730.8,676.9,669.2,653.8
14D10,14,3.66057918,McGregor Terrace and Riverside Terrace,17000,Auto Theft,119,94,105,129,42,144,447,111.8,8.4,21,11.6,28.8,700,552.9,617.6,758.8,847.1,657.6
14D20,14,7.25646368,"Blueridge, Sunnyside, Brook Haven and Bayou Estates",28000,Auto Theft,150,160,132,197,47,192,639,159.8,31.3,28,-2.5,20.2,535.7,571.4,471.4,703.6,685.7,570.7
14D30,14,4.20537595,"Crestmont, Edgewood, Bellfort Park, Inwood Terrace and Southpark",21000,Auto Theft,76,102,82,114,22,108,374,93.5,50,42.1,-5.3,15.5,361.9,485.7,390.5,542.9,514.3,445.2
14D40,14,6.61224595,"South Acres, Shamrock Manor, Hillwood and Cloverland",21000,Auto Theft,73,71,85,120,28,123,349,87.2,64.4,68.5,2.5,41.1,347.6,338.1,404.8,571.4,585.7,415.2
14D50,14,8.69627992,"Golden Glade Estates, Langston and Almeda Genoa",9000,Auto Theft,44,40,64,64,11,56,212,53,45.5,27.3,-12.5,5.7,488.9,444.4,711.1,711.1,622.2,588.9
15E10,15,4.34996776,"Meyerland Plaza, Robindell, Meyerland, Braeburn Terrace and Maplewood South",24000,Auto Theft,73,61,65,80,25,87,279,69.8,9.6,19.2,8.7,24.6,304.2,254.2,270.8,333.3,362.5,290.8
15E20,15,3.58384499,"Westbury, Park West and Willow Creek",18000,Auto Theft,62,51,55,59,11,52,227,56.8,-4.8,-16.1,-11.9,-8.5,344.4,283.3,305.6,327.8,288.9,315.6
15E30,15,6.29133294,"Meyer Park, Post Oak Manor, Westwood, Willow Bend and Linkwood",34000,Auto Theft,112,159,128,170,62,177,569,142.2,51.8,58,4.1,24.5,329.4,467.6,376.5,500,520.6,418.2
15E40,15,10.0079174,"NRG Park, Astroworld, Lakes at 610 and Plaza del Oro",30000,Auto Theft,243,284,232,418,152,446,1177,294.2,72,83.5,6.7,51.6,810,946.7,773.3,1393.3,1486.7,980.7
16E10,16,5.38940818,Canterbury Village and Monarch Estates,15000,Auto Theft,50,72,85,93,27,103,300,75,86,106,10.8,37.3,333.3,480,566.7,620,686.7,500
16E20,16,8.15202134,"Almeda Plaza, South Glen, Dumbarton Oaks and Briarwick",35000,Auto Theft,123,110,131,128,41,138,492,123,4.1,12.2,7.8,12.2,351.4,314.3,374.3,365.7,394.3,351.4
16E30,16,7.00932789,"Greenpark, Southwest Crossing and Windsor Village",22000,Auto Theft,81,116,83,103,26,111,383,95.8,27.2,37,7.8,15.9,368.2,527.3,377.3,468.2,504.5,435.5
16E40,16,7.49721482,"Chasewood, Willowpark, Briarwick, Ridgemont and Quail Run",35000,Auto Theft,88,96,122,92,27,91,398,99.5,4.5,3.4,-1.1,-8.5,251.4,274.3,348.6,262.9,260,284.3
17E10,17,3.3104034,"Southwest Memorial Hospital, Burnett Bayland Park and Westmoreland",51000,Auto Theft,353,363,382,394,84,385,1492,373,11.6,9.1,-2.3,3.2,692.2,711.8,749,772.5,754.9,731.4
17E20,17,3.92767309,the Houston Baptist University area and Maplewood West,27000,Auto Theft,143,112,108,141,28,139,504,126,-1.4,-2.8,-1.4,10.3,529.6,414.8,400,522.2,514.8,466.7
17E30,17,3.8060455,Braeburn Valley West and Glenshire,21000,Auto Theft,166,188,170,186,35,163,710,177.5,12,-1.8,-12.4,-8.2,790.5,895.2,809.5,885.7,776.2,845.2
17E40,17,4.70920035,"Creekbend, Southwood and Fondren Southwest",46000,Auto Theft,258,220,223,221,66,238,922,230.5,-14.3,-7.8,7.7,3.3,560.9,478.3,484.8,480.4,517.4,501.1
18F10,18,1.95881352,"Saddlebrook, Bayou Woods and Sherwood Forest",7000,Auto Theft,31,35,44,46,12,48,156,39,48.4,54.8,4.3,23.1,442.9,500,628.6,657.1,685.7,557.1
18F20,18,3.51641691,"The Galleria, Tanglewood, Riverway and Post Oak",24000,Auto Theft,103,216,262,383,80,364,964,241,271.8,253.4,-5,51,429.2,900,1091.7,1595.8,1516.7,1004.2
18F30,18,3.80008564,"The Richmond Strip, Briargrove, Post Oak Estates and Westhaven",36000,Auto Theft,191,186,298,297,60,275,972,243,55.5,44,-7.4,13.2,530.6,516.7,827.8,825,763.9,675
18F40,18,2.9060249,"Rosewood General Hospital, Woodlake and Briarmeadow",35000,Auto Theft,196,208,288,273,64,264,965,241.2,39.3,34.7,-3.3,9.5,560,594.3,822.9,780,754.3,689.1
18F50,18,2.96939217,"Tanglewild, Sharpstown Mall and Regency Square",20000,Auto Theft,278,283,320,326,82,319,1207,301.8,17.3,14.7,-2.1,5.7,1390,1415,1600,1630,1595,1509
18F60,18,3.62528697,Sharpstown Country Club and Southway Center,28000,Auto Theft,161,188,191,169,36,147,709,177.2,5,-8.7,-13,-17,575,671.4,682.1,603.6,525,632.9
19G10,19,2.74020376,Concourse South and Westwood Mall,31000,Auto Theft,303,296,295,290,61,273,1184,296,-4.3,-9.9,-5.9,-7.8,977.4,954.8,951.6,935.5,880.6,954.8
19G20,19,3.29219023,"Catalina Square, Bellaire West, Imperial Point",25000,Auto Theft,116,147,136,113,34,126,512,128,-2.6,8.6,11.5,-1.6,464,588,544,452,504,512
19G30,19,2.49064202,"Rodeo Square, Wildflower Green, Braewood Glen",18000,Auto Theft,73,91,64,54,11,51,282,70.5,-26,-30.1,-5.6,-27.7,405.6,505.6,355.6,300,283.3,391.7
19G40,19,4.56425364,"Huntington Village, Wellington Park, Leawood, Keegans Glen",37000,Auto Theft,141,146,144,155,41,151,586,146.5,9.9,7.1,-2.6,3.1,381.1,394.6,389.2,418.9,408.1,395.9
19G50,19,2.30578624,"Forum Park, Stancliff and Southwest Park",18000,Auto Theft,147,173,165,157,50,159,642,160.5,6.8,8.2,1.3,-0.9,816.7,961.1,916.7,872.2,883.3,891.7
20G10,20,3.06600809,"Westchase, Woodchase Village and Point West",29000,Auto Theft,155,171,223,219,45,207,768,192,41.3,33.5,-5.5,7.8,534.5,589.7,769,755.2,713.8,662.1
20G20,20,3.27621655,"Lakeside Estates, City West Place, Rivercrest and Briargrove Park",18000,Auto Theft,65,69,67,66,21,71,267,66.8,1.5,9.2,7.6,6.3,361.1,383.3,372.2,366.7,394.4,371.1
20G30,20,3.97953501,"West Houston Medical Center, Andrau Airport, Westchase and Westchase Mall",26000,Auto Theft,129,138,143,170,25,145,580,145,31.8,12.4,-14.7,0,496.2,530.8,550,653.8,557.7,557.7
20G40,20,4.16594899,"Lakeview Forest, Lakeside Place, Ashford Village and Southlake",28000,Auto Theft,79,107,108,99,46,122,393,98.2,25.3,54.4,23.2,24.2,282.1,382.1,385.7,353.6,435.7,350.7
20G70,20,2.38283582,Westpark Village and Ashford Point,21000,Auto Theft,59,79,66,114,40,132,318,79.5,93.2,123.7,15.8,66,281,376.2,314.3,542.9,628.6,378.6
20G80,20,25.33626534,City Limits,37000,Auto Theft,105,162,163,174,62,198,604,151,65.7,88.6,13.8,31.1,283.8,437.8,440.5,470.3,535.1,408.1
21I10,21,0.00549966,Intercontinental Airport,0,Auto Theft,0,7,20,20,9,25,47,11.8,NA,NA,25,111.9,NA,NA,NA,NA,NA,NA
21I20,21,0.01205019,Intercontinental Airport,0,Auto Theft,0,0,3,1,0,1,4,1,NA,NA,0,0,NA,NA,NA,NA,NA,NA
21I30,21,0.01180375,Intercontinental Airport,0,Auto Theft,0,0,0,0,0,0,0,0,NA,NA,NA,NA,NA,NA,NA,NA,NA,NA
21I40,21,0.00923163,Intercontinental Airport,0,Auto Theft,0,0,0,0,0,0,0,0,NA,NA,NA,NA,NA,NA,NA,NA,NA,NA
21I50,21,14.61100076,Intercontinental Airport,0,Auto Theft,181,157,200,137,45,155,675,168.8,-24.3,-14.4,13.1,-8.2,NA,NA,NA,NA,NA,NA
21I70,21,0.01945113,Intercontinental Airport,0,Auto Theft,0,0,0,0,0,0,0,0,NA,NA,NA,NA,NA,NA,NA,NA,NA,NA
22B10,22,3.28874287,"Willowbrook, Willow Chase Park and Centerfield",8000,Auto Theft,165,185,137,186,40,196,673,168.2,12.7,18.8,5.4,16.5,2062.5,2312.5,1712.5,2325,2450,2102.5
5F20,5,5.94082911,Spring Branch and Schwartz Park,42000,Auto Theft,196,215,201,173,77,201,785,196.2,-11.7,2.6,16.2,2.4,466.7,511.9,478.6,411.9,478.6,467.1
4F10,4,4.13606469,"Timber Oaks, Shadow Oaks and Long Point Acres",23000,Auto Theft,141,162,177,162,59,171,642,160.5,14.9,21.3,5.6,6.5,613,704.3,769.6,704.3,743.5,697.8
20G50,20,5.88593521,"Nottingham, Yorkshire, Wilchester, Town and Country Village and Memorial City Shopping Center",30000,Auto Theft,102,135,137,194,57,204,568,142,90.2,100,5.2,43.7,340,450,456.7,646.7,680,473.3
4F20,4,5.85840284,"Claymore Park, Westbranch, Spring Shadows and Kempwood Forest",28000,Auto Theft,77,108,115,148,49,150,448,112,92.2,94.8,1.4,33.9,275,385.7,410.7,528.6,535.7,400
20G60,20,4.54207617,"Barkers Landing, Fleetwood, Thornwood and Darrel Tully Stadium",22000,Auto Theft,77,108,125,121,31,127,431,107.8,57.1,64.9,5,17.8,350,490.9,568.2,550,577.3,490
4F30,4,26.30690179,"Addicks Reservoir Area, Claymore Park, Brittmore Village, Park Ten Place and Mayde Creek Farms",18000,Auto Theft,92,141,136,160,64,179,529,132.2,73.9,94.6,11.9,35.4,511.1,783.3,755.6,888.9,994.4,734.4
24C10,24,5.44044978,Kingwood,13000,Auto Theft,21,22,27,33,5,28,103,25.8,57.1,33.3,-15.2,8.5,161.5,169.2,207.7,253.8,215.4,198.5
24C20,24,6.8291794,Kingwood,18000,Auto Theft,18,22,28,19,4,16,87,21.8,5.6,-11.1,-15.8,-26.6,100,122.2,155.6,105.6,88.9,121.1
24C30,24,9.78735527,Kingwood,29000,Auto Theft,18,22,22,16,8,20,78,19.5,-11.1,11.1,25,2.6,62.1,75.9,75.9,55.2,69,67.2
24C40,24,35.7992771,Kingwood,6000,Auto Theft,18,25,18,24,5,26,85,21.2,33.3,44.4,8.3,22.6,300,416.7,300,400,433.3,353.3
24C50,24,7.51791807,Kingwood,5000,Auto Theft,89,119,117,102,27,95,427,106.8,14.6,6.7,-6.9,-11,1780,2380,2340,2040,1900,2136
24C60,24,4.86823328,Kingwood,21000,Auto Theft,13,14,17,9,6,13,53,13.2,-30.8,0,44.4,-1.5,61.9,66.7,81,42.9,61.9,62.9
21I60,21,0.01236886,Intercontinental Airport,0,Auto Theft,0,0,0,0,0,0,0,0,NA,NA,NA,NA,NA,NA,NA,NA,NA,NA
