beat,district,area_sq_mi,placename,population,category_name,total19,total20,total21,total22,total23,last12mos,total_prior4years,avg_prior4years,inc_19to21,inc_19tolast12,inc_21tolast12,inc_prior4yearavgtolast12,rate19,rate20,rate21,rate22,rate_last12,rate_prior4years
23J40,23,3.03933481,Ellington Field,0,Burglary,1,0,0,0,0,0,1,0.2,-100,-100,NA,-100,NA,NA,NA,NA,NA,NA
23J50,23,2.12389492,Hobby Airport,0,Burglary,4,0,0,1,0,1,5,1.2,-100,-75,NA,-16.7,NA,NA,NA,NA,NA,NA
1A10,1,1.74646692,Downtown Central Business District,17000,Burglary,76,77,65,86,29,108,304,76,-14.5,42.1,66.2,42.1,447.1,452.9,382.4,505.9,635.3,447.1
1A20,1,2.44133075,"Fourth Ward, Avondale and Westmoreland",27000,Burglary,309,304,217,211,43,230,1041,260.2,-29.8,-25.6,6,-11.6,1144.4,1125.9,803.7,781.5,851.9,963.7
1A30,1,2.65916892,"Cherryhurst, Mandell Place and Montrose",27000,Burglary,236,205,182,140,23,153,763,190.8,-22.9,-35.2,-15.9,-19.8,874.1,759.3,674.1,518.5,566.7,706.7
1A40,1,2.45016686,"Tall Timbers, Royden Oaks, River Oaks, Avalon Place and Oak Estates",7000,Burglary,31,29,20,14,2,15,94,23.5,-35.5,-51.6,-25,-36.2,442.9,414.3,285.7,200,214.3,335.7
1A50,1,3.04553452,"Post Oak Park, Afton Oaks, Highland Village, Weslayan, Greenway Plaza and The Compaq Center",26000,Burglary,240,212,142,166,45,183,760,190,-40.8,-23.8,28.9,-3.7,923.1,815.4,546.2,638.5,703.8,730.8
2A10,2,3.30928608,Irvington and Ryon,18000,Burglary,131,116,118,170,26,172,535,133.8,-9.9,31.3,45.8,28.6,727.8,644.4,655.6,944.4,955.6,743.3
2A20,2,1.8876461,"Sunset Heights, Brooksmith and Stude",11000,Burglary,94,77,80,75,14,82,326,81.5,-14.9,-12.8,2.5,0.6,854.5,700,727.3,681.8,745.5,740.9
2A30,2,4.65858171,"Houston Heights, Norhill and Studemont",31000,Burglary,276,175,142,155,19,163,748,187,-48.6,-40.9,14.8,-12.8,890.3,564.5,458.1,500,525.8,603.2
2A40,2,1.60546103,Old Sixth Ward and the First Ward,8000,Burglary,79,65,61,50,8,52,255,63.8,-22.8,-34.2,-14.8,-18.5,987.5,812.5,762.5,625,650,797.5
2A50,2,5.4659844,"Memorial Park, West End, Ashbury and Cottage Grove",29000,Burglary,214,130,150,135,20,144,629,157.2,-29.9,-32.7,-4,-8.4,737.9,448.3,517.2,465.5,496.6,542.1
2A60,2,4.67447346,"Westport, Holly Park, Lazy Brook, Citadel, Shady Acres and Timbergrove",21000,Burglary,139,133,134,147,21,152,553,138.2,-3.6,9.4,13.4,10,661.9,633.3,638.1,700,723.8,658.1
3B10,3,6.82068773,"Northwest Mall, Brookhollow, White Oak Acres, Oak Forest and Langwood",34000,Burglary,309,336,336,354,52,362,1335,333.8,8.7,17.2,7.7,8.4,908.8,988.2,988.2,1041.2,1064.7,981.8
3B30,3,5.310372,"White Oak Acres, Brook Hollow, Oak Forest, Garden Oaks and Shepherd Park Plaza",23000,Burglary,131,133,140,113,23,120,517,129.2,6.9,-8.4,-14.3,-7.1,569.6,578.3,608.7,491.3,521.7,561.7
3B40,3,3.40013561,"Independence Heights, Melrose and Graceland",13000,Burglary,183,191,183,127,14,136,684,171,0,-25.7,-25.7,-20.5,1407.7,1469.2,1407.7,976.9,1046.2,1315.4
3B50,3,3.85259517,"Northline Mall, Stratton Place, Oakwood, Colonial Gardens, Lindale and Junction City",20000,Burglary,154,143,137,142,21,151,576,144,-11,-1.9,10.2,4.9,770,715,685,710,755,720
5F10,5,3.25978513,Afton Village and Pine Terrace,14000,Burglary,124,98,119,125,10,121,466,116.5,-4,-2.4,1.7,3.9,885.7,700,850,892.9,864.3,832.1
5F30,5,8.70689439,"Fairbanks, Carverdale, Fawndale and Northwest Crossing",17000,Burglary,235,227,218,193,37,209,873,218.2,-7.2,-11.1,-4.1,-4.2,1382.4,1335.3,1282.4,1135.3,1229.4,1283.5
6B10,6,5.50084827,"York Plaza, Pembrook Place and Hawthorne Place",33000,Burglary,175,156,178,188,41,209,697,174.2,1.7,19.4,17.4,20,530.3,472.7,539.4,569.7,633.3,527.9
6B20,6,6.12869477,"Highland Heights, Oakdale and Melrose Gardens",18000,Burglary,169,192,132,164,39,178,657,164.2,-21.9,5.3,34.8,8.4,938.9,1066.7,733.3,911.1,988.9,912.2
6B30,6,7.2300685,"Woodland Trails, Oaks of Inwood, Bayou Bend, Cole Creek Manor and Inwood Forest",38000,Burglary,219,212,123,202,31,205,756,189,-43.8,-6.4,66.7,8.5,576.3,557.9,323.7,531.6,539.5,497.4
6B40,6,5.544689,"Highland Gardens, Highland Heights and North Plaza",20000,Burglary,149,190,124,135,16,136,598,149.5,-16.8,-8.7,9.7,-9,745,950,620,675,680,747.5
22B30,22,2.8264671,Aldine and Imperial Valley,19000,Burglary,137,171,122,125,12,123,555,138.8,-10.9,-10.2,0.8,-11.4,721.1,900,642.1,657.9,647.4,730.5
22B20,22,4.61158268,Greenspoint,24000,Burglary,278,276,269,260,17,238,1083,270.8,-3.2,-14.4,-11.5,-12.1,1158.3,1150,1120.8,1083.3,991.7,1128.3
7C10,7,3.47828324,"Fifth Ward, North Park and Pinecrest",13000,Burglary,145,126,121,148,10,143,540,135,-16.6,-1.4,18.2,5.9,1115.4,969.2,930.8,1138.5,1100,1038.5
7C20,7,7.08575157,"Huntington Place, Willshire Place, Kashmere Gardens and Liberty Gardens",21000,Burglary,256,243,289,227,37,242,1015,253.8,12.9,-5.5,-16.3,-4.6,1219,1157.1,1376.2,1081,1152.4,1208.6
7C30,7,4.51719841,"Camden Woods, Archers Acres and Croyden Gardens",18000,Burglary,155,159,117,136,16,138,567,141.8,-24.5,-11,17.9,-2.7,861.1,883.3,650,755.6,766.7,787.8
7C40,7,3.36786526,Keith-Weiss Park and Farrington Place,8000,Burglary,45,56,47,40,2,37,188,47,4.4,-17.8,-21.3,-21.3,562.5,700,587.5,500,462.5,587.5
22B40,22,13.03325001,"Intercontinental Airport, Northwood, Lakeview Park and Glen Lee",11000,Burglary,119,112,126,133,14,134,490,122.5,5.9,12.6,6.3,9.4,1081.8,1018.2,1145.5,1209.1,1218.2,1113.6
8C10,8,3.69037316,"Tidwell Park, Shady Oak and Buckingham Place",12000,Burglary,182,95,142,117,23,128,536,134,-22,-29.7,-9.9,-4.5,1516.7,791.7,1183.3,975,1066.7,1116.7
8C20,8,3.36154214,"Houston Gardens, Rosewood and Homestead",7000,Burglary,69,47,61,59,13,67,236,59,-11.6,-2.9,9.8,13.6,985.7,671.4,871.4,842.9,957.1,842.9
8C30,8,4.6258259,"Parkhurst, East Houston and Clairmont Place",11000,Burglary,112,83,84,103,16,105,382,95.5,-25,-6.2,25,9.9,1018.2,754.5,763.6,936.4,954.5,868.2
8C40,8,4.97945551,"Lake Houston, Greenriver, Knoll and Lake Forest",8000,Burglary,54,32,27,25,11,35,138,34.5,-50,-35.2,29.6,1.4,675,400,337.5,312.5,437.5,431.3
8C50,8,3.31739498,"Park North, Forest Green, Kentshire Place, Glenwood Forest and Dorchester",8000,Burglary,93,58,59,84,17,95,294,73.5,-36.6,2.2,61,29.3,1162.5,725,737.5,1050,1187.5,918.8
8C60,8,5.79693312,"Edgeworth, Northwood Manor and Scenic Woods",19000,Burglary,140,102,109,116,9,115,467,116.8,-22.1,-17.9,5.5,-1.5,736.8,536.8,573.7,610.5,605.3,614.7
9C10,9,5.21185619,"Port of Houston, Clinton Park, Pleasantville and Fidelity Manor",6000,Burglary,36,33,40,48,13,58,157,39.2,11.1,61.1,45,48,600,550,666.7,800,966.7,653.3
9C20,9,7.5383173,Denver Harbor and Houston Harbor,16000,Burglary,109,91,70,117,17,124,387,96.8,-35.8,13.8,77.1,28.1,681.2,568.8,437.5,731.2,775,605
9C30,9,8.13353768,"City Park East, Wynnewood Acres and Wallisville Gardens",9000,Burglary,54,72,50,39,6,42,215,53.8,-7.4,-22.2,-16,-21.9,600,800,555.6,433.3,466.7,597.8
9C40,9,10.42549456,"Greens Bayou Estates, Shady Brook, Northshore",23000,Burglary,188,181,163,226,35,246,758,189.5,-13.3,30.9,50.9,29.8,817.4,787,708.7,982.6,1069.6,823.9
10H10,10,2.81830654,Oak Lawn and Ranger,11000,Burglary,53,87,64,61,8,61,265,66.2,20.8,15.1,-4.7,-7.9,481.8,790.9,581.8,554.5,554.5,601.8
10H20,10,1.75743169,Eastwood and Broadmoor,10000,Burglary,62,86,59,64,6,64,271,67.8,-4.8,3.2,8.5,-5.6,620,860,590,640,640,678
10H30,10,1.02691154,Near East End,4000,Burglary,51,50,47,58,12,66,206,51.5,-7.8,29.4,40.4,28.2,1275,1250,1175,1450,1650,1287.5
10H40,10,0.99627062,Midtown,8000,Burglary,141,151,102,141,20,155,535,133.8,-27.7,9.9,52,15.8,1762.5,1887.5,1275,1762.5,1937.5,1672.5
10H50,10,2.30843079,the University of Houston area,13000,Burglary,187,188,158,142,14,145,675,168.8,-15.5,-22.5,-8.2,-14.1,1438.5,1446.2,1215.4,1092.3,1115.4,1298.5
10H60,10,3.08931006,"University Oaks, Riverside Terrace and the Texas Southern University area",20000,Burglary,137,124,141,112,19,120,514,128.5,2.9,-12.4,-14.9,-6.6,685,620,705,560,600,642.5
10H70,10,3.52217952,"Texas Medical Center, Hermann Park, Houston Zoo and Miller Outdoor Theatre",16000,Burglary,154,136,111,108,13,104,509,127.2,-27.9,-32.5,-6.3,-18.2,962.5,850,693.8,675,650,795
10H80,10,2.73862779,"Southampton, Rice University area, Shadow Lawn and Broad Acres",19000,Burglary,119,101,87,71,9,74,378,94.5,-26.9,-37.8,-14.9,-21.7,626.3,531.6,457.9,373.7,389.5,497.4
11H10,11,5.31502815,"Mason Park, Forest Hill, Sunnyland and Central Park",28000,Burglary,177,176,125,153,27,166,631,157.8,-29.4,-6.2,32.8,5.2,632.1,628.6,446.4,546.4,592.9,563.6
11H20,11,3.9311161,"Harrisburg, Manchester and Pecan Park",18000,Burglary,55,62,62,81,12,86,260,65,12.7,56.4,38.7,32.3,305.6,344.4,344.4,450,477.8,361.1
11H30,11,2.84278059,Meadow Brook and Park Place,15000,Burglary,102,74,75,71,9,74,322,80.5,-26.5,-27.5,-1.3,-8.1,680,493.3,500,473.3,493.3,536.7
11H40,11,6.14001938,Allendale and Oak Meadows,8000,Burglary,34,22,17,18,3,17,91,22.8,-50,-50,0,-25.4,425,275,212.5,225,212.5,285
11H50,11,2.09534157,"Meadow Creek, Ferndale Addition and Glenbrook Industrial",8000,Burglary,42,37,45,50,9,55,174,43.5,7.1,31,22.2,26.4,525,462.5,562.5,625,687.5,543.8
12D10,12,8.55384717,"Almeda Mall, Southridge, Edgebrook and South Houston Gardens",44000,Burglary,289,285,289,324,16,301,1187,296.8,0,4.2,4.2,1.4,656.8,647.7,656.8,736.4,684.1,674.5
12D20,12,3.83700574,Sage,22000,Burglary,131,131,170,158,2,123,590,147.5,29.8,-6.1,-27.6,-16.6,595.5,595.5,772.7,718.2,559.1,670.5
12D30,12,3.99301158,Gulf Palms and Beamer,15000,Burglary,62,79,48,59,3,54,248,62,-22.6,-12.9,12.5,-12.9,413.3,526.7,320,393.3,360,413.3
12D40,12,9.68663455,Scarsdale and Ellington Field,11000,Burglary,75,68,79,91,7,89,313,78.2,5.3,18.7,12.7,13.8,681.8,618.2,718.2,827.3,809.1,710.9
12D50,12,8.93327581,"Bay Glen, Bay Oaks, Brook Forest and Bay Forest",26000,Burglary,41,32,32,42,4,40,147,36.8,-22,-2.4,25,8.7,157.7,123.1,123.1,161.5,153.8,141.5
12D60,12,6.35832041,"NASA's Johnson Space Center, Meadow Green, Oakbrook West and Camino South",22000,Burglary,76,62,85,33,7,37,256,64,11.8,-51.3,-56.5,-42.2,345.5,281.8,386.4,150,168.2,290.9
12D70,12,5.39156317,Baybrook Mall and Sterling Knoll,12000,Burglary,82,90,96,112,4,112,380,95,17.1,36.6,16.7,17.9,683.3,750,800,933.3,933.3,791.7
13D10,13,5.2433708,"Gulfgate Mall, Bay Forest, Riverview, Hampshire, Golfcrest and Barnett Stadium",23000,Burglary,166,171,116,115,13,118,568,142,-30.1,-28.9,1.7,-16.9,721.7,743.5,504.3,500,513,617.4
13D20,13,6.66870859,"Fairlawn, Garden Villas, Glenbrook Valley and Santa Rosa",36000,Burglary,328,256,243,277,35,279,1104,276,-25.9,-14.9,14.8,1.1,911.1,711.1,675,769.4,775,766.7
13D30,13,3.07402543,"Allen Farms, Airport Gardens and the Hobby Airport area",2000,Burglary,12,10,13,12,2,13,47,11.8,8.3,8.3,0,10.2,600,500,650,600,650,590
13D40,13,5.0688163,"Val Verde East, Gulf Meadows and Houston Skyscraper Shadows",13000,Burglary,66,77,35,72,11,73,250,62.5,-47,10.6,108.6,16.8,507.7,592.3,269.2,553.8,561.5,480.8
14D10,14,3.66057918,McGregor Terrace and Riverside Terrace,17000,Burglary,242,205,126,177,25,188,750,187.5,-47.9,-22.3,49.2,0.3,1423.5,1205.9,741.2,1041.2,1105.9,1102.9
14D20,14,7.25646368,"Blueridge, Sunnyside, Brook Haven and Bayou Estates",28000,Burglary,409,291,285,268,33,274,1253,313.2,-30.3,-33,-3.9,-12.5,1460.7,1039.3,1017.9,957.1,978.6,1118.6
14D30,14,4.20537595,"Crestmont, Edgewood, Bellfort Park, Inwood Terrace and Southpark",21000,Burglary,184,155,126,157,27,176,622,155.5,-31.5,-4.3,39.7,13.2,876.2,738.1,600,747.6,838.1,740.5
14D40,14,6.61224595,"South Acres, Shamrock Manor, Hillwood and Cloverland",21000,Burglary,115,116,87,103,12,103,421,105.2,-24.3,-10.4,18.4,-2.1,547.6,552.4,414.3,490.5,490.5,501
14D50,14,8.69627992,"Golden Glade Estates, Langston and Almeda Genoa",9000,Burglary,91,58,59,46,3,44,254,63.5,-35.2,-51.6,-25.4,-30.7,1011.1,644.4,655.6,511.1,488.9,705.6
15E10,15,4.34996776,"Meyerland Plaza, Robindell, Meyerland, Braeburn Terrace and Maplewood South",24000,Burglary,201,102,122,125,10,120,550,137.5,-39.3,-40.3,-1.6,-12.7,837.5,425,508.3,520.8,500,572.9
15E20,15,3.58384499,"Westbury, Park West and Willow Creek",18000,Burglary,102,69,91,49,5,48,311,77.8,-10.8,-52.9,-47.3,-38.3,566.7,383.3,505.6,272.2,266.7,432.2
15E30,15,6.29133294,"Meyer Park, Post Oak Manor, Westwood, Willow Bend and Linkwood",34000,Burglary,269,210,165,149,12,144,793,198.2,-38.7,-46.5,-12.7,-27.3,791.2,617.6,485.3,438.2,423.5,582.9
15E40,15,10.0079174,"NRG Park, Astroworld, Lakes at 610 and Plaza del Oro",30000,Burglary,350,288,248,369,46,377,1255,313.8,-29.1,7.7,52,20.1,1166.7,960,826.7,1230,1256.7,1046
16E10,16,5.38940818,Canterbury Village and Monarch Estates,15000,Burglary,85,49,34,40,5,40,208,52,-60,-52.9,17.6,-23.1,566.7,326.7,226.7,266.7,266.7,346.7
16E20,16,8.15202134,"Almeda Plaza, South Glen, Dumbarton Oaks and Briarwick",35000,Burglary,114,114,111,116,20,120,455,113.8,-2.6,5.3,8.1,5.4,325.7,325.7,317.1,331.4,342.9,325.1
16E30,16,7.00932789,"Greenpark, Southwest Crossing and Windsor Village",22000,Burglary,93,95,90,63,5,64,341,85.2,-3.2,-31.2,-28.9,-24.9,422.7,431.8,409.1,286.4,290.9,387.3
16E40,16,7.49721482,"Chasewood, Willowpark, Briarwick, Ridgemont and Quail Run",35000,Burglary,130,105,92,73,13,75,400,100,-29.2,-42.3,-18.5,-25,371.4,300,262.9,208.6,214.3,285.7
17E10,17,3.3104034,"Southwest Memorial Hospital, Burnett Bayland Park and Westmoreland",51000,Burglary,317,244,290,362,59,381,1213,303.2,-8.5,20.2,31.4,25.7,621.6,478.4,568.6,709.8,747.1,594.5
17E20,17,3.92767309,the Houston Baptist University area and Maplewood West,27000,Burglary,159,119,106,105,19,114,489,122.2,-33.3,-28.3,7.5,-6.7,588.9,440.7,392.6,388.9,422.2,452.6
17E30,17,3.8060455,Braeburn Valley West and Glenshire,21000,Burglary,121,162,142,113,14,112,538,134.5,17.4,-7.4,-21.1,-16.7,576.2,771.4,676.2,538.1,533.3,640.5
17E40,17,4.70920035,"Creekbend, Southwood and Fondren Southwest",46000,Burglary,290,279,252,226,24,226,1047,261.8,-13.1,-22.1,-10.3,-13.7,630.4,606.5,547.8,491.3,491.3,569.1
18F10,18,1.95881352,"Saddlebrook, Bayou Woods and Sherwood Forest",7000,Burglary,51,51,46,45,5,41,193,48.2,-9.8,-19.6,-10.9,-14.9,728.6,728.6,657.1,642.9,585.7,688.6
18F20,18,3.51641691,"The Galleria, Tanglewood, Riverway and Post Oak",24000,Burglary,212,177,186,134,8,130,709,177.2,-12.3,-38.7,-30.1,-26.6,883.3,737.5,775,558.3,541.7,738.3
18F30,18,3.80008564,"The Richmond Strip, Briargrove, Post Oak Estates and Westhaven",36000,Burglary,303,296,264,229,36,239,1092,273,-12.9,-21.1,-9.5,-12.5,841.7,822.2,733.3,636.1,663.9,758.3
18F40,18,2.9060249,"Rosewood General Hospital, Woodlake and Briarmeadow",35000,Burglary,392,450,367,412,41,410,1621,405.2,-6.4,4.6,11.7,1.2,1120,1285.7,1048.6,1177.1,1171.4,1157.7
18F50,18,2.96939217,"Tanglewild, Sharpstown Mall and Regency Square",20000,Burglary,234,250,215,196,22,201,895,223.8,-8.1,-14.1,-6.5,-10.2,1170,1250,1075,980,1005,1119
18F60,18,3.62528697,Sharpstown Country Club and Southway Center,28000,Burglary,191,186,142,163,17,163,682,170.5,-25.7,-14.7,14.8,-4.4,682.1,664.3,507.1,582.1,582.1,608.9
19G10,19,2.74020376,Concourse South and Westwood Mall,31000,Burglary,280,269,230,284,30,291,1063,265.8,-17.9,3.9,26.5,9.5,903.2,867.7,741.9,916.1,938.7,857.4
19G20,19,3.29219023,"Catalina Square, Bellaire West, Imperial Point",25000,Burglary,150,135,152,144,12,139,581,145.2,1.3,-7.3,-8.6,-4.3,600,540,608,576,556,580.8
19G30,19,2.49064202,"Rodeo Square, Wildflower Green, Braewood Glen",18000,Burglary,107,102,84,61,9,62,354,88.5,-21.5,-42.1,-26.2,-29.9,594.4,566.7,466.7,338.9,344.4,491.7
19G40,19,4.56425364,"Huntington Village, Wellington Park, Leawood, Keegans Glen",37000,Burglary,212,183,167,146,13,136,708,177,-21.2,-35.8,-18.6,-23.2,573,494.6,451.4,394.6,367.6,478.4
19G50,19,2.30578624,"Forum Park, Stancliff and Southwest Park",18000,Burglary,117,148,137,131,16,117,533,133.2,17.1,0,-14.6,-12.2,650,822.2,761.1,727.8,650,740
20G10,20,3.06600809,"Westchase, Woodchase Village and Point West",29000,Burglary,291,288,214,238,45,263,1031,257.8,-26.5,-9.6,22.9,2,1003.4,993.1,737.9,820.7,906.9,889
20G20,20,3.27621655,"Lakeside Estates, City West Place, Rivercrest and Briargrove Park",18000,Burglary,140,99,85,76,14,77,400,100,-39.3,-45,-9.4,-23,777.8,550,472.2,422.2,427.8,555.6
20G30,20,3.97953501,"West Houston Medical Center, Andrau Airport, Westchase and Westchase Mall",26000,Burglary,312,253,278,225,26,223,1068,267,-10.9,-28.5,-19.8,-16.5,1200,973.1,1069.2,865.4,857.7,1026.9
20G40,20,4.16594899,"Lakeview Forest, Lakeside Place, Ashford Village and Southlake",28000,Burglary,278,230,180,184,29,193,872,218,-35.3,-30.6,7.2,-11.5,992.9,821.4,642.9,657.1,689.3,778.6
20G70,20,2.38283582,Westpark Village and Ashford Point,21000,Burglary,143,157,175,119,14,122,594,148.5,22.4,-14.7,-30.3,-17.8,681,747.6,833.3,566.7,581,707.1
20G80,20,25.33626534,City Limits,37000,Burglary,374,321,298,299,34,295,1292,323,-20.3,-21.1,-1,-8.7,1010.8,867.6,805.4,808.1,797.3,873
21I10,21,0.00549966,Intercontinental Airport,0,Burglary,0,1,0,0,0,0,1,0.2,NA,NA,NA,-100,NA,NA,NA,NA,NA,NA
21I20,21,0.01205019,Intercontinental Airport,0,Burglary,0,0,0,1,0,1,1,0.2,NA,NA,NA,400,NA,NA,NA,NA,NA,NA
21I30,21,0.01180375,Intercontinental Airport,0,Burglary,0,0,0,0,0,0,0,0,NA,NA,NA,NA,NA,NA,NA,NA,NA,NA
21I40,21,0.00923163,Intercontinental Airport,0,Burglary,0,0,0,0,0,0,0,0,NA,NA,NA,NA,NA,NA,NA,NA,NA,NA
21I50,21,14.61100076,Intercontinental Airport,0,Burglary,1,1,5,5,0,5,12,3,400,400,0,66.7,NA,NA,NA,NA,NA,NA
21I70,21,0.01945113,Intercontinental Airport,0,Burglary,0,0,0,0,0,0,0,0,NA,NA,NA,NA,NA,NA,NA,NA,NA,NA
22B10,22,3.28874287,"Willowbrook, Willow Chase Park and Centerfield",8000,Burglary,88,111,120,77,3,72,396,99,36.4,-18.2,-40,-27.3,1100,1387.5,1500,962.5,900,1237.5
5F20,5,5.94082911,Spring Branch and Schwartz Park,42000,Burglary,219,185,157,159,26,170,720,180,-28.3,-22.4,8.3,-5.6,521.4,440.5,373.8,378.6,404.8,428.6
4F10,4,4.13606469,"Timber Oaks, Shadow Oaks and Long Point Acres",23000,Burglary,139,162,137,103,13,101,541,135.2,-1.4,-27.3,-26.3,-25.3,604.3,704.3,595.7,447.8,439.1,587.8
20G50,20,5.88593521,"Nottingham, Yorkshire, Wilchester, Town and Country Village and Memorial City Shopping Center",30000,Burglary,143,107,100,77,13,84,427,106.8,-30.1,-41.3,-16,-21.3,476.7,356.7,333.3,256.7,280,356
4F20,4,5.85840284,"Claymore Park, Westbranch, Spring Shadows and Kempwood Forest",28000,Burglary,147,118,112,94,19,102,471,117.8,-23.8,-30.6,-8.9,-13.4,525,421.4,400,335.7,364.3,420.7
20G60,20,4.54207617,"Barkers Landing, Fleetwood, Thornwood and Darrel Tully Stadium",22000,Burglary,136,155,124,109,6,107,524,131,-8.8,-21.3,-13.7,-18.3,618.2,704.5,563.6,495.5,486.4,595.5
4F30,4,26.30690179,"Addicks Reservoir Area, Claymore Park, Brittmore Village, Park Ten Place and Mayde Creek Farms",18000,Burglary,160,129,128,90,11,93,507,126.8,-20,-41.9,-27.3,-26.7,888.9,716.7,711.1,500,516.7,704.4
24C10,24,5.44044978,Kingwood,13000,Burglary,55,46,38,56,3,52,195,48.8,-30.9,-5.5,36.8,6.6,423.1,353.8,292.3,430.8,400,375.4
24C20,24,6.8291794,Kingwood,18000,Burglary,37,31,28,17,0,15,113,28.2,-24.3,-59.5,-46.4,-46.8,205.6,172.2,155.6,94.4,83.3,156.7
24C30,24,9.78735527,Kingwood,29000,Burglary,49,36,34,31,3,25,150,37.5,-30.6,-49,-26.5,-33.3,169,124.1,117.2,106.9,86.2,129.3
24C40,24,35.7992771,Kingwood,6000,Burglary,37,28,19,31,0,25,115,28.8,-48.6,-32.4,31.6,-13.2,616.7,466.7,316.7,516.7,416.7,480
24C50,24,7.51791807,Kingwood,5000,Burglary,65,45,51,47,2,45,208,52,-21.5,-30.8,-11.8,-13.5,1300,900,1020,940,900,1040
24C60,24,4.86823328,Kingwood,21000,Burglary,28,14,6,5,1,4,53,13.2,-78.6,-85.7,-33.3,-69.7,133.3,66.7,28.6,23.8,19,62.9
21I60,21,0.01236886,Intercontinental Airport,0,Burglary,0,0,0,0,0,0,0,0,NA,NA,NA,NA,NA,NA,NA,NA,NA,NA
FTB4,NA,NA,NA,NA,Burglary,0,0,0,0,0,0,0,0,NA,NA,NA,NA,NA,NA,NA,NA,NA,NA
HCC1,NA,NA,NA,NA,Burglary,0,0,0,0,0,0,0,0,NA,NA,NA,NA,NA,NA,NA,NA,NA,NA
HCC4,NA,NA,NA,NA,Burglary,0,0,0,0,0,0,0,0,NA,NA,NA,NA,NA,NA,NA,NA,NA,NA
HCC5,NA,NA,NA,NA,Burglary,0,0,0,0,0,0,0,0,NA,NA,NA,NA,NA,NA,NA,NA,NA,NA
HCC7,NA,NA,NA,NA,Burglary,0,0,0,0,0,0,0,0,NA,NA,NA,NA,NA,NA,NA,NA,NA,NA
HCSO,NA,NA,NA,NA,Burglary,17,16,4,5,3,8,42,10.5,-76.5,-52.9,100,-23.8,NA,NA,NA,NA,NA,NA
OOJ,NA,NA,NA,NA,Burglary,23,37,4,5,5,10,69,17.2,-82.6,-56.5,150,-41.9,NA,NA,NA,NA,NA,NA
UH-2PD,NA,NA,NA,NA,Burglary,0,0,0,0,0,0,0,0,NA,NA,NA,NA,NA,NA,NA,NA,NA,NA
UH-3PD,NA,NA,NA,NA,Burglary,0,0,0,0,0,0,0,0,NA,NA,NA,NA,NA,NA,NA,NA,NA,NA
Unknown,NA,NA,NA,NA,Burglary,6,2,1,3,0,3,12,3,-83.3,-50,200,0,NA,NA,NA,NA,NA,NA
