beat,district,area_sq_mi,placename,population,category_name,total19,total20,total21,total22,total23,last12mos,total_prior4years,avg_prior4years,inc_19to22,inc_19tolast12,inc_22tolast12,inc_prior4yearavgtolast12,rate19,rate20,rate21,rate22,rate_last12,rate_prior4years,previous_year
23J40,23,3.03933481,Ellington Field,0,Burglary,1,0,0,0,0,0,1,0.2,-100,-100,NA,-100,NA,NA,NA,NA,NA,NA,0
23J50,23,2.12389492,Hobby Airport,0,Burglary,4,0,0,1,1,1,5,1.2,-75,-75,0,-16.7,NA,NA,NA,NA,NA,NA,1
1A10,1,1.74646692,Downtown Central Business District,17000,Burglary,76,77,65,86,106,118,304,76,13.2,55.3,37.2,55.3,447.1,452.9,382.4,505.9,694.1,447.1,86
1A20,1,2.44133075,"Fourth Ward, Avondale and Westmoreland",27000,Burglary,309,304,217,211,172,206,1041,260.2,-31.7,-33.3,-2.4,-20.8,1144.4,1125.9,803.7,781.5,763,963.7,211
1A30,1,2.65916892,"Cherryhurst, Mandell Place and Montrose",27000,Burglary,236,205,182,140,149,169,763,190.8,-40.7,-28.4,20.7,-11.4,874.1,759.3,674.1,518.5,625.9,706.7,140
1A40,1,2.45016686,"Tall Timbers, Royden Oaks, River Oaks, Avalon Place and Oak Estates",7000,Burglary,31,29,20,14,17,17,94,23.5,-54.8,-45.2,21.4,-27.7,442.9,414.3,285.7,200,242.9,335.7,14
1A50,1,3.04553452,"Post Oak Park, Afton Oaks, Highland Village, Weslayan, Greenway Plaza and The Compaq Center",26000,Burglary,240,212,142,166,130,154,760,190,-30.8,-35.8,-7.2,-18.9,923.1,815.4,546.2,638.5,592.3,730.8,166
2A10,2,3.30928608,Irvington and Ryon,18000,Burglary,131,116,118,170,147,158,535,133.8,29.8,20.6,-7.1,18.1,727.8,644.4,655.6,944.4,877.8,743.3,170
2A20,2,1.8876461,"Sunset Heights, Brooksmith and Stude",11000,Burglary,94,77,80,75,70,82,326,81.5,-20.2,-12.8,9.3,0.6,854.5,700,727.3,681.8,745.5,740.9,75
2A30,2,4.65858171,"Houston Heights, Norhill and Studemont",31000,Burglary,276,175,142,155,103,118,748,187,-43.8,-57.2,-23.9,-36.9,890.3,564.5,458.1,500,380.6,603.2,155
2A40,2,1.60546103,Old Sixth Ward and the First Ward,8000,Burglary,79,65,61,50,38,40,255,63.8,-36.7,-49.4,-20,-37.3,987.5,812.5,762.5,625,500,797.5,50
2A50,2,5.4659844,"Memorial Park, West End, Ashbury and Cottage Grove",29000,Burglary,214,130,150,135,98,117,629,157.2,-36.9,-45.3,-13.3,-25.6,737.9,448.3,517.2,465.5,403.4,542.1,135
2A60,2,4.67447346,"Westport, Holly Park, Lazy Brook, Citadel, Shady Acres and Timbergrove",21000,Burglary,139,133,134,147,90,103,553,138.2,5.8,-25.9,-29.9,-25.5,661.9,633.3,638.1,700,490.5,658.1,147
3B10,3,6.82068773,"Northwest Mall, Brookhollow, White Oak Acres, Oak Forest and Langwood",34000,Burglary,309,336,336,354,291,349,1335,333.8,14.6,12.9,-1.4,4.6,908.8,988.2,988.2,1041.2,1026.5,981.8,354
3B30,3,5.310372,"White Oak Acres, Brook Hollow, Oak Forest, Garden Oaks and Shepherd Park Plaza",23000,Burglary,131,133,140,113,98,110,517,129.2,-13.7,-16,-2.7,-14.9,569.6,578.3,608.7,491.3,478.3,561.7,113
3B40,3,3.40013561,"Independence Heights, Melrose and Graceland",13000,Burglary,183,191,183,127,134,148,684,171,-30.6,-19.1,16.5,-13.5,1407.7,1469.2,1407.7,976.9,1138.5,1315.4,127
3B50,3,3.85259517,"Northline Mall, Stratton Place, Oakwood, Colonial Gardens, Lindale and Junction City",20000,Burglary,154,143,137,142,161,176,576,144,-7.8,14.3,23.9,22.2,770,715,685,710,880,720,142
5F10,5,3.25978513,Afton Village and Pine Terrace,14000,Burglary,124,98,119,125,92,98,466,116.5,0.8,-21,-21.6,-15.9,885.7,700,850,892.9,700,832.1,125
5F30,5,8.70689439,"Fairbanks, Carverdale, Fawndale and Northwest Crossing",17000,Burglary,235,227,218,193,270,293,873,218.2,-17.9,24.7,51.8,34.3,1382.4,1335.3,1282.4,1135.3,1723.5,1283.5,193
6B10,6,5.50084827,"York Plaza, Pembrook Place and Hawthorne Place",33000,Burglary,175,156,178,188,170,196,697,174.2,7.4,12,4.3,12.5,530.3,472.7,539.4,569.7,593.9,527.9,188
6B20,6,6.12869477,"Highland Heights, Oakdale and Melrose Gardens",18000,Burglary,169,192,132,164,125,136,657,164.2,-3,-19.5,-17.1,-17.2,938.9,1066.7,733.3,911.1,755.6,912.2,164
6B30,6,7.2300685,"Woodland Trails, Oaks of Inwood, Bayou Bend, Cole Creek Manor and Inwood Forest",38000,Burglary,219,212,123,202,182,199,756,189,-7.8,-9.1,-1.5,5.3,576.3,557.9,323.7,531.6,523.7,497.4,202
6B40,6,5.544689,"Highland Gardens, Highland Heights and North Plaza",20000,Burglary,149,190,124,135,103,109,598,149.5,-9.4,-26.8,-19.3,-27.1,745,950,620,675,545,747.5,135
22B30,22,2.8264671,Aldine and Imperial Valley,19000,Burglary,137,171,122,125,103,122,555,138.8,-8.8,-10.9,-2.4,-12.1,721.1,900,642.1,657.9,642.1,730.5,125
22B20,22,4.61158268,Greenspoint,24000,Burglary,278,276,269,260,267,292,1083,270.8,-6.5,5,12.3,7.8,1158.3,1150,1120.8,1083.3,1216.7,1128.3,260
7C10,7,3.47828324,"Fifth Ward, North Park and Pinecrest",13000,Burglary,145,126,121,148,119,134,540,135,2.1,-7.6,-9.5,-0.7,1115.4,969.2,930.8,1138.5,1030.8,1038.5,148
7C20,7,7.08575157,"Huntington Place, Willshire Place, Kashmere Gardens and Liberty Gardens",21000,Burglary,256,243,289,227,220,263,1015,253.8,-11.3,2.7,15.9,3.6,1219,1157.1,1376.2,1081,1252.4,1208.6,227
7C30,7,4.51719841,"Camden Woods, Archers Acres and Croyden Gardens",18000,Burglary,155,159,117,136,114,126,567,141.8,-12.3,-18.7,-7.4,-11.1,861.1,883.3,650,755.6,700,787.8,136
7C40,7,3.36786526,Keith-Weiss Park and Farrington Place,8000,Burglary,45,56,47,40,40,43,188,47,-11.1,-4.4,7.5,-8.5,562.5,700,587.5,500,537.5,587.5,40
22B40,22,13.03325001,"Intercontinental Airport, Northwood, Lakeview Park and Glen Lee",11000,Burglary,119,112,126,133,87,105,490,122.5,11.8,-11.8,-21.1,-14.3,1081.8,1018.2,1145.5,1209.1,954.5,1113.6,133
8C10,8,3.69037316,"Tidwell Park, Shady Oak and Buckingham Place",12000,Burglary,182,95,142,117,130,146,536,134,-35.7,-19.8,24.8,9,1516.7,791.7,1183.3,975,1216.7,1116.7,117
8C20,8,3.36154214,"Houston Gardens, Rosewood and Homestead",7000,Burglary,69,47,61,59,73,84,236,59,-14.5,21.7,42.4,42.4,985.7,671.4,871.4,842.9,1200,842.9,59
8C30,8,4.6258259,"Parkhurst, East Houston and Clairmont Place",11000,Burglary,112,83,84,103,145,153,382,95.5,-8,36.6,48.5,60.2,1018.2,754.5,763.6,936.4,1390.9,868.2,103
8C40,8,4.97945551,"Lake Houston, Greenriver, Knoll and Lake Forest",8000,Burglary,54,32,27,25,41,43,138,34.5,-53.7,-20.4,72,24.6,675,400,337.5,312.5,537.5,431.3,25
8C50,8,3.31739498,"Park North, Forest Green, Kentshire Place, Glenwood Forest and Dorchester",8000,Burglary,93,58,59,84,76,85,294,73.5,-9.7,-8.6,1.2,15.6,1162.5,725,737.5,1050,1062.5,918.8,84
8C60,8,5.79693312,"Edgeworth, Northwood Manor and Scenic Woods",19000,Burglary,140,102,109,116,88,98,467,116.8,-17.1,-30,-15.5,-16.1,736.8,536.8,573.7,610.5,515.8,614.7,116
9C10,9,5.21185619,"Port of Houston, Clinton Park, Pleasantville and Fidelity Manor",6000,Burglary,36,33,40,48,43,52,157,39.2,33.3,44.4,8.3,32.7,600,550,666.7,800,866.7,653.3,48
9C20,9,7.5383173,Denver Harbor and Houston Harbor,16000,Burglary,109,91,70,117,91,111,387,96.8,7.3,1.8,-5.1,14.7,681.2,568.8,437.5,731.2,693.8,605,117
9C30,9,8.13353768,"City Park East, Wynnewood Acres and Wallisville Gardens",9000,Burglary,54,72,50,39,52,53,215,53.8,-27.8,-1.9,35.9,-1.5,600,800,555.6,433.3,588.9,597.8,39
9C40,9,10.42549456,"Greens Bayou Estates, Shady Brook, Northshore",23000,Burglary,188,181,163,226,154,189,758,189.5,20.2,0.5,-16.4,-0.3,817.4,787,708.7,982.6,821.7,823.9,226
10H10,10,2.81830654,Oak Lawn and Ranger,11000,Burglary,53,87,64,61,64,67,265,66.2,15.1,26.4,9.8,1.2,481.8,790.9,581.8,554.5,609.1,601.8,61
10H20,10,1.75743169,Eastwood and Broadmoor,10000,Burglary,62,86,59,64,55,60,271,67.8,3.2,-3.2,-6.2,-11.5,620,860,590,640,600,678,64
10H30,10,1.02691154,Near East End,4000,Burglary,51,50,47,58,72,83,206,51.5,13.7,62.7,43.1,61.2,1275,1250,1175,1450,2075,1287.5,58
10H40,10,0.99627062,Midtown,8000,Burglary,141,151,102,141,90,119,535,133.8,0,-15.6,-15.6,-11.1,1762.5,1887.5,1275,1762.5,1487.5,1672.5,141
10H50,10,2.30843079,the University of Houston area,13000,Burglary,187,188,158,142,126,135,675,168.8,-24.1,-27.8,-4.9,-20,1438.5,1446.2,1215.4,1092.3,1038.5,1298.5,142
10H60,10,3.08931006,"University Oaks, Riverside Terrace and the Texas Southern University area",20000,Burglary,137,124,141,112,117,130,514,128.5,-18.2,-5.1,16.1,1.2,685,620,705,560,650,642.5,112
10H70,10,3.52217952,"Texas Medical Center, Hermann Park, Houston Zoo and Miller Outdoor Theatre",16000,Burglary,154,136,111,108,63,71,509,127.2,-29.9,-53.9,-34.3,-44.2,962.5,850,693.8,675,443.7,795,108
10H80,10,2.73862779,"Southampton, Rice University area, Shadow Lawn and Broad Acres",19000,Burglary,119,101,87,71,54,61,378,94.5,-40.3,-48.7,-14.1,-35.4,626.3,531.6,457.9,373.7,321.1,497.4,71
11H10,11,5.31502815,"Mason Park, Forest Hill, Sunnyland and Central Park",28000,Burglary,177,176,125,153,121,143,631,157.8,-13.6,-19.2,-6.5,-9.4,632.1,628.6,446.4,546.4,510.7,563.6,153
11H20,11,3.9311161,"Harrisburg, Manchester and Pecan Park",18000,Burglary,55,62,62,81,76,86,260,65,47.3,56.4,6.2,32.3,305.6,344.4,344.4,450,477.8,361.1,81
11H30,11,2.84278059,Meadow Brook and Park Place,15000,Burglary,102,74,75,71,81,91,322,80.5,-30.4,-10.8,28.2,13,680,493.3,500,473.3,606.7,536.7,71
11H40,11,6.14001938,Allendale and Oak Meadows,8000,Burglary,34,22,17,18,18,19,91,22.8,-47.1,-44.1,5.6,-16.7,425,275,212.5,225,237.5,285,18
11H50,11,2.09534157,"Meadow Creek, Ferndale Addition and Glenbrook Industrial",8000,Burglary,42,37,45,50,51,58,174,43.5,19,38.1,16,33.3,525,462.5,562.5,625,725,543.8,50
12D10,12,8.55384717,"Almeda Mall, Southridge, Edgebrook and South Houston Gardens",44000,Burglary,289,285,289,324,154,180,1187,296.8,12.1,-37.7,-44.4,-39.4,656.8,647.7,656.8,736.4,409.1,674.5,324
12D20,12,3.83700574,Sagemont,22000,Burglary,131,131,170,158,62,80,590,147.5,20.6,-38.9,-49.4,-45.8,595.5,595.5,772.7,718.2,363.6,670.5,158
12D30,12,3.99301158,Gulf Palms and Beamer,15000,Burglary,62,79,48,59,50,52,248,62,-4.8,-16.1,-11.9,-16.1,413.3,526.7,320,393.3,346.7,413.3,59
12D40,12,9.68663455,Scarsdale and Ellington Field,11000,Burglary,75,68,79,91,42,50,313,78.2,21.3,-33.3,-45.1,-36.1,681.8,618.2,718.2,827.3,454.5,710.9,91
12D50,12,8.93327581,"Bay Glen, Bay Oaks, Brook Forest and Bay Forest",26000,Burglary,41,32,32,42,33,34,147,36.8,2.4,-17.1,-19,-7.6,157.7,123.1,123.1,161.5,130.8,141.5,42
12D60,12,6.35832041,"NASA's Johnson Space Center, Meadow Green, Oakbrook West and Camino South",22000,Burglary,76,62,85,33,61,65,256,64,-56.6,-14.5,97,1.6,345.5,281.8,386.4,150,295.5,290.9,33
12D70,12,5.39156317,Baybrook Mall and Sterling Knoll,12000,Burglary,82,90,96,112,72,84,380,95,36.6,2.4,-25,-11.6,683.3,750,800,933.3,700,791.7,112
13D10,13,5.2433708,"Gulfgate Mall, Bay Forest, Riverview, Hampshire, Golfcrest and Barnett Stadium",23000,Burglary,166,171,116,115,79,100,568,142,-30.7,-39.8,-13,-29.6,721.7,743.5,504.3,500,434.8,617.4,115
13D20,13,6.66870859,"Fairlawn, Garden Villas, Glenbrook Valley and Santa Rosa",36000,Burglary,328,256,243,277,223,249,1104,276,-15.5,-24.1,-10.1,-9.8,911.1,711.1,675,769.4,691.7,766.7,277
13D30,13,3.07402543,"Allen Farms, Airport Gardens and the Hobby Airport area",2000,Burglary,12,10,13,12,12,15,47,11.8,0,25,25,27.1,600,500,650,600,750,590,12
13D40,13,5.0688163,"Val Verde East, Gulf Meadows and Houston Skyscraper Shadows",13000,Burglary,66,77,35,72,42,56,250,62.5,9.1,-15.2,-22.2,-10.4,507.7,592.3,269.2,553.8,430.8,480.8,72
14D10,14,3.66057918,McGregor Terrace and Riverside Terrace,17000,Burglary,242,205,126,177,152,178,750,187.5,-26.9,-26.4,0.6,-5.1,1423.5,1205.9,741.2,1041.2,1047.1,1102.9,177
14D20,14,7.25646368,"Sunnyside, Brook Haven and Bayou Estates",28000,Burglary,409,291,285,268,234,279,1253,313.2,-34.5,-31.8,4.1,-10.9,1460.7,1039.3,1017.9,957.1,996.4,1118.6,268
14D30,14,4.20537595,"Crestmont, Edgewood, Bellfort Park, Inwood Terrace and Southpark",21000,Burglary,184,155,126,157,134,157,622,155.5,-14.7,-14.7,0,1,876.2,738.1,600,747.6,747.6,740.5,157
14D40,14,6.61224595,"South Acres, Shamrock Manor, Hillwood and Cloverland",21000,Burglary,115,116,87,103,134,141,421,105.2,-10.4,22.6,36.9,34,547.6,552.4,414.3,490.5,671.4,501,103
14D50,14,8.69627992,"Golden Glade Estates, Langston and Almeda Genoa",9000,Burglary,91,58,59,46,34,42,254,63.5,-49.5,-53.8,-8.7,-33.9,1011.1,644.4,655.6,511.1,466.7,705.6,46
15E10,15,4.34996776,"Meyerland Plaza, Robindell, Meyerland, Braeburn Terrace and Maplewood South",24000,Burglary,201,102,122,125,89,106,550,137.5,-37.8,-47.3,-15.2,-22.9,837.5,425,508.3,520.8,441.7,572.9,125
15E20,15,3.58384499,"Westbury, Park West and Willow Creek",18000,Burglary,102,69,91,49,39,46,311,77.8,-52,-54.9,-6.1,-40.9,566.7,383.3,505.6,272.2,255.6,432.2,49
15E30,15,6.29133294,"Meyer Park, Post Oak Manor, Westwood, Willow Bend and Linkwood",34000,Burglary,269,210,165,149,128,142,793,198.2,-44.6,-47.2,-4.7,-28.4,791.2,617.6,485.3,438.2,417.6,582.9,149
15E40,15,10.0079174,"NRG Park, Astroworld, Lakes at 610 and Plaza del Oro",30000,Burglary,350,288,248,369,296,339,1255,313.8,5.4,-3.1,-8.1,8,1166.7,960,826.7,1230,1130,1046,369
16E10,16,5.38940818,Canterbury Village and Monarch Estates,15000,Burglary,85,49,34,40,39,41,208,52,-52.9,-51.8,2.5,-21.2,566.7,326.7,226.7,266.7,273.3,346.7,40
16E20,16,8.15202134,"Almeda Plaza, South Glen, Dumbarton Oaks and Briarwick",35000,Burglary,114,114,111,116,122,142,455,113.8,1.8,24.6,22.4,24.8,325.7,325.7,317.1,331.4,405.7,325.1,116
16E30,16,7.00932789,"Greenpark, Southwest Crossing and Windsor Village",22000,Burglary,93,95,90,63,74,79,341,85.2,-32.3,-15.1,25.4,-7.3,422.7,431.8,409.1,286.4,359.1,387.3,63
16E40,16,7.49721482,"Chasewood, Willowpark, Briarwick, Ridgemont and Quail Run",35000,Burglary,130,105,92,73,60,61,400,100,-43.8,-53.1,-16.4,-39,371.4,300,262.9,208.6,174.3,285.7,73
17E10,17,3.3104034,"Southwest Memorial Hospital, Burnett Bayland Park and Westmoreland",51000,Burglary,317,244,290,362,298,338,1213,303.2,14.2,6.6,-6.6,11.5,621.6,478.4,568.6,709.8,662.7,594.5,362
17E20,17,3.92767309,the Houston Baptist University area and Maplewood West,27000,Burglary,159,119,106,105,103,115,489,122.2,-34,-27.7,9.5,-5.9,588.9,440.7,392.6,388.9,425.9,452.6,105
17E30,17,3.8060455,Braeburn Valley West and Glenshire,21000,Burglary,121,162,142,113,111,124,538,134.5,-6.6,2.5,9.7,-7.8,576.2,771.4,676.2,538.1,590.5,640.5,113
17E40,17,4.70920035,"Creekbend, Southwood and Fondren Southwest",46000,Burglary,290,279,252,226,218,241,1047,261.8,-22.1,-16.9,6.6,-7.9,630.4,606.5,547.8,491.3,523.9,569.1,226
18F10,18,1.95881352,"Saddlebrook, Bayou Woods and Sherwood Forest",7000,Burglary,51,51,46,45,34,42,193,48.2,-11.8,-17.6,-6.7,-12.9,728.6,728.6,657.1,642.9,600,688.6,45
18F20,18,3.51641691,"The Galleria, Tanglewood, Riverway and Post Oak",24000,Burglary,212,177,186,134,89,111,709,177.2,-36.8,-47.6,-17.2,-37.4,883.3,737.5,775,558.3,462.5,738.3,134
18F30,18,3.80008564,"The Richmond Strip, Briargrove, Post Oak Estates and Westhaven",36000,Burglary,303,296,264,229,212,241,1092,273,-24.4,-20.5,5.2,-11.7,841.7,822.2,733.3,636.1,669.4,758.3,229
18F40,18,2.9060249,"Rosewood General Hospital, Woodlake and Briarmeadow",35000,Burglary,392,450,367,412,320,366,1621,405.2,5.1,-6.6,-11.2,-9.7,1120,1285.7,1048.6,1177.1,1045.7,1157.7,412
18F50,18,2.96939217,"Tanglewild, Sharpstown Mall and Regency Square",20000,Burglary,234,250,215,196,167,184,895,223.8,-16.2,-21.4,-6.1,-17.8,1170,1250,1075,980,920,1119,196
18F60,18,3.62528697,Sharpstown Country Club and Southway Center,28000,Burglary,191,186,142,163,170,192,682,170.5,-14.7,0.5,17.8,12.6,682.1,664.3,507.1,582.1,685.7,608.9,163
19G10,19,2.74020376,Concourse South and Westwood Mall,31000,Burglary,280,269,230,284,192,213,1063,265.8,1.4,-23.9,-25,-19.9,903.2,867.7,741.9,916.1,687.1,857.4,284
19G20,19,3.29219023,"Catalina Square, Bellaire West, Imperial Point",25000,Burglary,150,135,152,144,113,137,581,145.2,-4,-8.7,-4.9,-5.6,600,540,608,576,548,580.8,144
19G30,19,2.49064202,"Rodeo Square, Wildflower Green, Braewood Glen",18000,Burglary,107,102,84,61,63,71,354,88.5,-43,-33.6,16.4,-19.8,594.4,566.7,466.7,338.9,394.4,491.7,61
19G40,19,4.56425364,"Huntington Village, Wellington Park, Leawood, Keegans Glen",37000,Burglary,212,183,167,146,112,121,708,177,-31.1,-42.9,-17.1,-31.6,573,494.6,451.4,394.6,327,478.4,146
19G50,19,2.30578624,"Forum Park, Stancliff and Southwest Park",18000,Burglary,117,148,137,131,106,123,533,133.2,12,5.1,-6.1,-7.7,650,822.2,761.1,727.8,683.3,740,131
20G10,20,3.06600809,"Westchase, Woodchase Village and Point West",29000,Burglary,291,288,214,238,206,247,1031,257.8,-18.2,-15.1,3.8,-4.2,1003.4,993.1,737.9,820.7,851.7,889,238
20G20,20,3.27621655,"Lakeside Estates, City West Place, Rivercrest and Briargrove Park",18000,Burglary,140,99,85,76,55,61,400,100,-45.7,-56.4,-19.7,-39,777.8,550,472.2,422.2,338.9,555.6,76
20G30,20,3.97953501,"West Houston Medical Center, Andrau Airport, Westchase and Westchase Mall",26000,Burglary,312,253,278,225,150,171,1068,267,-27.9,-45.2,-24,-36,1200,973.1,1069.2,865.4,657.7,1026.9,225
20G40,20,4.16594899,"Lakeview Forest, Lakeside Place, Ashford Village and Southlake",28000,Burglary,278,230,180,184,148,169,872,218,-33.8,-39.2,-8.2,-22.5,992.9,821.4,642.9,657.1,603.6,778.6,184
20G70,20,2.38283582,Westpark Village and Ashford Point,21000,Burglary,143,157,175,119,102,123,594,148.5,-16.8,-14,3.4,-17.2,681,747.6,833.3,566.7,585.7,707.1,119
20G80,20,25.33626534,City Limits,37000,Burglary,374,321,298,299,171,198,1292,323,-20.1,-47.1,-33.8,-38.7,1010.8,867.6,805.4,808.1,535.1,873,299
21I10,21,0.00549966,Intercontinental Airport,0,Burglary,0,1,0,0,0,0,1,0.2,NA,NA,NA,-100,NA,NA,NA,NA,NA,NA,0
21I20,21,0.01205019,Intercontinental Airport,0,Burglary,0,0,0,1,0,0,1,0.2,NA,NA,-100,-100,NA,NA,NA,NA,NA,NA,1
21I30,21,0.01180375,Intercontinental Airport,0,Burglary,0,0,0,0,0,0,0,0,NA,NA,NA,NA,NA,NA,NA,NA,NA,NA,0
21I40,21,0.00923163,Intercontinental Airport,0,Burglary,0,0,0,0,0,0,0,0,NA,NA,NA,NA,NA,NA,NA,NA,NA,NA,0
21I50,21,14.61100076,Intercontinental Airport,0,Burglary,1,1,5,5,1,1,12,3,400,0,-80,-66.7,NA,NA,NA,NA,NA,NA,5
21I70,21,0.01945113,Intercontinental Airport,0,Burglary,0,0,0,0,0,0,0,0,NA,NA,NA,NA,NA,NA,NA,NA,NA,NA,0
22B10,22,3.28874287,"Willowbrook, Willow Chase Park and Centerfield",8000,Burglary,88,111,120,77,57,70,396,99,-12.5,-20.5,-9.1,-29.3,1100,1387.5,1500,962.5,875,1237.5,77
5F20,5,5.94082911,Spring Branch and Schwartz Park,42000,Burglary,219,185,157,159,140,159,720,180,-27.4,-27.4,0,-11.7,521.4,440.5,373.8,378.6,378.6,428.6,159
4F10,4,4.13606469,"Timber Oaks, Shadow Oaks and Long Point Acres",23000,Burglary,139,162,137,103,80,94,541,135.2,-25.9,-32.4,-8.7,-30.5,604.3,704.3,595.7,447.8,408.7,587.8,103
20G50,20,5.88593521,"Nottingham, Yorkshire, Wilchester, Town and Country Village and Memorial City Shopping Center",30000,Burglary,143,107,100,77,61,68,427,106.8,-46.2,-52.4,-11.7,-36.3,476.7,356.7,333.3,256.7,226.7,356,77
4F20,4,5.85840284,"Claymore Park, Westbranch, Spring Shadows and Kempwood Forest",28000,Burglary,147,118,112,94,88,98,471,117.8,-36.1,-33.3,4.3,-16.8,525,421.4,400,335.7,350,420.7,94
20G60,20,4.54207617,"Barkers Landing, Fleetwood, Thornwood and Darrel Tully Stadium",23000,Burglary,136,155,124,109,78,90,524,131,-19.9,-33.8,-17.4,-31.3,591.3,673.9,539.1,473.9,391.3,569.6,109
4F30,4,26.30690179,"Addicks Reservoir Area, Claymore Park, Brittmore Village, Park Ten Place and Mayde Creek Farms",18000,Burglary,160,129,128,90,83,96,507,126.8,-43.8,-40,6.7,-24.3,888.9,716.7,711.1,500,533.3,704.4,90
24C10,24,5.44044978,Kingwood,13000,Burglary,55,46,38,56,19,24,195,48.8,1.8,-56.4,-57.1,-50.8,423.1,353.8,292.3,430.8,184.6,375.4,56
24C20,24,6.8291794,Kingwood,18000,Burglary,37,31,28,17,14,16,113,28.2,-54.1,-56.8,-5.9,-43.3,205.6,172.2,155.6,94.4,88.9,156.7,17
24C30,24,9.78735527,Kingwood,29000,Burglary,49,36,34,31,23,24,150,37.5,-36.7,-51,-22.6,-36,169,124.1,117.2,106.9,82.8,129.3,31
24C40,24,35.7992771,Kingwood,6000,Burglary,37,28,19,31,14,22,115,28.8,-16.2,-40.5,-29,-23.6,616.7,466.7,316.7,516.7,366.7,480,31
24C50,24,7.51791807,Kingwood,5000,Burglary,65,45,51,47,34,36,208,52,-27.7,-44.6,-23.4,-30.8,1300,900,1020,940,720,1040,47
24C60,24,4.86823328,Kingwood,21000,Burglary,28,14,6,5,2,2,53,13.2,-82.1,-92.9,-60,-84.8,133.3,66.7,28.6,23.8,9.5,62.9,5
21I60,21,0.01236886,Intercontinental Airport,0,Burglary,0,0,0,0,0,0,0,0,NA,NA,NA,NA,NA,NA,NA,NA,NA,NA,0
