beat,district,area_sq_mi,placename,population,category_name,total19,total20,total21,total22,last12mos,total_prior3years,avg_prior3years,inc_19to21,inc_19tolast12,inc_21tolast12,inc_prior3yearavgtolast12,rate19,rate20,rate21,rate_last12,rate_prior3years
23J40,23,3.03933481,Ellington Field,0,Drug Offenses,0,0,0,0,0,0,0,NA,NA,NA,NA,NA,NA,NA,NA,NA
23J50,23,2.12389492,Hobby Airport,0,Drug Offenses,23,23,22,37,40,68,22.7,-4.3,73.9,81.8,76,NA,NA,NA,NA,NA
1A10,1,1.74646692,Downtown Central Business District,17000,Drug Offenses,116,133,217,128,168,466,155.3,87.1,44.8,-22.6,8,682.4,782.4,1276.5,988.2,913.5
1A20,1,2.44133075,"Fourth Ward, Avondale and Westmoreland",27000,Drug Offenses,106,88,72,68,82,266,88.7,-32.1,-22.6,13.9,-8,392.6,325.9,266.7,303.7,328.5
1A30,1,2.65916892,"Cherryhurst, Mandell Place and Montrose",27000,Drug Offenses,68,74,50,42,52,192,64,-26.5,-23.5,4,-19,251.9,274.1,185.2,192.6,237
1A40,1,2.45016686,"Tall Timbers, Royden Oaks, River Oaks, Avalon Place and Oak Estates",7000,Drug Offenses,7,8,4,3,3,19,6.3,-42.9,-57.1,-25,-52,100,114.3,57.1,42.9,90
1A50,1,3.04553452,"Post Oak Park, Afton Oaks, Highland Village, Weslayan, Greenway Plaza and The Compaq Center",26000,Drug Offenses,38,41,45,44,59,124,41.3,18.4,55.3,31.1,43,146.2,157.7,173.1,226.9,158.8
2A10,2,3.30928608,Irvington and Ryon,18000,Drug Offenses,220,157,124,97,113,501,167,-43.6,-48.6,-8.9,-32,1222.2,872.2,688.9,627.8,927.8
2A20,2,1.8876461,"Sunset Heights, Brooksmith and Stude",11000,Drug Offenses,116,71,71,37,46,258,86,-38.8,-60.3,-35.2,-47,1054.5,645.5,645.5,418.2,781.8
2A30,2,4.65858171,"Houston Heights, Norhill and Studemont",31000,Drug Offenses,52,51,38,32,40,141,47,-26.9,-23.1,5.3,-15,167.7,164.5,122.6,129,151.6
2A40,2,1.60546103,Old Sixth Ward and the First Ward,8000,Drug Offenses,39,29,23,31,37,91,30.3,-41,-5.1,60.9,22,487.5,362.5,287.5,462.5,378.8
2A50,2,5.4659844,"Memorial Park, West End, Ashbury and Cottage Grove",29000,Drug Offenses,63,40,52,52,59,155,51.7,-17.5,-6.3,13.5,14,217.2,137.9,179.3,203.4,178.3
2A60,2,4.67447346,"Westport, Holly Park, Lazy Brook, Citadel, Shady Acres and Timbergrove",21000,Drug Offenses,32,28,34,31,43,94,31.3,6.2,34.4,26.5,37,152.4,133.3,161.9,204.8,149
3B10,3,6.82068773,"Northwest Mall, Brookhollow, White Oak Acres, Oak Forest and Langwood",34000,Drug Offenses,176,196,193,160,192,565,188.3,9.7,9.1,-0.5,2,517.6,576.5,567.6,564.7,553.8
3B30,3,5.310372,"White Oak Acres, Brook Hollow, Oak Forest, Garden Oaks and Shepherd Park Plaza",23000,Drug Offenses,35,37,35,30,36,107,35.7,0,2.9,2.9,1,152.2,160.9,152.2,156.5,155.2
3B40,3,3.40013561,"Independence Heights, Melrose and Graceland",13000,Drug Offenses,168,171,167,106,136,506,168.7,-0.6,-19,-18.6,-19,1292.3,1315.4,1284.6,1046.2,1297.7
3B50,3,3.85259517,"Northline Mall, Stratton Place, Oakwood, Colonial Gardens, Lindale and Junction City",20000,Drug Offenses,133,146,149,110,136,428,142.7,12,2.3,-8.7,-5,665,730,745,680,713.5
5F10,5,3.25978513,Afton Village and Pine Terrace,14000,Drug Offenses,78,63,43,45,54,184,61.3,-44.9,-30.8,25.6,-12,557.1,450,307.1,385.7,437.9
5F30,5,8.70689439,"Fairbanks, Carverdale, Fawndale and Northwest Crossing",17000,Drug Offenses,132,143,137,104,123,412,137.3,3.8,-6.8,-10.2,-10,776.5,841.2,805.9,723.5,807.6
6B10,6,5.50084827,"York Plaza, Pembrook Place and Hawthorne Place",33000,Drug Offenses,138,148,183,145,177,469,156.3,32.6,28.3,-3.3,13,418.2,448.5,554.5,536.4,473.6
6B20,6,6.12869477,"Highland Heights, Oakdale and Melrose Gardens",18000,Drug Offenses,141,119,141,82,106,401,133.7,0,-24.8,-24.8,-21,783.3,661.1,783.3,588.9,742.8
6B30,6,7.2300685,"Woodland Trails, Oaks of Inwood, Bayou Bend, Cole Creek Manor and Inwood Forest",38000,Drug Offenses,111,104,94,55,76,309,103,-15.3,-31.5,-19.1,-26,292.1,273.7,247.4,200,271.1
6B40,6,5.544689,"Highland Gardens, Highland Heights and North Plaza",20000,Drug Offenses,164,179,193,127,165,536,178.7,17.7,0.6,-14.5,-8,820,895,965,825,893.5
22B30,22,2.8264671,Aldine and Imperial Valley,19000,Drug Offenses,125,78,62,47,58,265,88.3,-50.4,-53.6,-6.5,-34,657.9,410.5,326.3,305.3,464.7
22B20,22,4.61158268,Greenspoint,24000,Drug Offenses,336,248,189,203,235,773,257.7,-43.8,-30.1,24.3,-9,1400,1033.3,787.5,979.2,1073.7
7C10,7,3.47828324,"Fifth Ward, North Park and Pinecrest",13000,Drug Offenses,125,79,122,114,141,326,108.7,-2.4,12.8,15.6,30,961.5,607.7,938.5,1084.6,836.2
7C20,7,7.08575157,"Huntington Place, Willshire Place, Kashmere Gardens and Liberty Gardens",21000,Drug Offenses,356,279,262,228,287,897,299,-26.4,-19.4,9.5,-4,1695.2,1328.6,1247.6,1366.7,1423.8
7C30,7,4.51719841,"Camden Woods, Archers Acres and Croyden Gardens",18000,Drug Offenses,160,141,149,190,222,450,150,-6.9,38.8,49,48,888.9,783.3,827.8,1233.3,833.3
7C40,7,3.36786526,Keith-Weiss Park and Farrington Place,8000,Drug Offenses,61,45,38,37,44,144,48,-37.7,-27.9,15.8,-8,762.5,562.5,475,550,600
22B40,22,13.03325001,"Intercontinental Airport, Northwood, Lakeview Park and Glen Lee",11000,Drug Offenses,80,59,105,99,121,244,81.3,31.2,51.2,15.2,49,727.3,536.4,954.5,1100,739.1
8C10,8,3.69037316,"Tidwell Park, Shady Oak and Buckingham Place",12000,Drug Offenses,218,97,210,211,265,525,175,-3.7,21.6,26.2,51,1816.7,808.3,1750,2208.3,1458.3
8C20,8,3.36154214,"Houston Gardens, Rosewood and Homestead",7000,Drug Offenses,57,35,58,37,48,150,50,1.8,-15.8,-17.2,-4,814.3,500,828.6,685.7,714.3
8C30,8,4.6258259,"Parkhurst, East Houston and Clairmont Place",11000,Drug Offenses,68,40,72,50,66,180,60,5.9,-2.9,-8.3,10,618.2,363.6,654.5,600,545.5
8C40,8,4.97945551,"Lake Houston, Greenriver, Knoll and Lake Forest",8000,Drug Offenses,26,10,27,8,14,63,21,3.8,-46.2,-48.1,-33,325,125,337.5,175,262.5
8C50,8,3.31739498,"Park North, Forest Green, Kentshire Place, Glenwood Forest and Dorchester",8000,Drug Offenses,54,37,51,36,46,142,47.3,-5.6,-14.8,-9.8,-3,675,462.5,637.5,575,591.2
8C60,8,5.79693312,"Edgeworth, Northwood Manor and Scenic Woods",19000,Drug Offenses,142,78,119,66,87,339,113,-16.2,-38.7,-26.9,-23,747.4,410.5,626.3,457.9,594.7
9C10,9,5.21185619,"Port of Houston, Clinton Park, Pleasantville and Fidelity Manor",6000,Drug Offenses,28,20,34,19,21,82,27.3,21.4,-25,-38.2,-23,466.7,333.3,566.7,350,455
9C20,9,7.5383173,Denver Harbor and Houston Harbor,16000,Drug Offenses,67,38,69,45,57,174,58,3,-14.9,-17.4,-2,418.8,237.5,431.3,356.2,362.5
9C30,9,8.13353768,"City Park East, Wynnewood Acres and Wallisville Gardens",9000,Drug Offenses,38,33,46,30,42,117,39,21.1,10.5,-8.7,8,422.2,366.7,511.1,466.7,433.3
9C40,9,10.42549456,"Greens Bayou Estates, Shady Brook, Northshore",23000,Drug Offenses,83,84,97,95,118,264,88,16.9,42.2,21.6,34,360.9,365.2,421.7,513,382.6
10H10,10,2.81830654,Oak Lawn and Ranger,11000,Drug Offenses,15,19,37,37,41,71,23.7,146.7,173.3,10.8,73,136.4,172.7,336.4,372.7,215.5
10H20,10,1.75743169,Eastwood and Broadmoor,10000,Drug Offenses,23,20,12,27,28,55,18.3,-47.8,21.7,133.3,53,230,200,120,280,183
10H30,10,1.02691154,Near East End,4000,Drug Offenses,35,17,16,18,18,68,22.7,-54.3,-48.6,12.5,-21,875,425,400,450,567.5
10H40,10,0.99627062,Midtown,8000,Drug Offenses,303,196,147,128,149,646,215.3,-51.5,-50.8,1.4,-31,3787.5,2450,1837.5,1862.5,2691.3
10H50,10,2.30843079,the University of Houston area,13000,Drug Offenses,434,189,168,217,242,791,263.7,-61.3,-44.2,44,-8,3338.5,1453.8,1292.3,1861.5,2028.5
10H60,10,3.08931006,"University Oaks, Riverside Terrace and the Texas Southern University area",20000,Drug Offenses,131,93,56,62,68,280,93.3,-57.3,-48.1,21.4,-27,655,465,280,340,466.5
10H70,10,3.52217952,"Texas Medical Center, Hermann Park, Houston Zoo and Miller Outdoor Theatre",16000,Drug Offenses,48,37,51,41,47,136,45.3,6.2,-2.1,-7.8,4,300,231.2,318.8,293.8,283.1
10H80,10,2.73862779,"Southampton, Rice University area, Shadow Lawn and Broad Acres",19000,Drug Offenses,12,15,10,9,13,37,12.3,-16.7,8.3,30,6,63.2,78.9,52.6,68.4,64.7
11H10,11,5.31502815,"Mason Park, Forest Hill, Sunnyland and Central Park",28000,Drug Offenses,99,75,148,187,223,322,107.3,49.5,125.3,50.7,108,353.6,267.9,528.6,796.4,383.2
11H20,11,3.9311161,"Harrisburg, Manchester and Pecan Park",18000,Drug Offenses,56,37,66,53,62,159,53,17.9,10.7,-6.1,17,311.1,205.6,366.7,344.4,294.4
11H30,11,2.84278059,Meadow Brook and Park Place,15000,Drug Offenses,78,72,70,75,91,220,73.3,-10.3,16.7,30,24,520,480,466.7,606.7,488.7
11H40,11,6.14001938,Allendale and Oak Meadows,8000,Drug Offenses,6,15,16,12,17,37,12.3,166.7,183.3,6.2,38,75,187.5,200,212.5,153.8
11H50,11,2.09534157,"Meadow Creek, Ferndale Addition and Glenbrook Industrial",8000,Drug Offenses,11,24,25,27,32,60,20,127.3,190.9,28,60,137.5,300,312.5,400,250
12D10,12,8.55384717,"Almeda Mall, Southridge, Edgebrook and South Houston Gardens",44000,Drug Offenses,115,178,221,190,231,514,171.3,92.2,100.9,4.5,35,261.4,404.5,502.3,525,389.3
12D20,12,3.83700574,Sage,22000,Drug Offenses,44,33,39,35,44,116,38.7,-11.4,0,12.8,14,200,150,177.3,200,175.9
12D30,12,3.99301158,Gulf Palms and Beamer,15000,Drug Offenses,39,26,21,17,20,86,28.7,-46.2,-48.7,-4.8,-30,260,173.3,140,133.3,191.3
12D40,12,9.68663455,Scarsdale and Ellington Field,11000,Drug Offenses,29,29,26,15,19,84,28,-10.3,-34.5,-26.9,-32,263.6,263.6,236.4,172.7,254.5
12D50,12,8.93327581,"Bay Glen, Bay Oaks, Brook Forest and Bay Forest",26000,Drug Offenses,6,8,6,3,4,20,6.7,0,-33.3,-33.3,-40,23.1,30.8,23.1,15.4,25.8
12D60,12,6.35832041,"NASA's Johnson Space Center, Meadow Green, Oakbrook West and Camino South",22000,Drug Offenses,10,20,19,6,14,49,16.3,90,40,-26.3,-14,45.5,90.9,86.4,63.6,74.1
12D70,12,5.39156317,Baybrook Mall and Sterling Knoll,12000,Drug Offenses,27,17,26,22,26,70,23.3,-3.7,-3.7,0,12,225,141.7,216.7,216.7,194.2
13D10,13,5.2433708,"Gulfgate Mall, Bay Forest, Riverview, Hampshire, Golfcrest and Barnett Stadium",23000,Drug Offenses,127,65,104,73,106,296,98.7,-18.1,-16.5,1.9,7,552.2,282.6,452.2,460.9,429.1
13D20,13,6.66870859,"Fairlawn, Garden Villas, Glenbrook Valley and Santa Rosa",36000,Drug Offenses,221,240,235,131,189,696,232,6.3,-14.5,-19.6,-19,613.9,666.7,652.8,525,644.4
13D30,13,3.07402543,"Allen Farms, Airport Gardens and the Hobby Airport area",2000,Drug Offenses,13,21,16,9,12,50,16.7,23.1,-7.7,-25,-28,650,1050,800,600,835
13D40,13,5.0688163,"Val Verde East, Gulf Meadows and Houston Skyscraper Shadows",13000,Drug Offenses,24,22,18,16,17,64,21.3,-25,-29.2,-5.6,-20,184.6,169.2,138.5,130.8,163.8
14D10,14,3.66057918,McGregor Terrace and Riverside Terrace,17000,Drug Offenses,251,210,139,89,110,600,200,-44.6,-56.2,-20.9,-45,1476.5,1235.3,817.6,647.1,1176.5
14D20,14,7.25646368,"Blueridge, Sunnyside, Brook Haven and Bayou Estates",28000,Drug Offenses,350,342,277,223,286,969,323,-20.9,-18.3,3.2,-11,1250,1221.4,989.3,1021.4,1153.6
14D30,14,4.20537595,"Crestmont, Edgewood, Bellfort Park, Inwood Terrace and Southpark",21000,Drug Offenses,161,139,110,94,107,410,136.7,-31.7,-33.5,-2.7,-22,766.7,661.9,523.8,509.5,651
14D40,14,6.61224595,"South Acres, Shamrock Manor, Hillwood and Cloverland",21000,Drug Offenses,63,68,60,63,67,191,63.7,-4.8,6.3,11.7,5,300,323.8,285.7,319,303.3
14D50,14,8.69627992,"Golden Glade Estates, Langston and Almeda Genoa",9000,Drug Offenses,25,14,24,19,23,63,21,-4,-8,-4.2,10,277.8,155.6,266.7,255.6,233.3
15E10,15,4.34996776,"Meyerland Plaza, Robindell, Meyerland, Braeburn Terrace and Maplewood South",24000,Drug Offenses,41,31,44,35,45,116,38.7,7.3,9.8,2.3,16,170.8,129.2,183.3,187.5,161.3
15E20,15,3.58384499,"Westbury, Park West and Willow Creek",18000,Drug Offenses,67,48,46,51,62,161,53.7,-31.3,-7.5,34.8,15,372.2,266.7,255.6,344.4,298.3
15E30,15,6.29133294,"Meyer Park, Post Oak Manor, Westwood, Willow Bend and Linkwood",34000,Drug Offenses,52,71,61,35,47,184,61.3,17.3,-9.6,-23,-23,152.9,208.8,179.4,138.2,180.3
15E40,15,10.0079174,"NRG Park, Astroworld, Lakes at 610 and Plaza del Oro",30000,Drug Offenses,97,142,146,122,159,385,128.3,50.5,63.9,8.9,24,323.3,473.3,486.7,530,427.7
16E10,16,5.38940818,Canterbury Village and Monarch Estates,15000,Drug Offenses,12,8,9,9,12,29,9.7,-25,0,33.3,24,80,53.3,60,80,64.7
16E20,16,8.15202134,"Almeda Plaza, South Glen, Dumbarton Oaks and Briarwick",35000,Drug Offenses,73,73,78,44,53,224,74.7,6.8,-27.4,-32.1,-29,208.6,208.6,222.9,151.4,213.4
16E30,16,7.00932789,"Greenpark, Southwest Crossing and Windsor Village",22000,Drug Offenses,96,82,86,86,100,264,88,-10.4,4.2,16.3,14,436.4,372.7,390.9,454.5,400
16E40,16,7.49721482,"Chasewood, Willowpark, Briarwick, Ridgemont and Quail Run",35000,Drug Offenses,46,51,54,31,39,151,50.3,17.4,-15.2,-27.8,-22,131.4,145.7,154.3,111.4,143.7
17E10,17,3.3104034,"Southwest Memorial Hospital, Burnett Bayland Park and Westmoreland",51000,Drug Offenses,174,192,163,137,169,529,176.3,-6.3,-2.9,3.7,-4,341.2,376.5,319.6,331.4,345.7
17E20,17,3.92767309,the Houston Baptist University area and Maplewood West,27000,Drug Offenses,55,65,79,54,71,199,66.3,43.6,29.1,-10.1,7,203.7,240.7,292.6,263,245.6
17E30,17,3.8060455,Braeburn Valley West and Glenshire,21000,Drug Offenses,109,113,129,98,119,351,117,18.3,9.2,-7.8,2,519,538.1,614.3,566.7,557.1
17E40,17,4.70920035,"Creekbend, Southwood and Fondren Southwest",46000,Drug Offenses,177,205,204,131,167,586,195.3,15.3,-5.6,-18.1,-14,384.8,445.7,443.5,363,424.6
18F10,18,1.95881352,"Saddlebrook, Bayou Woods and Sherwood Forest",7000,Drug Offenses,4,5,14,2,5,23,7.7,250,25,-64.3,-35,57.1,71.4,200,71.4,110
18F20,18,3.51641691,"The Galleria, Tanglewood, Riverway and Post Oak",24000,Drug Offenses,72,74,92,74,94,238,79.3,27.8,30.6,2.2,19,300,308.3,383.3,391.7,330.4
18F30,18,3.80008564,"The Richmond Strip, Briargrove, Post Oak Estates and Westhaven",36000,Drug Offenses,123,99,107,77,97,329,109.7,-13,-21.1,-9.3,-12,341.7,275,297.2,269.4,304.7
18F40,18,2.9060249,"Rosewood General Hospital, Woodlake and Briarmeadow",35000,Drug Offenses,126,91,125,132,154,342,114,-0.8,22.2,23.2,35,360,260,357.1,440,325.7
18F50,18,2.96939217,"Tanglewild, Sharpstown Mall and Regency Square",20000,Drug Offenses,112,124,168,129,162,404,134.7,50,44.6,-3.6,20,560,620,840,810,673.5
18F60,18,3.62528697,Sharpstown Country Club and Southway Center,28000,Drug Offenses,83,48,73,58,78,204,68,-12,-6,6.8,15,296.4,171.4,260.7,278.6,242.9
19G10,19,2.74020376,Concourse South and Westwood Mall,31000,Drug Offenses,209,201,203,174,216,613,204.3,-2.9,3.3,6.4,6,674.2,648.4,654.8,696.8,659
19G20,19,3.29219023,"Catalina Square, Bellaire West, Imperial Point",25000,Drug Offenses,109,87,116,74,99,312,104,6.4,-9.2,-14.7,-5,436,348,464,396,416
19G30,19,2.49064202,"Rodeo Square, Wildflower Green, Braewood Glen",18000,Drug Offenses,47,45,45,56,68,137,45.7,-4.3,44.7,51.1,49,261.1,250,250,377.8,253.9
19G40,19,4.56425364,"Huntington Village, Wellington Park, Leawood, Keegans Glen",37000,Drug Offenses,93,104,80,81,97,277,92.3,-14,4.3,21.2,5,251.4,281.1,216.2,262.2,249.5
19G50,19,2.30578624,"Forum Park, Stancliff and Southwest Park",18000,Drug Offenses,97,108,93,76,86,298,99.3,-4.1,-11.3,-7.5,-13,538.9,600,516.7,477.8,551.7
20G10,20,3.06600809,"Westchase, Woodchase Village and Point West",29000,Drug Offenses,83,92,115,97,121,290,96.7,38.6,45.8,5.2,25,286.2,317.2,396.6,417.2,333.4
20G20,20,3.27621655,"Lakeside Estates, City West Place, Rivercrest and Briargrove Park",18000,Drug Offenses,29,47,40,40,48,116,38.7,37.9,65.5,20,24,161.1,261.1,222.2,266.7,215
20G30,20,3.97953501,"West Houston Medical Center, Andrau Airport, Westchase and Westchase Mall",26000,Drug Offenses,161,159,244,212,265,564,188,51.6,64.6,8.6,41,619.2,611.5,938.5,1019.2,723.1
20G40,20,4.16594899,"Lakeview Forest, Lakeside Place, Ashford Village and Southlake",28000,Drug Offenses,50,41,81,61,81,172,57.3,62,62,0,41,178.6,146.4,289.3,289.3,204.6
20G70,20,2.38283582,Westpark Village and Ashford Point,21000,Drug Offenses,38,33,30,28,32,101,33.7,-21.1,-15.8,6.7,-5,181,157.1,142.9,152.4,160.5
20G80,20,25.33626534,City Limits,37000,Drug Offenses,32,47,58,23,29,137,45.7,81.2,-9.4,-50,-37,86.5,127,156.8,78.4,123.5
21I10,21,0.00549966,Intercontinental Airport,0,Drug Offenses,15,12,18,16,22,45,15,20,46.7,22.2,47,NA,NA,NA,NA,NA
21I20,21,0.01205019,Intercontinental Airport,0,Drug Offenses,0,0,0,0,0,0,0,NA,NA,NA,NA,NA,NA,NA,NA,NA
21I30,21,0.01180375,Intercontinental Airport,0,Drug Offenses,0,0,0,0,0,0,0,NA,NA,NA,NA,NA,NA,NA,NA,NA
21I40,21,0.00923163,Intercontinental Airport,0,Drug Offenses,0,0,2,0,1,2,0.7,NA,NA,-50,43,NA,NA,NA,NA,NA
21I50,21,14.61100076,Intercontinental Airport,0,Drug Offenses,45,45,83,82,96,173,57.7,84.4,113.3,15.7,66,NA,NA,NA,NA,NA
21I70,21,0.01945113,Intercontinental Airport,0,Drug Offenses,0,0,0,0,0,0,0,NA,NA,NA,NA,NA,NA,NA,NA,NA
22B10,22,3.28874287,"Willowbrook, Willow Chase Park and Centerfield",8000,Drug Offenses,41,33,38,37,39,112,37.3,-7.3,-4.9,2.6,5,512.5,412.5,475,487.5,466.2
5F20,5,5.94082911,Spring Branch and Schwartz Park,42000,Drug Offenses,101,93,79,67,84,273,91,-21.8,-16.8,6.3,-8,240.5,221.4,188.1,200,216.7
4F10,4,4.13606469,"Timber Oaks, Shadow Oaks and Long Point Acres",23000,Drug Offenses,57,38,58,48,57,153,51,1.8,0,-1.7,12,247.8,165.2,252.2,247.8,221.7
20G50,20,5.88593521,"Nottingham, Yorkshire, Wilchester, Town and Country Village and Memorial City Shopping Center",30000,Drug Offenses,35,30,48,35,44,113,37.7,37.1,25.7,-8.3,17,116.7,100,160,146.7,125.7
4F20,4,5.85840284,"Claymore Park, Westbranch, Spring Shadows and Kempwood Forest",28000,Drug Offenses,56,35,43,43,55,134,44.7,-23.2,-1.8,27.9,23,200,125,153.6,196.4,159.6
20G60,20,4.54207617,"Barkers Landing, Fleetwood, Thornwood and Darrel Tully Stadium",22000,Drug Offenses,46,62,55,25,35,163,54.3,19.6,-23.9,-36.4,-36,209.1,281.8,250,159.1,246.8
4F30,4,26.30690179,"Addicks Reservoir Area, Claymore Park, Brittmore Village, Park Ten Place and Mayde Creek Farms",18000,Drug Offenses,59,55,49,27,32,163,54.3,-16.9,-45.8,-34.7,-41,327.8,305.6,272.2,177.8,301.7
24C10,24,5.44044978,Kingwood,13000,Drug Offenses,11,7,9,5,8,27,9,-18.2,-27.3,-11.1,-11,84.6,53.8,69.2,61.5,69.2
24C20,24,6.8291794,Kingwood,18000,Drug Offenses,13,0,7,3,5,20,6.7,-46.2,-61.5,-28.6,-25,72.2,0,38.9,27.8,37.2
24C30,24,9.78735527,Kingwood,29000,Drug Offenses,15,6,6,1,2,27,9,-60,-86.7,-66.7,-78,51.7,20.7,20.7,6.9,31
24C40,24,35.7992771,Kingwood,6000,Drug Offenses,8,1,2,0,0,11,3.7,-75,-100,-100,-100,133.3,16.7,33.3,0,61.7
24C50,24,7.51791807,Kingwood,5000,Drug Offenses,13,17,10,6,8,40,13.3,-23.1,-38.5,-20,-40,260,340,200,160,266
24C60,24,4.86823328,Kingwood,21000,Drug Offenses,2,0,2,0,0,4,1.3,0,-100,-100,-100,9.5,0,9.5,0,6.2
21I60,21,0.01236886,Intercontinental Airport,0,Drug Offenses,4,1,1,5,6,6,2,-75,50,500,200,NA,NA,NA,NA,NA
FTB4,NA,NA,NA,NA,Drug Offenses,0,0,0,0,0,0,0,NA,NA,NA,NA,NA,NA,NA,NA,NA
HCC1,NA,NA,NA,NA,Drug Offenses,0,0,0,0,0,0,0,NA,NA,NA,NA,NA,NA,NA,NA,NA
HCC4,NA,NA,NA,NA,Drug Offenses,1,1,0,0,0,2,0.7,-100,-100,NA,-100,NA,NA,NA,NA,NA
HCC5,NA,NA,NA,NA,Drug Offenses,1,4,1,2,2,6,2,0,100,100,0,NA,NA,NA,NA,NA
HCC7,NA,NA,NA,NA,Drug Offenses,0,2,1,0,0,3,1,NA,NA,-100,-100,NA,NA,NA,NA,NA
HCSO,NA,NA,NA,NA,Drug Offenses,197,220,46,43,47,463,154.3,-76.6,-76.1,2.2,-70,NA,NA,NA,NA,NA
OOJ,NA,NA,NA,NA,Drug Offenses,58,92,24,19,20,174,58,-58.6,-65.5,-16.7,-66,NA,NA,NA,NA,NA
UH-2PD,NA,NA,NA,NA,Drug Offenses,0,0,0,0,0,0,0,NA,NA,NA,NA,NA,NA,NA,NA,NA
UH-3PD,NA,NA,NA,NA,Drug Offenses,0,0,0,0,0,0,0,NA,NA,NA,NA,NA,NA,NA,NA,NA
Unknown,NA,NA,NA,NA,Drug Offenses,41,33,31,16,21,105,35,-24.4,-48.8,-32.3,-40,NA,NA,NA,NA,NA
