beat,district,area_sq_mi,placename,population,category_name,total19,total20,total21,total22,last12mos,total_prior3years,avg_prior3years,inc_19to21,inc_19tolast12,inc_21tolast12,inc_prior3yearavgtolast12,rate19,rate20,rate21,rate_last12,rate_prior3years
23J40,23,3.03933481,Ellington Field,0,Drug Offenses,0,0,0,0,0,0,0,NA,NA,NA,NA,NA,NA,NA,NA,NA
23J50,23,2.12389492,Hobby Airport,0,Drug Offenses,23,23,22,41,43,68,22.7,-4.3,87,95.5,89,NA,NA,NA,NA,NA
1A10,1,1.74646692,Downtown Central Business District,17000,Drug Offenses,116,133,217,138,164,466,155.3,87.1,41.4,-24.4,6,682.4,782.4,1276.5,964.7,913.5
1A20,1,2.44133075,"Fourth Ward, Avondale and Westmoreland",27000,Drug Offenses,106,88,72,69,75,266,88.7,-32.1,-29.2,4.2,-15,392.6,325.9,266.7,277.8,328.5
1A30,1,2.65916892,"Cherryhurst, Mandell Place and Montrose",27000,Drug Offenses,68,74,50,45,51,192,64,-26.5,-25,2,-20,251.9,274.1,185.2,188.9,237
1A40,1,2.45016686,"Tall Timbers, Royden Oaks, River Oaks, Avalon Place and Oak Estates",7000,Drug Offenses,7,8,4,3,3,19,6.3,-42.9,-57.1,-25,-52,100,114.3,57.1,42.9,90
1A50,1,3.04553452,"Post Oak Park, Afton Oaks, Highland Village, Weslayan, Greenway Plaza and The Compaq Center",26000,Drug Offenses,38,41,45,44,49,124,41.3,18.4,28.9,8.9,19,146.2,157.7,173.1,188.5,158.8
2A10,2,3.30928608,Irvington and Ryon,18000,Drug Offenses,220,157,124,106,112,501,167,-43.6,-49.1,-9.7,-33,1222.2,872.2,688.9,622.2,927.8
2A20,2,1.8876461,"Sunset Heights, Brooksmith and Stude",11000,Drug Offenses,116,71,71,44,49,258,86,-38.8,-57.8,-31,-43,1054.5,645.5,645.5,445.5,781.8
2A30,2,4.65858171,"Houston Heights, Norhill and Studemont",31000,Drug Offenses,52,51,38,37,39,141,47,-26.9,-25,2.6,-17,167.7,164.5,122.6,125.8,151.6
2A40,2,1.60546103,Old Sixth Ward and the First Ward,8000,Drug Offenses,39,29,23,32,36,91,30.3,-41,-7.7,56.5,19,487.5,362.5,287.5,450,378.8
2A50,2,5.4659844,"Memorial Park, West End, Ashbury and Cottage Grove",29000,Drug Offenses,63,40,52,57,59,155,51.7,-17.5,-6.3,13.5,14,217.2,137.9,179.3,203.4,178.3
2A60,2,4.67447346,"Westport, Holly Park, Lazy Brook, Citadel, Shady Acres and Timbergrove",21000,Drug Offenses,32,28,34,32,39,94,31.3,6.2,21.9,14.7,25,152.4,133.3,161.9,185.7,149
3B10,3,6.82068773,"Northwest Mall, Brookhollow, White Oak Acres, Oak Forest and Langwood",34000,Drug Offenses,176,196,193,168,188,565,188.3,9.7,6.8,-2.6,-0,517.6,576.5,567.6,552.9,553.8
3B30,3,5.310372,"White Oak Acres, Brook Hollow, Oak Forest, Garden Oaks and Shepherd Park Plaza",23000,Drug Offenses,35,37,35,34,36,107,35.7,0,2.9,2.9,1,152.2,160.9,152.2,156.5,155.2
3B40,3,3.40013561,"Independence Heights, Melrose and Graceland",13000,Drug Offenses,168,171,167,116,130,506,168.7,-0.6,-22.6,-22.2,-23,1292.3,1315.4,1284.6,1000,1297.7
3B50,3,3.85259517,"Northline Mall, Stratton Place, Oakwood, Colonial Gardens, Lindale and Junction City",20000,Drug Offenses,133,146,149,124,142,428,142.7,12,6.8,-4.7,-0,665,730,745,710,713.5
5F10,5,3.25978513,Afton Village and Pine Terrace,14000,Drug Offenses,78,63,43,40,47,184,61.3,-44.9,-39.7,9.3,-23,557.1,450,307.1,335.7,437.9
5F30,5,8.70689439,"Fairbanks, Carverdale, Fawndale and Northwest Crossing",17000,Drug Offenses,132,143,137,115,127,412,137.3,3.8,-3.8,-7.3,-8,776.5,841.2,805.9,747.1,807.6
6B10,6,5.50084827,"York Plaza, Pembrook Place and Hawthorne Place",33000,Drug Offenses,138,148,183,161,179,469,156.3,32.6,29.7,-2.2,15,418.2,448.5,554.5,542.4,473.6
6B20,6,6.12869477,"Highland Heights, Oakdale and Melrose Gardens",18000,Drug Offenses,141,119,141,91,106,401,133.7,0,-24.8,-24.8,-21,783.3,661.1,783.3,588.9,742.8
6B30,6,7.2300685,"Woodland Trails, Oaks of Inwood, Bayou Bend, Cole Creek Manor and Inwood Forest",38000,Drug Offenses,111,104,94,64,75,309,103,-15.3,-32.4,-20.2,-27,292.1,273.7,247.4,197.4,271.1
6B40,6,5.544689,"Highland Gardens, Highland Heights and North Plaza",20000,Drug Offenses,164,179,193,144,171,536,178.7,17.7,4.3,-11.4,-4,820,895,965,855,893.5
22B30,22,2.8264671,Aldine and Imperial Valley,19000,Drug Offenses,125,78,62,52,56,265,88.3,-50.4,-55.2,-9.7,-37,657.9,410.5,326.3,294.7,464.7
22B20,22,4.61158268,Greenspoint,24000,Drug Offenses,336,248,189,224,240,773,257.7,-43.8,-28.6,27,-7,1400,1033.3,787.5,1000,1073.7
7C10,7,3.47828324,"Fifth Ward, North Park and Pinecrest",13000,Drug Offenses,125,79,122,139,150,326,108.7,-2.4,20,23,38,961.5,607.7,938.5,1153.8,836.2
7C20,7,7.08575157,"Huntington Place, Willshire Place, Kashmere Gardens and Liberty Gardens",21000,Drug Offenses,356,279,262,235,263,897,299,-26.4,-26.1,0.4,-12,1695.2,1328.6,1247.6,1252.4,1423.8
7C30,7,4.51719841,"Camden Woods, Archers Acres and Croyden Gardens",18000,Drug Offenses,160,141,149,243,261,450,150,-6.9,63.1,75.2,74,888.9,783.3,827.8,1450,833.3
7C40,7,3.36786526,Keith-Weiss Park and Farrington Place,8000,Drug Offenses,61,45,38,49,52,144,48,-37.7,-14.8,36.8,8,762.5,562.5,475,650,600
22B40,22,13.03325001,"Intercontinental Airport, Northwood, Lakeview Park and Glen Lee",11000,Drug Offenses,80,59,105,107,115,244,81.3,31.2,43.8,9.5,41,727.3,536.4,954.5,1045.5,739.1
8C10,8,3.69037316,"Tidwell Park, Shady Oak and Buckingham Place",12000,Drug Offenses,218,97,210,237,266,525,175,-3.7,22,26.7,52,1816.7,808.3,1750,2216.7,1458.3
8C20,8,3.36154214,"Houston Gardens, Rosewood and Homestead",7000,Drug Offenses,57,35,58,42,47,150,50,1.8,-17.5,-19,-6,814.3,500,828.6,671.4,714.3
8C30,8,4.6258259,"Parkhurst, East Houston and Clairmont Place",11000,Drug Offenses,68,40,72,56,61,180,60,5.9,-10.3,-15.3,2,618.2,363.6,654.5,554.5,545.5
8C40,8,4.97945551,"Lake Houston, Greenriver, Knoll and Lake Forest",8000,Drug Offenses,26,10,27,9,10,63,21,3.8,-61.5,-63,-52,325,125,337.5,125,262.5
8C50,8,3.31739498,"Park North, Forest Green, Kentshire Place, Glenwood Forest and Dorchester",8000,Drug Offenses,54,37,51,32,36,142,47.3,-5.6,-33.3,-29.4,-24,675,462.5,637.5,450,591.2
8C60,8,5.79693312,"Edgeworth, Northwood Manor and Scenic Woods",19000,Drug Offenses,142,78,119,75,84,339,113,-16.2,-40.8,-29.4,-26,747.4,410.5,626.3,442.1,594.7
9C10,9,5.21185619,"Port of Houston, Clinton Park, Pleasantville and Fidelity Manor",6000,Drug Offenses,28,20,34,18,19,82,27.3,21.4,-32.1,-44.1,-30,466.7,333.3,566.7,316.7,455
9C20,9,7.5383173,Denver Harbor and Houston Harbor,16000,Drug Offenses,67,38,69,50,56,174,58,3,-16.4,-18.8,-3,418.8,237.5,431.3,350,362.5
9C30,9,8.13353768,"City Park East, Wynnewood Acres and Wallisville Gardens",9000,Drug Offenses,38,33,46,35,44,117,39,21.1,15.8,-4.3,13,422.2,366.7,511.1,488.9,433.3
9C40,9,10.42549456,"Greens Bayou Estates, Shady Brook, Northshore",23000,Drug Offenses,83,84,97,123,133,264,88,16.9,60.2,37.1,51,360.9,365.2,421.7,578.3,382.6
10H10,10,2.81830654,Oak Lawn and Ranger,11000,Drug Offenses,15,19,37,39,41,71,23.7,146.7,173.3,10.8,73,136.4,172.7,336.4,372.7,215.5
10H20,10,1.75743169,Eastwood and Broadmoor,10000,Drug Offenses,23,20,12,27,27,55,18.3,-47.8,17.4,125,48,230,200,120,270,183
10H30,10,1.02691154,Near East End,4000,Drug Offenses,35,17,16,20,20,68,22.7,-54.3,-42.9,25,-12,875,425,400,500,567.5
10H40,10,0.99627062,Midtown,8000,Drug Offenses,303,196,147,146,160,646,215.3,-51.5,-47.2,8.8,-26,3787.5,2450,1837.5,2000,2691.3
10H50,10,2.30843079,the University of Houston area,13000,Drug Offenses,434,189,168,237,248,791,263.7,-61.3,-42.9,47.6,-6,3338.5,1453.8,1292.3,1907.7,2028.5
10H60,10,3.08931006,"University Oaks, Riverside Terrace and the Texas Southern University area",20000,Drug Offenses,131,93,56,71,74,280,93.3,-57.3,-43.5,32.1,-21,655,465,280,370,466.5
10H70,10,3.52217952,"Texas Medical Center, Hermann Park, Houston Zoo and Miller Outdoor Theatre",16000,Drug Offenses,48,37,51,44,48,136,45.3,6.2,0,-5.9,6,300,231.2,318.8,300,283.1
10H80,10,2.73862779,"Southampton, Rice University area, Shadow Lawn and Broad Acres",19000,Drug Offenses,12,15,10,11,14,37,12.3,-16.7,16.7,40,14,63.2,78.9,52.6,73.7,64.7
11H10,11,5.31502815,"Mason Park, Forest Hill, Sunnyland and Central Park",28000,Drug Offenses,99,75,148,205,220,322,107.3,49.5,122.2,48.6,105,353.6,267.9,528.6,785.7,383.2
11H20,11,3.9311161,"Harrisburg, Manchester and Pecan Park",18000,Drug Offenses,56,37,66,56,60,159,53,17.9,7.1,-9.1,13,311.1,205.6,366.7,333.3,294.4
11H30,11,2.84278059,Meadow Brook and Park Place,15000,Drug Offenses,78,72,70,82,91,220,73.3,-10.3,16.7,30,24,520,480,466.7,606.7,488.7
11H40,11,6.14001938,Allendale and Oak Meadows,8000,Drug Offenses,6,15,16,14,17,37,12.3,166.7,183.3,6.2,38,75,187.5,200,212.5,153.8
11H50,11,2.09534157,"Meadow Creek, Ferndale Addition and Glenbrook Industrial",8000,Drug Offenses,11,24,25,29,33,60,20,127.3,200,32,65,137.5,300,312.5,412.5,250
12D10,12,8.55384717,"Almeda Mall, Southridge, Edgebrook and South Houston Gardens",44000,Drug Offenses,115,178,221,199,218,514,171.3,92.2,89.6,-1.4,27,261.4,404.5,502.3,495.5,389.3
12D20,12,3.83700574,Sage,22000,Drug Offenses,44,33,39,36,39,116,38.7,-11.4,-11.4,0,1,200,150,177.3,177.3,175.9
12D30,12,3.99301158,Gulf Palms and Beamer,15000,Drug Offenses,39,26,21,19,19,86,28.7,-46.2,-51.3,-9.5,-34,260,173.3,140,126.7,191.3
12D40,12,9.68663455,Scarsdale and Ellington Field,11000,Drug Offenses,29,29,26,17,17,84,28,-10.3,-41.4,-34.6,-39,263.6,263.6,236.4,154.5,254.5
12D50,12,8.93327581,"Bay Glen, Bay Oaks, Brook Forest and Bay Forest",26000,Drug Offenses,6,8,6,3,4,20,6.7,0,-33.3,-33.3,-40,23.1,30.8,23.1,15.4,25.8
12D60,12,6.35832041,"NASA's Johnson Space Center, Meadow Green, Oakbrook West and Camino South",22000,Drug Offenses,10,20,19,6,10,49,16.3,90,0,-47.4,-39,45.5,90.9,86.4,45.5,74.1
12D70,12,5.39156317,Baybrook Mall and Sterling Knoll,12000,Drug Offenses,27,17,26,25,27,70,23.3,-3.7,0,3.8,16,225,141.7,216.7,225,194.2
13D10,13,5.2433708,"Gulfgate Mall, Bay Forest, Riverview, Hampshire, Golfcrest and Barnett Stadium",23000,Drug Offenses,127,65,104,77,97,296,98.7,-18.1,-23.6,-6.7,-2,552.2,282.6,452.2,421.7,429.1
13D20,13,6.66870859,"Fairlawn, Garden Villas, Glenbrook Valley and Santa Rosa",36000,Drug Offenses,221,240,235,138,171,696,232,6.3,-22.6,-27.2,-26,613.9,666.7,652.8,475,644.4
13D30,13,3.07402543,"Allen Farms, Airport Gardens and the Hobby Airport area",2000,Drug Offenses,13,21,16,9,11,50,16.7,23.1,-15.4,-31.2,-34,650,1050,800,550,835
13D40,13,5.0688163,"Val Verde East, Gulf Meadows and Houston Skyscraper Shadows",13000,Drug Offenses,24,22,18,16,16,64,21.3,-25,-33.3,-11.1,-25,184.6,169.2,138.5,123.1,163.8
14D10,14,3.66057918,McGregor Terrace and Riverside Terrace,17000,Drug Offenses,251,210,139,98,107,600,200,-44.6,-57.4,-23,-46,1476.5,1235.3,817.6,629.4,1176.5
14D20,14,7.25646368,"Blueridge, Sunnyside, Brook Haven and Bayou Estates",28000,Drug Offenses,350,342,277,236,272,969,323,-20.9,-22.3,-1.8,-16,1250,1221.4,989.3,971.4,1153.6
14D30,14,4.20537595,"Crestmont, Edgewood, Bellfort Park, Inwood Terrace and Southpark",21000,Drug Offenses,161,139,110,116,125,410,136.7,-31.7,-22.4,13.6,-9,766.7,661.9,523.8,595.2,651
14D40,14,6.61224595,"South Acres, Shamrock Manor, Hillwood and Cloverland",21000,Drug Offenses,63,68,60,72,76,191,63.7,-4.8,20.6,26.7,19,300,323.8,285.7,361.9,303.3
14D50,14,8.69627992,"Golden Glade Estates, Langston and Almeda Genoa",9000,Drug Offenses,25,14,24,19,20,63,21,-4,-20,-16.7,-5,277.8,155.6,266.7,222.2,233.3
15E10,15,4.34996776,"Meyerland Plaza, Robindell, Meyerland, Braeburn Terrace and Maplewood South",24000,Drug Offenses,41,31,44,41,44,116,38.7,7.3,7.3,0,14,170.8,129.2,183.3,183.3,161.3
15E20,15,3.58384499,"Westbury, Park West and Willow Creek",18000,Drug Offenses,67,48,46,54,61,161,53.7,-31.3,-9,32.6,14,372.2,266.7,255.6,338.9,298.3
15E30,15,6.29133294,"Meyer Park, Post Oak Manor, Westwood, Willow Bend and Linkwood",34000,Drug Offenses,52,71,61,41,46,184,61.3,17.3,-11.5,-24.6,-25,152.9,208.8,179.4,135.3,180.3
15E40,15,10.0079174,"NRG Park, Astroworld, Lakes at 610 and Plaza del Oro",30000,Drug Offenses,97,142,146,142,158,385,128.3,50.5,62.9,8.2,23,323.3,473.3,486.7,526.7,427.7
16E10,16,5.38940818,Canterbury Village and Monarch Estates,15000,Drug Offenses,12,8,9,8,11,29,9.7,-25,-8.3,22.2,13,80,53.3,60,73.3,64.7
16E20,16,8.15202134,"Almeda Plaza, South Glen, Dumbarton Oaks and Briarwick",35000,Drug Offenses,73,73,78,51,57,224,74.7,6.8,-21.9,-26.9,-24,208.6,208.6,222.9,162.9,213.4
16E30,16,7.00932789,"Greenpark, Southwest Crossing and Windsor Village",22000,Drug Offenses,96,82,86,99,105,264,88,-10.4,9.4,22.1,19,436.4,372.7,390.9,477.3,400
16E40,16,7.49721482,"Chasewood, Willowpark, Briarwick, Ridgemont and Quail Run",35000,Drug Offenses,46,51,54,35,43,151,50.3,17.4,-6.5,-20.4,-15,131.4,145.7,154.3,122.9,143.7
17E10,17,3.3104034,"Southwest Memorial Hospital, Burnett Bayland Park and Westmoreland",51000,Drug Offenses,174,192,163,151,174,529,176.3,-6.3,0,6.7,-1,341.2,376.5,319.6,341.2,345.7
17E20,17,3.92767309,the Houston Baptist University area and Maplewood West,27000,Drug Offenses,55,65,79,63,73,199,66.3,43.6,32.7,-7.6,10,203.7,240.7,292.6,270.4,245.6
17E30,17,3.8060455,Braeburn Valley West and Glenshire,21000,Drug Offenses,109,113,129,107,122,351,117,18.3,11.9,-5.4,4,519,538.1,614.3,581,557.1
17E40,17,4.70920035,"Creekbend, Southwood and Fondren Southwest",46000,Drug Offenses,177,205,204,141,163,586,195.3,15.3,-7.9,-20.1,-17,384.8,445.7,443.5,354.3,424.6
18F10,18,1.95881352,"Saddlebrook, Bayou Woods and Sherwood Forest",7000,Drug Offenses,4,5,14,2,3,23,7.7,250,-25,-78.6,-61,57.1,71.4,200,42.9,110
18F20,18,3.51641691,"The Galleria, Tanglewood, Riverway and Post Oak",24000,Drug Offenses,72,74,92,81,90,238,79.3,27.8,25,-2.2,13,300,308.3,383.3,375,330.4
18F30,18,3.80008564,"The Richmond Strip, Briargrove, Post Oak Estates and Westhaven",36000,Drug Offenses,123,99,107,99,109,329,109.7,-13,-11.4,1.9,-1,341.7,275,297.2,302.8,304.7
18F40,18,2.9060249,"Rosewood General Hospital, Woodlake and Briarmeadow",35000,Drug Offenses,126,91,125,149,159,342,114,-0.8,26.2,27.2,39,360,260,357.1,454.3,325.7
18F50,18,2.96939217,"Tanglewild, Sharpstown Mall and Regency Square",20000,Drug Offenses,112,124,168,139,158,404,134.7,50,41.1,-6,17,560,620,840,790,673.5
18F60,18,3.62528697,Sharpstown Country Club and Southway Center,28000,Drug Offenses,83,48,73,66,74,204,68,-12,-10.8,1.4,9,296.4,171.4,260.7,264.3,242.9
19G10,19,2.74020376,Concourse South and Westwood Mall,31000,Drug Offenses,209,201,203,196,223,613,204.3,-2.9,6.7,9.9,9,674.2,648.4,654.8,719.4,659
19G20,19,3.29219023,"Catalina Square, Bellaire West, Imperial Point",25000,Drug Offenses,109,87,116,90,105,312,104,6.4,-3.7,-9.5,1,436,348,464,420,416
19G30,19,2.49064202,"Rodeo Square, Wildflower Green, Braewood Glen",18000,Drug Offenses,47,45,45,61,69,137,45.7,-4.3,46.8,53.3,51,261.1,250,250,383.3,253.9
19G40,19,4.56425364,"Huntington Village, Wellington Park, Leawood, Keegans Glen",37000,Drug Offenses,93,104,80,93,103,277,92.3,-14,10.8,28.8,12,251.4,281.1,216.2,278.4,249.5
19G50,19,2.30578624,"Forum Park, Stancliff and Southwest Park",18000,Drug Offenses,97,108,93,89,92,298,99.3,-4.1,-5.2,-1.1,-7,538.9,600,516.7,511.1,551.7
20G10,20,3.06600809,"Westchase, Woodchase Village and Point West",29000,Drug Offenses,83,92,115,107,123,290,96.7,38.6,48.2,7,27,286.2,317.2,396.6,424.1,333.4
20G20,20,3.27621655,"Lakeside Estates, City West Place, Rivercrest and Briargrove Park",18000,Drug Offenses,29,47,40,44,48,116,38.7,37.9,65.5,20,24,161.1,261.1,222.2,266.7,215
20G30,20,3.97953501,"West Houston Medical Center, Andrau Airport, Westchase and Westchase Mall",26000,Drug Offenses,161,159,244,227,258,564,188,51.6,60.2,5.7,37,619.2,611.5,938.5,992.3,723.1
20G40,20,4.16594899,"Lakeview Forest, Lakeside Place, Ashford Village and Southlake",28000,Drug Offenses,50,41,81,68,75,172,57.3,62,50,-7.4,31,178.6,146.4,289.3,267.9,204.6
20G70,20,2.38283582,Westpark Village and Ashford Point,21000,Drug Offenses,38,33,30,32,33,101,33.7,-21.1,-13.2,10,-2,181,157.1,142.9,157.1,160.5
20G80,20,25.33626534,City Limits,37000,Drug Offenses,32,47,58,27,32,137,45.7,81.2,0,-44.8,-30,86.5,127,156.8,86.5,123.5
21I10,21,0.00549966,Intercontinental Airport,0,Drug Offenses,15,12,18,16,17,45,15,20,13.3,-5.6,13,NA,NA,NA,NA,NA
21I20,21,0.01205019,Intercontinental Airport,0,Drug Offenses,0,0,0,0,0,0,0,NA,NA,NA,NA,NA,NA,NA,NA,NA
21I30,21,0.01180375,Intercontinental Airport,0,Drug Offenses,0,0,0,0,0,0,0,NA,NA,NA,NA,NA,NA,NA,NA,NA
21I40,21,0.00923163,Intercontinental Airport,0,Drug Offenses,0,0,2,0,1,2,0.7,NA,NA,-50,43,NA,NA,NA,NA,NA
21I50,21,14.61100076,Intercontinental Airport,0,Drug Offenses,45,45,83,91,96,173,57.7,84.4,113.3,15.7,66,NA,NA,NA,NA,NA
21I70,21,0.01945113,Intercontinental Airport,0,Drug Offenses,0,0,0,0,0,0,0,NA,NA,NA,NA,NA,NA,NA,NA,NA
22B10,22,3.28874287,"Willowbrook, Willow Chase Park and Centerfield",8000,Drug Offenses,41,33,38,40,41,112,37.3,-7.3,0,7.9,10,512.5,412.5,475,512.5,466.2
5F20,5,5.94082911,Spring Branch and Schwartz Park,42000,Drug Offenses,101,93,79,84,93,273,91,-21.8,-7.9,17.7,2,240.5,221.4,188.1,221.4,216.7
4F10,4,4.13606469,"Timber Oaks, Shadow Oaks and Long Point Acres",23000,Drug Offenses,57,38,58,57,63,153,51,1.8,10.5,8.6,24,247.8,165.2,252.2,273.9,221.7
20G50,20,5.88593521,"Nottingham, Yorkshire, Wilchester, Town and Country Village and Memorial City Shopping Center",30000,Drug Offenses,35,30,48,40,46,113,37.7,37.1,31.4,-4.2,22,116.7,100,160,153.3,125.7
4F20,4,5.85840284,"Claymore Park, Westbranch, Spring Shadows and Kempwood Forest",28000,Drug Offenses,56,35,43,42,48,134,44.7,-23.2,-14.3,11.6,7,200,125,153.6,171.4,159.6
20G60,20,4.54207617,"Barkers Landing, Fleetwood, Thornwood and Darrel Tully Stadium",22000,Drug Offenses,46,62,55,28,31,163,54.3,19.6,-32.6,-43.6,-43,209.1,281.8,250,140.9,246.8
4F30,4,26.30690179,"Addicks Reservoir Area, Claymore Park, Brittmore Village, Park Ten Place and Mayde Creek Farms",18000,Drug Offenses,59,55,49,31,34,163,54.3,-16.9,-42.4,-30.6,-37,327.8,305.6,272.2,188.9,301.7
24C10,24,5.44044978,Kingwood,13000,Drug Offenses,11,7,9,5,8,27,9,-18.2,-27.3,-11.1,-11,84.6,53.8,69.2,61.5,69.2
24C20,24,6.8291794,Kingwood,18000,Drug Offenses,13,0,7,3,3,20,6.7,-46.2,-76.9,-57.1,-55,72.2,0,38.9,16.7,37.2
24C30,24,9.78735527,Kingwood,29000,Drug Offenses,15,6,6,1,2,27,9,-60,-86.7,-66.7,-78,51.7,20.7,20.7,6.9,31
24C40,24,35.7992771,Kingwood,6000,Drug Offenses,8,1,2,0,0,11,3.7,-75,-100,-100,-100,133.3,16.7,33.3,0,61.7
24C50,24,7.51791807,Kingwood,5000,Drug Offenses,13,17,10,6,8,40,13.3,-23.1,-38.5,-20,-40,260,340,200,160,266
24C60,24,4.86823328,Kingwood,21000,Drug Offenses,2,0,2,0,0,4,1.3,0,-100,-100,-100,9.5,0,9.5,0,6.2
21I60,21,0.01236886,Intercontinental Airport,0,Drug Offenses,4,1,1,6,6,6,2,-75,50,500,200,NA,NA,NA,NA,NA
FTB4,NA,NA,NA,NA,Drug Offenses,0,0,0,0,0,0,0,NA,NA,NA,NA,NA,NA,NA,NA,NA
HCC1,NA,NA,NA,NA,Drug Offenses,0,0,0,0,0,0,0,NA,NA,NA,NA,NA,NA,NA,NA,NA
HCC4,NA,NA,NA,NA,Drug Offenses,1,1,0,0,0,2,0.7,-100,-100,NA,-100,NA,NA,NA,NA,NA
HCC5,NA,NA,NA,NA,Drug Offenses,1,4,1,2,2,6,2,0,100,100,0,NA,NA,NA,NA,NA
HCC7,NA,NA,NA,NA,Drug Offenses,0,2,1,0,0,3,1,NA,NA,-100,-100,NA,NA,NA,NA,NA
HCSO,NA,NA,NA,NA,Drug Offenses,197,220,46,47,48,463,154.3,-76.6,-75.6,4.3,-69,NA,NA,NA,NA,NA
OOJ,NA,NA,NA,NA,Drug Offenses,58,92,24,24,24,174,58,-58.6,-58.6,0,-59,NA,NA,NA,NA,NA
UH-2PD,NA,NA,NA,NA,Drug Offenses,0,0,0,0,0,0,0,NA,NA,NA,NA,NA,NA,NA,NA,NA
UH-3PD,NA,NA,NA,NA,Drug Offenses,0,0,0,0,0,0,0,NA,NA,NA,NA,NA,NA,NA,NA,NA
Unknown,NA,NA,NA,NA,Drug Offenses,41,33,31,20,25,105,35,-24.4,-39,-19.4,-29,NA,NA,NA,NA,NA
