beat,district,area_sq_mi,placename,population,type,total19,total20,total21,total22,last12mos,total_prior3years,avg_prior3years,inc_19to21,inc_19tolast12,inc_21tolast12,inc_prior3yearavgtolast12,rate19,rate20,rate21,rate_last12,rate_prior3years
23J40,23,3.03933481,Ellington Field,0,Property,4,2,2,2,2,8,2.7,-50,-50,0,-26,NA,NA,NA,NA,NA
23J50,23,2.12389492,Hobby Airport,0,Property,135,71,117,148,150,323,107.7,-13.3,11.1,28.2,39,NA,NA,NA,NA,NA
1A10,1,1.74646692,Downtown Central Business District,17000,Property,1740,1112,1255,1749,1770,4107,1369,-27.9,1.7,41,29,10235.3,6541.2,7382.4,10411.8,8052.9
1A20,1,2.44133075,"Fourth Ward, Avondale and Westmoreland",27000,Property,2893,2564,2712,2690,2717,8169,2723,-6.3,-6.1,0.2,-0,10714.8,9496.3,10044.4,10063,10085.2
1A30,1,2.65916892,"Cherryhurst, Mandell Place and Montrose",27000,Property,2224,1600,1429,1699,1728,5253,1751,-35.7,-22.3,20.9,-1,8237,5925.9,5292.6,6400,6485.2
1A40,1,2.45016686,"Tall Timbers, Royden Oaks, River Oaks, Avalon Place and Oak Estates",7000,Property,193,186,175,185,189,554,184.7,-9.3,-2.1,8,2,2757.1,2657.1,2500,2700,2638.6
1A50,1,3.04553452,"Post Oak Park, Afton Oaks, Highland Village, Weslayan, Greenway Plaza and The Compaq Center",26000,Property,1898,1835,1747,2120,2143,5480,1826.7,-8,12.9,22.7,17,7300,7057.7,6719.2,8242.3,7025.8
2A10,2,3.30928608,Irvington and Ryon,18000,Property,709,748,710,892,895,2167,722.3,0.1,26.2,26.1,24,3938.9,4155.6,3944.4,4972.2,4012.8
2A20,2,1.8876461,"Sunset Heights, Brooksmith and Stude",11000,Property,432,429,453,473,480,1314,438,4.9,11.1,6,10,3927.3,3900,4118.2,4363.6,3981.8
2A30,2,4.65858171,"Houston Heights, Norhill and Studemont",31000,Property,1611,1164,1278,1524,1541,4053,1351,-20.7,-4.3,20.6,14,5196.8,3754.8,4122.6,4971,4358.1
2A40,2,1.60546103,Old Sixth Ward and the First Ward,8000,Property,676,659,660,668,675,1995,665,-2.4,-0.1,2.3,2,8450,8237.5,8250,8437.5,8312.5
2A50,2,5.4659844,"Memorial Park, West End, Ashbury and Cottage Grove",29000,Property,2052,1682,1690,1843,1866,5424,1808,-17.6,-9.1,10.4,3,7075.9,5800,5827.6,6434.5,6234.5
2A60,2,4.67447346,"Westport, Holly Park, Lazy Brook, Citadel, Shady Acres and Timbergrove",21000,Property,1062,1117,1152,1312,1330,3331,1110.3,8.5,25.2,15.5,20,5057.1,5319,5485.7,6333.3,5287.1
3B10,3,6.82068773,"Northwest Mall, Brookhollow, White Oak Acres, Oak Forest and Langwood",34000,Property,1970,1939,2024,2603,2633,5933,1977.7,2.7,33.7,30.1,33,5794.1,5702.9,5952.9,7744.1,5816.8
3B30,3,5.310372,"White Oak Acres, Brook Hollow, Oak Forest, Garden Oaks and Shepherd Park Plaza",23000,Property,845,719,684,771,787,2248,749.3,-19.1,-6.9,15.1,5,3673.9,3126.1,2973.9,3421.7,3257.8
3B40,3,3.40013561,"Independence Heights, Melrose and Graceland",13000,Property,800,812,814,848,855,2426,808.7,1.8,6.9,5,6,6153.8,6246.2,6261.5,6576.9,6220.8
3B50,3,3.85259517,"Northline Mall, Stratton Place, Oakwood, Colonial Gardens, Lindale and Junction City",20000,Property,1689,1633,1252,1256,1278,4574,1524.7,-25.9,-24.3,2.1,-16,8445,8165,6260,6390,7623.5
5F10,5,3.25978513,Afton Village and Pine Terrace,14000,Property,765,854,768,780,793,2387,795.7,0.4,3.7,3.3,-0,5464.3,6100,5485.7,5664.3,5683.6
5F30,5,8.70689439,"Fairbanks, Carverdale, Fawndale and Northwest Crossing",17000,Property,2236,2013,2019,2008,2052,6268,2089.3,-9.7,-8.2,1.6,-2,13152.9,11841.2,11876.5,12070.6,12290
6B10,6,5.50084827,"York Plaza, Pembrook Place and Hawthorne Place",33000,Property,1213,1311,1121,1190,1201,3645,1215,-7.6,-1,7.1,-1,3675.8,3972.7,3397,3639.4,3681.8
6B20,6,6.12869477,"Highland Heights, Oakdale and Melrose Gardens",18000,Property,785,759,664,789,800,2208,736,-15.4,1.9,20.5,9,4361.1,4216.7,3688.9,4444.4,4088.9
6B30,6,7.2300685,"Woodland Trails, Oaks of Inwood, Bayou Bend, Cole Creek Manor and Inwood Forest",38000,Property,1078,1066,923,1048,1060,3067,1022.3,-14.4,-1.7,14.8,4,2836.8,2805.3,2428.9,2789.5,2690.3
6B40,6,5.544689,"Highland Gardens, Highland Heights and North Plaza",20000,Property,915,879,832,814,843,2626,875.3,-9.1,-7.9,1.3,-4,4575,4395,4160,4215,4376.5
22B30,22,2.8264671,Aldine and Imperial Valley,19000,Property,902,1042,987,967,982,2931,977,9.4,8.9,-0.5,1,4747.4,5484.2,5194.7,5168.4,5142.1
22B20,22,4.61158268,Greenspoint,24000,Property,1650,1754,1966,1817,1840,5370,1790,19.2,11.5,-6.4,3,6875,7308.3,8191.7,7666.7,7458.3
7C10,7,3.47828324,"Fifth Ward, North Park and Pinecrest",13000,Property,646,615,573,687,695,1834,611.3,-11.3,7.6,21.3,14,4969.2,4730.8,4407.7,5346.2,4702.3
7C20,7,7.08575157,"Huntington Place, Willshire Place, Kashmere Gardens and Liberty Gardens",21000,Property,1043,1026,1052,1104,1120,3121,1040.3,0.9,7.4,6.5,8,4966.7,4885.7,5009.5,5333.3,4953.8
7C30,7,4.51719841,"Camden Woods, Archers Acres and Croyden Gardens",18000,Property,708,765,741,767,776,2214,738,4.7,9.6,4.7,5,3933.3,4250,4116.7,4311.1,4100
7C40,7,3.36786526,Keith-Weiss Park and Farrington Place,8000,Property,381,345,355,427,430,1081,360.3,-6.8,12.9,21.1,19,4762.5,4312.5,4437.5,5375,4503.8
22B40,22,13.03325001,"Intercontinental Airport, Northwood, Lakeview Park and Glen Lee",11000,Property,1063,1098,1464,1743,1777,3625,1208.3,37.7,67.2,21.4,47,9663.6,9981.8,13309.1,16154.5,10984.5
8C10,8,3.69037316,"Tidwell Park, Shady Oak and Buckingham Place",12000,Property,778,668,597,553,564,2043,681,-23.3,-27.5,-5.5,-17,6483.3,5566.7,4975,4700,5675
8C20,8,3.36154214,"Houston Gardens, Rosewood and Homestead",7000,Property,265,291,279,316,320,835,278.3,5.3,20.8,14.7,15,3785.7,4157.1,3985.7,4571.4,3975.7
8C30,8,4.6258259,"Parkhurst, East Houston and Clairmont Place",11000,Property,437,454,438,512,519,1329,443,0.2,18.8,18.5,17,3972.7,4127.3,3981.8,4718.2,4027.3
8C40,8,4.97945551,"Lake Houston, Greenriver, Knoll and Lake Forest",8000,Property,207,168,193,225,228,568,189.3,-6.8,10.1,18.1,20,2587.5,2100,2412.5,2850,2366.3
8C50,8,3.31739498,"Park North, Forest Green, Kentshire Place, Glenwood Forest and Dorchester",8000,Property,389,330,340,320,324,1059,353,-12.6,-16.7,-4.7,-8,4862.5,4125,4250,4050,4412.5
8C60,8,5.79693312,"Edgeworth, Northwood Manor and Scenic Woods",19000,Property,563,617,501,516,522,1681,560.3,-11,-7.3,4.2,-7,2963.2,3247.4,2636.8,2747.4,2948.9
9C10,9,5.21185619,"Port of Houston, Clinton Park, Pleasantville and Fidelity Manor",6000,Property,167,156,165,217,220,488,162.7,-1.2,31.7,33.3,35,2783.3,2600,2750,3666.7,2711.7
9C20,9,7.5383173,Denver Harbor and Houston Harbor,16000,Property,526,559,431,627,635,1516,505.3,-18.1,20.7,47.3,26,3287.5,3493.8,2693.8,3968.8,3158.1
9C30,9,8.13353768,"City Park East, Wynnewood Acres and Wallisville Gardens",9000,Property,682,659,550,610,616,1891,630.3,-19.4,-9.7,12,-2,7577.8,7322.2,6111.1,6844.4,7003.3
9C40,9,10.42549456,"Greens Bayou Estates, Shady Brook, Northshore",23000,Property,1172,1332,1189,1455,1476,3693,1231,1.5,25.9,24.1,20,5095.7,5791.3,5169.6,6417.4,5352.2
10H10,10,2.81830654,Oak Lawn and Ranger,11000,Property,320,387,357,455,460,1064,354.7,11.6,43.8,28.9,30,2909.1,3518.2,3245.5,4181.8,3224.5
10H20,10,1.75743169,Eastwood and Broadmoor,10000,Property,395,400,311,308,311,1106,368.7,-21.3,-21.3,0,-16,3950,4000,3110,3110,3687
10H30,10,1.02691154,Near East End,4000,Property,780,529,631,852,859,1940,646.7,-19.1,10.1,36.1,33,19500,13225,15775,21475,16167.5
10H40,10,0.99627062,Midtown,8000,Property,1518,1050,981,1292,1309,3549,1183,-35.4,-13.8,33.4,11,18975,13125,12262.5,16362.5,14787.5
10H50,10,2.30843079,the University of Houston area,13000,Property,833,781,729,866,877,2343,781,-12.5,5.3,20.3,12,6407.7,6007.7,5607.7,6746.2,6007.7
10H60,10,3.08931006,"University Oaks, Riverside Terrace and the Texas Southern University area",20000,Property,772,763,900,1013,1023,2435,811.7,16.6,32.5,13.7,26,3860,3815,4500,5115,4058.5
10H70,10,3.52217952,"Texas Medical Center, Hermann Park, Houston Zoo and Miller Outdoor Theatre",16000,Property,1285,1215,1089,1414,1434,3589,1196.3,-15.3,11.6,31.7,20,8031.2,7593.8,6806.2,8962.5,7476.9
10H80,10,2.73862779,"Southampton, Rice University area, Shadow Lawn and Broad Acres",19000,Property,871,663,668,703,719,2202,734,-23.3,-17.5,7.6,-2,4584.2,3489.5,3515.8,3784.2,3863.2
11H10,11,5.31502815,"Mason Park, Forest Hill, Sunnyland and Central Park",28000,Property,1087,1115,950,952,964,3152,1050.7,-12.6,-11.3,1.5,-8,3882.1,3982.1,3392.9,3442.9,3752.5
11H20,11,3.9311161,"Harrisburg, Manchester and Pecan Park",18000,Property,387,450,465,403,404,1302,434,20.2,4.4,-13.1,-7,2150,2500,2583.3,2244.4,2411.1
11H30,11,2.84278059,Meadow Brook and Park Place,15000,Property,644,747,558,510,514,1949,649.7,-13.4,-20.2,-7.9,-21,4293.3,4980,3720,3426.7,4331.3
11H40,11,6.14001938,Allendale and Oak Meadows,8000,Property,178,202,168,153,154,548,182.7,-5.6,-13.5,-8.3,-16,2225,2525,2100,1925,2283.8
11H50,11,2.09534157,"Meadow Creek, Ferndale Addition and Glenbrook Industrial",8000,Property,264,306,348,355,365,918,306,31.8,38.3,4.9,19,3300,3825,4350,4562.5,3825
12D10,12,8.55384717,"Almeda Mall, Southridge, Edgebrook and South Houston Gardens",44000,Property,1898,2044,2007,2134,2161,5949,1983,5.7,13.9,7.7,9,4313.6,4645.5,4561.4,4911.4,4506.8
12D20,12,3.83700574,Sage,22000,Property,835,821,835,865,875,2491,830.3,0,4.8,4.8,5,3795.5,3731.8,3795.5,3977.3,3774.1
12D30,12,3.99301158,Gulf Palms and Beamer,15000,Property,379,418,365,404,408,1162,387.3,-3.7,7.7,11.8,5,2526.7,2786.7,2433.3,2720,2582
12D40,12,9.68663455,Scarsdale and Ellington Field,11000,Property,322,359,335,346,351,1016,338.7,4,9,4.8,4,2927.3,3263.6,3045.5,3190.9,3079.1
12D50,12,8.93327581,"Bay Glen, Bay Oaks, Brook Forest and Bay Forest",26000,Property,224,179,165,164,165,568,189.3,-26.3,-26.3,0,-13,861.5,688.5,634.6,634.6,728.1
12D60,12,6.35832041,"NASA's Johnson Space Center, Meadow Green, Oakbrook West and Camino South",22000,Property,343,402,377,310,317,1122,374,9.9,-7.6,-15.9,-15,1559.1,1827.3,1713.6,1440.9,1700
12D70,12,5.39156317,Baybrook Mall and Sterling Knoll,12000,Property,1128,1084,1214,1151,1171,3426,1142,7.6,3.8,-3.5,3,9400,9033.3,10116.7,9758.3,9516.7
13D10,13,5.2433708,"Gulfgate Mall, Bay Forest, Riverview, Hampshire, Golfcrest and Barnett Stadium",23000,Property,1031,1072,1008,983,995,3111,1037,-2.2,-3.5,-1.3,-4,4482.6,4660.9,4382.6,4326.1,4508.7
13D20,13,6.66870859,"Fairlawn, Garden Villas, Glenbrook Valley and Santa Rosa",36000,Property,1538,1486,1447,1452,1470,4471,1490.3,-5.9,-4.4,1.6,-1,4272.2,4127.8,4019.4,4083.3,4139.7
13D30,13,3.07402543,"Allen Farms, Airport Gardens and the Hobby Airport area",2000,Property,129,122,141,111,111,392,130.7,9.3,-14,-21.3,-15,6450,6100,7050,5550,6535
13D40,13,5.0688163,"Val Verde East, Gulf Meadows and Houston Skyscraper Shadows",13000,Property,388,417,385,393,398,1190,396.7,-0.8,2.6,3.4,0,2984.6,3207.7,2961.5,3061.5,3051.5
14D10,14,3.66057918,McGregor Terrace and Riverside Terrace,17000,Property,1081,854,742,786,797,2677,892.3,-31.4,-26.3,7.4,-11,6358.8,5023.5,4364.7,4688.2,5248.8
14D20,14,7.25646368,"Blueridge, Sunnyside, Brook Haven and Bayou Estates",28000,Property,1388,1194,974,1162,1173,3556,1185.3,-29.8,-15.5,20.4,-1,4957.1,4264.3,3478.6,4189.3,4233.2
14D30,14,4.20537595,"Crestmont, Edgewood, Bellfort Park, Inwood Terrace and Southpark",21000,Property,601,584,487,536,542,1672,557.3,-19,-9.8,11.3,-3,2861.9,2781,2319,2581,2653.8
14D40,14,6.61224595,"South Acres, Shamrock Manor, Hillwood and Cloverland",21000,Property,574,560,496,540,541,1630,543.3,-13.6,-5.7,9.1,-0,2733.3,2666.7,2361.9,2576.2,2587.1
14D50,14,8.69627992,"Golden Glade Estates, Langston and Almeda Genoa",9000,Property,328,274,272,311,314,874,291.3,-17.1,-4.3,15.4,8,3644.4,3044.4,3022.2,3488.9,3236.7
15E10,15,4.34996776,"Meyerland Plaza, Robindell, Meyerland, Braeburn Terrace and Maplewood South",24000,Property,929,845,711,789,800,2485,828.3,-23.5,-13.9,12.5,-3,3870.8,3520.8,2962.5,3333.3,3451.2
15E20,15,3.58384499,"Westbury, Park West and Willow Creek",18000,Property,488,560,498,465,478,1546,515.3,2,-2,-4,-7,2711.1,3111.1,2766.7,2655.6,2862.8
15E30,15,6.29133294,"Meyer Park, Post Oak Manor, Westwood, Willow Bend and Linkwood",34000,Property,1380,1245,1059,1124,1129,3684,1228,-23.3,-18.2,6.6,-8,4058.8,3661.8,3114.7,3320.6,3611.8
15E40,15,10.0079174,"NRG Park, Astroworld, Lakes at 610 and Plaza del Oro",30000,Property,2240,1983,2046,2643,2674,6269,2089.7,-8.7,19.4,30.7,28,7466.7,6610,6820,8913.3,6965.7
16E10,16,5.38940818,Canterbury Village and Monarch Estates,15000,Property,450,352,330,382,383,1132,377.3,-26.7,-14.9,16.1,2,3000,2346.7,2200,2553.3,2515.3
16E20,16,8.15202134,"Almeda Plaza, South Glen, Dumbarton Oaks and Briarwick",35000,Property,826,687,775,806,816,2288,762.7,-6.2,-1.2,5.3,7,2360,1962.9,2214.3,2331.4,2179.1
16E30,16,7.00932789,"Greenpark, Southwest Crossing and Windsor Village",22000,Property,629,675,606,561,571,1910,636.7,-3.7,-9.2,-5.8,-10,2859.1,3068.2,2754.5,2595.5,2894.1
16E40,16,7.49721482,"Chasewood, Willowpark, Briarwick, Ridgemont and Quail Run",35000,Property,663,591,644,548,554,1898,632.7,-2.9,-16.4,-14,-12,1894.3,1688.6,1840,1582.9,1807.7
17E10,17,3.3104034,"Southwest Memorial Hospital, Burnett Bayland Park and Westmoreland",51000,Property,1929,1706,1787,1790,1818,5422,1807.3,-7.4,-5.8,1.7,1,3782.4,3345.1,3503.9,3564.7,3543.7
17E20,17,3.92767309,the Houston Baptist University area and Maplewood West,27000,Property,784,762,677,720,735,2223,741,-13.6,-6.2,8.6,-1,2903.7,2822.2,2507.4,2722.2,2744.4
17E30,17,3.8060455,Braeburn Valley West and Glenshire,21000,Property,804,1058,861,825,836,2723,907.7,7.1,4,-2.9,-8,3828.6,5038.1,4100,3981,4322.4
17E40,17,4.70920035,"Creekbend, Southwood and Fondren Southwest",46000,Property,1473,1462,1375,1263,1283,4310,1436.7,-6.7,-12.9,-6.7,-11,3202.2,3178.3,2989.1,2789.1,3123.3
18F10,18,1.95881352,"Saddlebrook, Bayou Woods and Sherwood Forest",7000,Property,249,265,273,294,302,787,262.3,9.6,21.3,10.6,15,3557.1,3785.7,3900,4314.3,3747.1
18F20,18,3.51641691,"The Galleria, Tanglewood, Riverway and Post Oak",24000,Property,2284,2283,2508,2870,2912,7075,2358.3,9.8,27.5,16.1,23,9516.7,9512.5,10450,12133.3,9826.2
18F30,18,3.80008564,"The Richmond Strip, Briargrove, Post Oak Estates and Westhaven",36000,Property,1812,1682,1952,2043,2076,5446,1815.3,7.7,14.6,6.4,14,5033.3,4672.2,5422.2,5766.7,5042.5
18F40,18,2.9060249,"Rosewood General Hospital, Woodlake and Briarmeadow",35000,Property,1948,2121,2127,2181,2202,6196,2065.3,9.2,13,3.5,7,5565.7,6060,6077.1,6291.4,5900.9
18F50,18,2.96939217,"Tanglewild, Sharpstown Mall and Regency Square",20000,Property,1408,1429,1606,1663,1688,4443,1481,14.1,19.9,5.1,14,7040,7145,8030,8440,7405
18F60,18,3.62528697,Sharpstown Country Club and Southway Center,28000,Property,991,1007,1001,973,994,2999,999.7,1,0.3,-0.7,-1,3539.3,3596.4,3575,3550,3570.4
19G10,19,2.74020376,Concourse South and Westwood Mall,31000,Property,1576,1807,1756,1782,1818,5139,1713,11.4,15.4,3.5,6,5083.9,5829,5664.5,5864.5,5525.8
19G20,19,3.29219023,"Catalina Square, Bellaire West, Imperial Point",25000,Property,843,821,682,709,727,2346,782,-19.1,-13.8,6.6,-7,3372,3284,2728,2908,3128
19G30,19,2.49064202,"Rodeo Square, Wildflower Green, Braewood Glen",18000,Property,492,512,424,326,332,1428,476,-13.8,-32.5,-21.7,-30,2733.3,2844.4,2355.6,1844.4,2644.4
19G40,19,4.56425364,"Huntington Village, Wellington Park, Leawood, Keegans Glen",37000,Property,1017,1010,859,864,883,2886,962,-15.5,-13.2,2.8,-8,2748.6,2729.7,2321.6,2386.5,2600
19G50,19,2.30578624,"Forum Park, Stancliff and Southwest Park",18000,Property,673,905,834,656,665,2412,804,23.9,-1.2,-20.3,-17,3738.9,5027.8,4633.3,3694.4,4466.7
20G10,20,3.06600809,"Westchase, Woodchase Village and Point West",29000,Property,1354,1406,1427,1446,1463,4187,1395.7,5.4,8.1,2.5,5,4669,4848.3,4920.7,5044.8,4812.8
20G20,20,3.27621655,"Lakeside Estates, City West Place, Rivercrest and Briargrove Park",18000,Property,575,594,510,479,484,1679,559.7,-11.3,-15.8,-5.1,-14,3194.4,3300,2833.3,2688.9,3109.4
20G30,20,3.97953501,"West Houston Medical Center, Andrau Airport, Westchase and Westchase Mall",26000,Property,1685,1518,1497,1403,1440,4700,1566.7,-11.2,-14.5,-3.8,-8,6480.8,5838.5,5757.7,5538.5,6025.8
20G40,20,4.16594899,"Lakeview Forest, Lakeside Place, Ashford Village and Southlake",28000,Property,1093,1057,925,957,965,3075,1025,-15.4,-11.7,4.3,-6,3903.6,3775,3303.6,3446.4,3660.7
20G70,20,2.38283582,Westpark Village and Ashford Point,21000,Property,583,644,666,578,589,1893,631,14.2,1,-11.6,-7,2776.2,3066.7,3171.4,2804.8,3004.8
20G80,20,25.33626534,City Limits,37000,Property,1319,1283,1332,1290,1309,3934,1311.3,1,-0.8,-1.7,-0,3564.9,3467.6,3600,3537.8,3544.1
21I10,21,0.00549966,Intercontinental Airport,0,Property,258,141,185,247,248,584,194.7,-28.3,-3.9,34.1,27,NA,NA,NA,NA,NA
21I20,21,0.01205019,Intercontinental Airport,0,Property,3,0,9,3,3,12,4,200,0,-66.7,-25,NA,NA,NA,NA,NA
21I30,21,0.01180375,Intercontinental Airport,0,Property,7,2,2,0,0,11,3.7,-71.4,-100,-100,-100,NA,NA,NA,NA,NA
21I40,21,0.00923163,Intercontinental Airport,0,Property,15,6,2,4,4,23,7.7,-86.7,-73.3,100,-48,NA,NA,NA,NA,NA
21I50,21,14.61100076,Intercontinental Airport,0,Property,515,325,446,527,536,1286,428.7,-13.4,4.1,20.2,25,NA,NA,NA,NA,NA
21I70,21,0.01945113,Intercontinental Airport,0,Property,5,1,2,1,1,8,2.7,-60,-80,-50,-63,NA,NA,NA,NA,NA
22B10,22,3.28874287,"Willowbrook, Willow Chase Park and Centerfield",8000,Property,1637,1417,1665,1786,1821,4719,1573,1.7,11.2,9.4,16,20462.5,17712.5,20812.5,22762.5,19662.5
5F20,5,5.94082911,Spring Branch and Schwartz Park,42000,Property,1086,1129,1062,1026,1041,3277,1092.3,-2.2,-4.1,-2,-5,2585.7,2688.1,2528.6,2478.6,2600.7
4F10,4,4.13606469,"Timber Oaks, Shadow Oaks and Long Point Acres",23000,Property,1014,1121,1044,1118,1141,3179,1059.7,3,12.5,9.3,8,4408.7,4873.9,4539.1,4960.9,4607.4
20G50,20,5.88593521,"Nottingham, Yorkshire, Wilchester, Town and Country Village and Memorial City Shopping Center",30000,Property,1669,1375,1341,1486,1507,4385,1461.7,-19.7,-9.7,12.4,3,5563.3,4583.3,4470,5023.3,4872.3
4F20,4,5.85840284,"Claymore Park, Westbranch, Spring Shadows and Kempwood Forest",28000,Property,807,739,790,906,927,2336,778.7,-2.1,14.9,17.3,19,2882.1,2639.3,2821.4,3310.7,2781.1
20G60,20,4.54207617,"Barkers Landing, Fleetwood, Thornwood and Darrel Tully Stadium",22000,Property,926,937,940,820,838,2803,934.3,1.5,-9.5,-10.9,-10,4209.1,4259.1,4272.7,3809.1,4246.8
4F30,4,26.30690179,"Addicks Reservoir Area, Claymore Park, Brittmore Village, Park Ten Place and Mayde Creek Farms",18000,Property,935,975,1049,1003,1010,2959,986.3,12.2,8,-3.7,2,5194.4,5416.7,5827.8,5611.1,5479.4
24C10,24,5.44044978,Kingwood,13000,Property,274,242,218,232,235,734,244.7,-20.4,-14.2,7.8,-4,2107.7,1861.5,1676.9,1807.7,1882.3
24C20,24,6.8291794,Kingwood,18000,Property,207,207,185,182,189,599,199.7,-10.6,-8.7,2.2,-5,1150,1150,1027.8,1050,1109.4
24C30,24,9.78735527,Kingwood,29000,Property,263,232,213,244,247,708,236,-19,-6.1,16,5,906.9,800,734.5,851.7,813.8
24C40,24,35.7992771,Kingwood,6000,Property,108,122,104,121,122,334,111.3,-3.7,13,17.3,10,1800,2033.3,1733.3,2033.3,1855
24C50,24,7.51791807,Kingwood,5000,Property,352,528,552,544,549,1432,477.3,56.8,56,-0.5,15,7040,10560,11040,10980,9546
24C60,24,4.86823328,Kingwood,21000,Property,107,92,83,61,64,282,94,-22.4,-40.2,-22.9,-32,509.5,438.1,395.2,304.8,447.6
21I60,21,0.01236886,Intercontinental Airport,0,Property,40,22,16,15,15,78,26,-60,-62.5,-6.2,-42,NA,NA,NA,NA,NA
FTB4,NA,NA,NA,NA,Property,0,0,0,0,0,0,0,NA,NA,NA,NA,NA,NA,NA,NA,NA
HCC1,NA,NA,NA,NA,Property,0,0,0,1,1,0,0,NA,NA,NA,NA,NA,NA,NA,NA,NA
HCC4,NA,NA,NA,NA,Property,0,0,0,0,0,0,0,NA,NA,NA,NA,NA,NA,NA,NA,NA
HCC5,NA,NA,NA,NA,Property,3,1,2,0,0,6,2,-33.3,-100,-100,-100,NA,NA,NA,NA,NA
HCC7,NA,NA,NA,NA,Property,5,14,1,0,0,20,6.7,-80,-100,-100,-100,NA,NA,NA,NA,NA
HCSO,NA,NA,NA,NA,Property,179,174,23,67,67,376,125.3,-87.2,-62.6,191.3,-47,NA,NA,NA,NA,NA
OOJ,NA,NA,NA,NA,Property,240,214,38,95,95,492,164,-84.2,-60.4,150,-42,NA,NA,NA,NA,NA
UH-2PD,NA,NA,NA,NA,Property,0,0,0,0,0,0,0,NA,NA,NA,NA,NA,NA,NA,NA,NA
UH-3PD,NA,NA,NA,NA,Property,0,0,0,0,0,0,0,NA,NA,NA,NA,NA,NA,NA,NA,NA
Unknown,NA,NA,NA,NA,Property,43,29,10,23,23,82,27.3,-76.7,-46.5,130,-16,NA,NA,NA,NA,NA
