beat,district,area_sq_mi,placename,population,category_name,total19,total20,total21,total22,total23,2024,last12mos,total_prior4years,avg_prior4years,inc_19to22,inc_19tolast12,inc_22tolast12,inc_prior4yearavgtolast12,rate19,rate20,rate21,rate22,rate_last12,rate_prior4years,previous_year
23J40,23,3.03933481,Ellington Field,0,Sexual Assault,0,0,0,0,0,0,0,0,0,NA,NA,NA,NA,NA,NA,NA,NA,NA,NA,0
23J50,23,2.12389492,Hobby Airport,0,Sexual Assault,0,1,0,0,1,0,1,1,0.2,NA,NA,NA,400,NA,NA,NA,NA,NA,NA,0
1A10,1,1.74646692,Downtown Central Business District,17000,Sexual Assault,27,25,33,22,45,7,47,107,26.8,-18.5,74.1,113.6,75.4,158.8,147.1,194.1,129.4,276.5,157.6,22
1A20,1,2.44133075,"Fourth Ward, Avondale and Westmoreland",27000,Sexual Assault,31,24,27,26,18,6,22,108,27,-16.1,-29,-15.4,-18.5,114.8,88.9,100,96.3,81.5,100,26
1A30,1,2.65916892,"Cherryhurst, Mandell Place and Montrose",27000,Sexual Assault,16,21,14,10,18,6,22,61,15.2,-37.5,37.5,120,44.7,59.3,77.8,51.9,37,81.5,56.3,10
1A40,1,2.45016686,"Tall Timbers, Royden Oaks, River Oaks, Avalon Place and Oak Estates",7000,Sexual Assault,2,1,0,1,1,0,0,4,1,-50,-100,-100,-100,28.6,14.3,0,14.3,0,14.3,1
1A50,1,3.04553452,"Post Oak Park, Afton Oaks, Highland Village, Weslayan, Greenway Plaza and The Compaq Center",26000,Sexual Assault,10,13,13,16,11,0,10,52,13,60,0,-37.5,-23.1,38.5,50,50,61.5,38.5,50,16
2A10,2,3.30928608,Irvington and Ryon,18000,Sexual Assault,13,18,21,11,21,2,20,63,15.8,-15.4,53.8,81.8,26.6,72.2,100,116.7,61.1,111.1,87.8,11
2A20,2,1.8876461,"Sunset Heights, Brooksmith and Stude",11000,Sexual Assault,5,5,5,9,5,0,4,24,6,80,-20,-55.6,-33.3,45.5,45.5,45.5,81.8,36.4,54.5,9
2A30,2,4.65858171,"Houston Heights, Norhill and Studemont",31000,Sexual Assault,8,6,7,9,11,0,10,30,7.5,12.5,25,11.1,33.3,25.8,19.4,22.6,29,32.3,24.2,9
2A40,2,1.60546103,Old Sixth Ward and the First Ward,8000,Sexual Assault,9,5,2,5,9,0,8,21,5.2,-44.4,-11.1,60,53.8,112.5,62.5,25,62.5,100,65,5
2A50,2,5.4659844,"Memorial Park, West End, Ashbury and Cottage Grove",29000,Sexual Assault,15,14,15,15,13,1,14,59,14.8,0,-6.7,-6.7,-5.4,51.7,48.3,51.7,51.7,48.3,51,15
2A60,2,4.67447346,"Westport, Holly Park, Lazy Brook, Citadel, Shady Acres and Timbergrove",21000,Sexual Assault,3,5,9,6,10,3,12,23,5.8,100,300,100,106.9,14.3,23.8,42.9,28.6,57.1,27.6,6
3B10,3,6.82068773,"Northwest Mall, Brookhollow, White Oak Acres, Oak Forest and Langwood",34000,Sexual Assault,24,43,33,30,27,0,24,130,32.5,25,0,-20,-26.2,70.6,126.5,97.1,88.2,70.6,95.6,30
3B30,3,5.310372,"White Oak Acres, Brook Hollow, Oak Forest, Garden Oaks and Shepherd Park Plaza",23000,Sexual Assault,8,2,7,6,13,0,12,23,5.8,-25,50,100,106.9,34.8,8.7,30.4,26.1,52.2,25.2,6
3B40,3,3.40013561,"Independence Heights, Melrose and Graceland",13000,Sexual Assault,20,20,17,14,23,0,21,71,17.8,-30,5,50,18,153.8,153.8,130.8,107.7,161.5,136.9,14
3B50,3,3.85259517,"Northline Mall, Stratton Place, Oakwood, Colonial Gardens, Lindale and Junction City",20000,Sexual Assault,27,18,18,23,15,5,18,86,21.5,-14.8,-33.3,-21.7,-16.3,135,90,90,115,90,107.5,23
5F10,5,3.25978513,Afton Village and Pine Terrace,14000,Sexual Assault,10,5,11,8,13,2,13,34,8.5,-20,30,62.5,52.9,71.4,35.7,78.6,57.1,92.9,60.7,8
5F30,5,8.70689439,"Fairbanks, Carverdale, Fawndale and Northwest Crossing",17000,Sexual Assault,20,16,20,18,21,3,23,74,18.5,-10,15,27.8,24.3,117.6,94.1,117.6,105.9,135.3,108.8,18
6B10,6,5.50084827,"York Plaza, Pembrook Place and Hawthorne Place",33000,Sexual Assault,20,30,29,27,26,0,23,106,26.5,35,15,-14.8,-13.2,60.6,90.9,87.9,81.8,69.7,80.3,27
6B20,6,6.12869477,"Highland Heights, Oakdale and Melrose Gardens",18000,Sexual Assault,27,19,19,17,18,9,26,82,20.5,-37,-3.7,52.9,26.8,150,105.6,105.6,94.4,144.4,113.9,17
6B30,6,7.2300685,"Woodland Trails, Oaks of Inwood, Bayou Bend, Cole Creek Manor and Inwood Forest",38000,Sexual Assault,19,30,11,21,32,4,33,81,20.2,10.5,73.7,57.1,63.4,50,78.9,28.9,55.3,86.8,53.2,21
6B40,6,5.544689,"Highland Gardens, Highland Heights and North Plaza",20000,Sexual Assault,27,14,17,13,20,4,24,71,17.8,-51.9,-11.1,84.6,34.8,135,70,85,65,120,89,13
22B30,22,2.8264671,Aldine and Imperial Valley,19000,Sexual Assault,16,11,16,15,20,0,17,58,14.5,-6.2,6.2,13.3,17.2,84.2,57.9,84.2,78.9,89.5,76.3,15
22B20,22,4.61158268,Greenspoint,24000,Sexual Assault,39,34,39,34,36,0,33,146,36.5,-12.8,-15.4,-2.9,-9.6,162.5,141.7,162.5,141.7,137.5,152.1,34
7C10,7,3.47828324,"Fifth Ward, North Park and Pinecrest",13000,Sexual Assault,12,17,18,12,17,0,17,59,14.8,0,41.7,41.7,14.9,92.3,130.8,138.5,92.3,130.8,113.8,12
7C20,7,7.08575157,"Huntington Place, Willshire Place, Kashmere Gardens and Liberty Gardens",21000,Sexual Assault,50,41,33,25,36,7,41,149,37.2,-50,-18,64,10.2,238.1,195.2,157.1,119,195.2,177.1,25
7C30,7,4.51719841,"Camden Woods, Archers Acres and Croyden Gardens",18000,Sexual Assault,22,19,23,16,25,3,22,80,20,-27.3,0,37.5,10,122.2,105.6,127.8,88.9,122.2,111.1,16
7C40,7,3.36786526,Keith-Weiss Park and Farrington Place,8000,Sexual Assault,6,7,2,12,10,0,10,27,6.8,100,66.7,-16.7,47.1,75,87.5,25,150,125,85,12
22B40,22,13.03325001,"Intercontinental Airport, Northwood, Lakeview Park and Glen Lee",11000,Sexual Assault,11,14,15,10,7,1,8,50,12.5,-9.1,-27.3,-20,-36,100,127.3,136.4,90.9,72.7,113.6,10
8C10,8,3.69037316,"Tidwell Park, Shady Oak and Buckingham Place",12000,Sexual Assault,12,14,19,17,26,4,28,62,15.5,41.7,133.3,64.7,80.6,100,116.7,158.3,141.7,233.3,129.2,17
8C20,8,3.36154214,"Houston Gardens, Rosewood and Homestead",7000,Sexual Assault,5,3,6,2,6,0,6,16,4,-60,20,200,50,71.4,42.9,85.7,28.6,85.7,57.1,2
8C30,8,4.6258259,"Parkhurst, East Houston and Clairmont Place",11000,Sexual Assault,4,10,10,7,9,0,8,31,7.8,75,100,14.3,2.6,36.4,90.9,90.9,63.6,72.7,70.9,7
8C40,8,4.97945551,"Lake Houston, Greenriver, Knoll and Lake Forest",8000,Sexual Assault,5,6,1,1,5,4,9,13,3.2,-80,80,800,181.2,62.5,75,12.5,12.5,112.5,40,1
8C50,8,3.31739498,"Park North, Forest Green, Kentshire Place, Glenwood Forest and Dorchester",8000,Sexual Assault,7,9,11,8,15,0,10,35,8.8,14.3,42.9,25,13.6,87.5,112.5,137.5,100,125,110,8
8C60,8,5.79693312,"Edgeworth, Northwood Manor and Scenic Woods",19000,Sexual Assault,18,14,17,9,14,2,14,58,14.5,-50,-22.2,55.6,-3.4,94.7,73.7,89.5,47.4,73.7,76.3,9
9C10,9,5.21185619,"Port of Houston, Clinton Park, Pleasantville and Fidelity Manor",6000,Sexual Assault,4,4,10,3,5,0,5,21,5.2,-25,25,66.7,-3.8,66.7,66.7,166.7,50,83.3,86.7,3
9C20,9,7.5383173,Denver Harbor and Houston Harbor,16000,Sexual Assault,11,11,9,17,6,2,7,48,12,54.5,-36.4,-58.8,-41.7,68.8,68.8,56.2,106.3,43.8,75,17
9C30,9,8.13353768,"City Park East, Wynnewood Acres and Wallisville Gardens",9000,Sexual Assault,9,11,17,4,15,2,17,41,10.2,-55.6,88.9,325,66.7,100,122.2,188.9,44.4,188.9,113.3,4
9C40,9,10.42549456,"Greens Bayou Estates, Shady Brook, Northshore",23000,Sexual Assault,20,15,15,28,19,0,15,78,19.5,40,-25,-46.4,-23.1,87,65.2,65.2,121.7,65.2,84.8,28
10H10,10,2.81830654,Oak Lawn and Ranger,11000,Sexual Assault,10,5,11,2,7,0,6,28,7,-80,-40,200,-14.3,90.9,45.5,100,18.2,54.5,63.6,2
10H20,10,1.75743169,Eastwood and Broadmoor,10000,Sexual Assault,5,6,3,5,11,0,9,19,4.8,0,80,80,87.5,50,60,30,50,90,48,5
10H30,10,1.02691154,Near East End,4000,Sexual Assault,8,5,6,5,7,0,7,24,6,-37.5,-12.5,40,16.7,200,125,150,125,175,150,5
10H40,10,0.99627062,Midtown,8000,Sexual Assault,16,16,23,25,12,4,14,80,20,56.2,-12.5,-44,-30,200,200,287.5,312.5,175,250,25
10H50,10,2.30843079,the University of Houston area,13000,Sexual Assault,14,11,12,11,20,2,20,48,12,-21.4,42.9,81.8,66.7,107.7,84.6,92.3,84.6,153.8,92.3,11
10H60,10,3.08931006,"University Oaks, Riverside Terrace and the Texas Southern University area",20000,Sexual Assault,20,14,13,12,14,1,15,59,14.8,-40,-25,25,1.4,100,70,65,60,75,74,12
10H70,10,3.52217952,"Texas Medical Center, Hermann Park, Houston Zoo and Miller Outdoor Theatre",16000,Sexual Assault,28,32,45,38,54,3,51,143,35.8,35.7,82.1,34.2,42.5,175,200,281.2,237.5,318.8,223.8,38
10H80,10,2.73862779,"Southampton, Rice University area, Shadow Lawn and Broad Acres",19000,Sexual Assault,21,6,13,9,9,3,9,49,12.2,-57.1,-57.1,0,-26.2,110.5,31.6,68.4,47.4,47.4,64.2,9
11H10,11,5.31502815,"Mason Park, Forest Hill, Sunnyland and Central Park",28000,Sexual Assault,24,23,28,25,17,0,15,100,25,4.2,-37.5,-40,-40,85.7,82.1,100,89.3,53.6,89.3,25
11H20,11,3.9311161,"Harrisburg, Manchester and Pecan Park",18000,Sexual Assault,8,9,20,10,8,1,9,47,11.8,25,12.5,-10,-23.7,44.4,50,111.1,55.6,50,65.6,10
11H30,11,2.84278059,Meadow Brook and Park Place,15000,Sexual Assault,15,12,9,11,13,3,12,47,11.8,-26.7,-20,9.1,1.7,100,80,60,73.3,80,78.7,11
11H40,11,6.14001938,Allendale and Oak Meadows,8000,Sexual Assault,4,2,7,2,2,0,1,15,3.8,-50,-75,-50,-73.7,50,25,87.5,25,12.5,47.5,2
11H50,11,2.09534157,"Meadow Creek, Ferndale Addition and Glenbrook Industrial",8000,Sexual Assault,4,18,8,4,8,0,7,34,8.5,0,75,75,-17.6,50,225,100,50,87.5,106.3,4
12D10,12,8.55384717,"Almeda Mall, Southridge, Edgebrook and South Houston Gardens",44000,Sexual Assault,31,29,33,32,32,0,29,125,31.2,3.2,-6.5,-9.4,-7.1,70.5,65.9,75,72.7,65.9,70.9,32
12D20,12,3.83700574,Sagemont,22000,Sexual Assault,12,14,10,6,10,1,11,42,10.5,-50,-8.3,83.3,4.8,54.5,63.6,45.5,27.3,50,47.7,6
12D30,12,3.99301158,Gulf Palms and Beamer,15000,Sexual Assault,3,3,9,4,9,0,8,19,4.8,33.3,166.7,100,66.7,20,20,60,26.7,53.3,32,4
12D40,12,9.68663455,Scarsdale and Ellington Field,11000,Sexual Assault,10,7,8,16,8,2,10,41,10.2,60,0,-37.5,-2,90.9,63.6,72.7,145.5,90.9,92.7,16
12D50,12,8.93327581,"Bay Glen, Bay Oaks, Brook Forest and Bay Forest",26000,Sexual Assault,4,8,5,5,6,0,6,22,5.5,25,50,20,9.1,15.4,30.8,19.2,19.2,23.1,21.2,5
12D60,12,6.35832041,"NASA's Johnson Space Center, Meadow Green, Oakbrook West and Camino South",22000,Sexual Assault,15,9,23,4,10,1,8,51,12.8,-73.3,-46.7,100,-37.5,68.2,40.9,104.5,18.2,36.4,58.2,4
12D70,12,5.39156317,Baybrook Mall and Sterling Knoll,12000,Sexual Assault,8,7,8,10,16,0,15,33,8.2,25,87.5,50,82.9,66.7,58.3,66.7,83.3,125,68.3,10
13D10,13,5.2433708,"Gulfgate Mall, Bay Forest, Riverview, Hampshire, Golfcrest and Barnett Stadium",23000,Sexual Assault,30,20,25,18,15,2,16,93,23.2,-40,-46.7,-11.1,-31,130.4,87,108.7,78.3,69.6,100.9,18
13D20,13,6.66870859,"Fairlawn, Garden Villas, Glenbrook Valley and Santa Rosa",36000,Sexual Assault,31,31,22,38,32,5,34,122,30.5,22.6,9.7,-10.5,11.5,86.1,86.1,61.1,105.6,94.4,84.7,38
13D30,13,3.07402543,"Allen Farms, Airport Gardens and the Hobby Airport area",2000,Sexual Assault,5,1,0,3,1,0,1,9,2.2,-40,-80,-66.7,-54.5,250,50,0,150,50,110,3
13D40,13,5.0688163,"Val Verde East, Gulf Meadows and Houston Skyscraper Shadows",13000,Sexual Assault,8,15,1,9,6,0,6,33,8.2,12.5,-25,-33.3,-26.8,61.5,115.4,7.7,69.2,46.2,63.1,9
14D10,14,3.66057918,McGregor Terrace and Riverside Terrace,17000,Sexual Assault,21,31,19,15,33,1,31,86,21.5,-28.6,47.6,106.7,44.2,123.5,182.4,111.8,88.2,182.4,126.5,15
14D20,14,7.25646368,"Sunnyside, Brook Haven and Bayou Estates",28000,Sexual Assault,43,38,37,23,29,5,30,141,35.2,-46.5,-30.2,30.4,-14.8,153.6,135.7,132.1,82.1,107.1,125.7,23
14D30,14,4.20537595,"Crestmont, Edgewood, Bellfort Park, Inwood Terrace and Southpark",21000,Sexual Assault,21,14,8,15,19,0,17,58,14.5,-28.6,-19,13.3,17.2,100,66.7,38.1,71.4,81,69,15
14D40,14,6.61224595,"South Acres, Shamrock Manor, Hillwood and Cloverland",21000,Sexual Assault,23,18,13,12,14,1,13,66,16.5,-47.8,-43.5,8.3,-21.2,109.5,85.7,61.9,57.1,61.9,78.6,12
14D50,14,8.69627992,"Golden Glade Estates, Langston and Almeda Genoa",9000,Sexual Assault,3,7,4,3,11,0,11,17,4.2,0,266.7,266.7,161.9,33.3,77.8,44.4,33.3,122.2,46.7,3
15E10,15,4.34996776,"Meyerland Plaza, Robindell, Meyerland, Braeburn Terrace and Maplewood South",24000,Sexual Assault,5,8,10,8,10,0,9,31,7.8,60,80,12.5,15.4,20.8,33.3,41.7,33.3,37.5,32.5,8
15E20,15,3.58384499,"Westbury, Park West and Willow Creek",18000,Sexual Assault,8,16,3,4,3,1,4,31,7.8,-50,-50,0,-48.7,44.4,88.9,16.7,22.2,22.2,43.3,4
15E30,15,6.29133294,"Meyer Park, Post Oak Manor, Westwood, Willow Bend and Linkwood",34000,Sexual Assault,17,9,16,13,14,2,14,55,13.8,-23.5,-17.6,7.7,1.4,50,26.5,47.1,38.2,41.2,40.6,13
15E40,15,10.0079174,"NRG Park, Astroworld, Lakes at 610 and Plaza del Oro",30000,Sexual Assault,22,15,23,22,35,1,29,82,20.5,0,31.8,31.8,41.5,73.3,50,76.7,73.3,96.7,68.3,22
16E10,16,5.38940818,Canterbury Village and Monarch Estates,15000,Sexual Assault,9,6,4,2,13,0,11,21,5.2,-77.8,22.2,450,111.5,60,40,26.7,13.3,73.3,34.7,2
16E20,16,8.15202134,"Almeda Plaza, South Glen, Dumbarton Oaks and Briarwick",35000,Sexual Assault,13,16,23,14,27,0,24,66,16.5,7.7,84.6,71.4,45.5,37.1,45.7,65.7,40,68.6,47.1,14
16E30,16,7.00932789,"Greenpark, Southwest Crossing and Windsor Village",22000,Sexual Assault,17,12,16,17,11,2,13,62,15.5,0,-23.5,-23.5,-16.1,77.3,54.5,72.7,77.3,59.1,70.5,17
16E40,16,7.49721482,"Chasewood, Willowpark, Briarwick, Ridgemont and Quail Run",35000,Sexual Assault,15,21,11,11,20,1,19,58,14.5,-26.7,26.7,72.7,31,42.9,60,31.4,31.4,54.3,41.4,11
17E10,17,3.3104034,"Southwest Memorial Hospital, Burnett Bayland Park and Westmoreland",51000,Sexual Assault,54,39,44,42,38,5,43,179,44.8,-22.2,-20.4,2.4,-4,105.9,76.5,86.3,82.4,84.3,87.8,42
17E20,17,3.92767309,the Houston Baptist University area and Maplewood West,27000,Sexual Assault,37,19,38,26,23,5,24,120,30,-29.7,-35.1,-7.7,-20,137,70.4,140.7,96.3,88.9,111.1,26
17E30,17,3.8060455,Braeburn Valley West and Glenshire,21000,Sexual Assault,17,30,24,13,33,2,31,84,21,-23.5,82.4,138.5,47.6,81,142.9,114.3,61.9,147.6,100,13
17E40,17,4.70920035,"Creekbend, Southwood and Fondren Southwest",46000,Sexual Assault,46,39,34,30,48,1,43,149,37.2,-34.8,-6.5,43.3,15.6,100,84.8,73.9,65.2,93.5,80.9,30
18F10,18,1.95881352,"Saddlebrook, Bayou Woods and Sherwood Forest",7000,Sexual Assault,6,4,2,3,3,1,4,15,3.8,-50,-33.3,33.3,5.3,85.7,57.1,28.6,42.9,57.1,54.3,3
18F20,18,3.51641691,"The Galleria, Tanglewood, Riverway and Post Oak",24000,Sexual Assault,13,25,27,21,22,3,23,86,21.5,61.5,76.9,9.5,7,54.2,104.2,112.5,87.5,95.8,89.6,21
18F30,18,3.80008564,"The Richmond Strip, Briargrove, Post Oak Estates and Westhaven",36000,Sexual Assault,20,27,33,34,27,3,30,114,28.5,70,50,-11.8,5.3,55.6,75,91.7,94.4,83.3,79.2,34
18F40,18,2.9060249,"Rosewood General Hospital, Woodlake and Briarmeadow",35000,Sexual Assault,28,22,21,22,28,1,26,93,23.2,-21.4,-7.1,18.2,12.1,80,62.9,60,62.9,74.3,66.3,22
18F50,18,2.96939217,"Tanglewild, Sharpstown Mall and Regency Square",20000,Sexual Assault,33,17,20,33,26,1,23,103,25.8,0,-30.3,-30.3,-10.9,165,85,100,165,115,129,33
18F60,18,3.62528697,Sharpstown Country Club and Southway Center,28000,Sexual Assault,27,13,17,9,8,0,7,66,16.5,-66.7,-74.1,-22.2,-57.6,96.4,46.4,60.7,32.1,25,58.9,9
19G10,19,2.74020376,Concourse South and Westwood Mall,31000,Sexual Assault,41,39,32,24,35,3,35,136,34,-41.5,-14.6,45.8,2.9,132.3,125.8,103.2,77.4,112.9,109.7,24
19G20,19,3.29219023,"Catalina Square, Bellaire West, Imperial Point",25000,Sexual Assault,14,22,10,12,15,0,14,58,14.5,-14.3,0,16.7,-3.4,56,88,40,48,56,58,12
19G30,19,2.49064202,"Rodeo Square, Wildflower Green, Braewood Glen",18000,Sexual Assault,10,12,5,4,9,0,7,31,7.8,-60,-30,75,-10.3,55.6,66.7,27.8,22.2,38.9,43.3,4
19G40,19,4.56425364,"Huntington Village, Wellington Park, Leawood, Keegans Glen",37000,Sexual Assault,34,18,27,15,28,0,23,94,23.5,-55.9,-32.4,53.3,-2.1,91.9,48.6,73,40.5,62.2,63.5,15
19G50,19,2.30578624,"Forum Park, Stancliff and Southwest Park",18000,Sexual Assault,30,32,18,15,15,2,14,95,23.8,-50,-53.3,-6.7,-41.2,166.7,177.8,100,83.3,77.8,132.2,15
20G10,20,3.06600809,"Westchase, Woodchase Village and Point West",29000,Sexual Assault,22,20,24,20,21,0,20,86,21.5,-9.1,-9.1,0,-7,75.9,69,82.8,69,69,74.1,20
20G20,20,3.27621655,"Lakeside Estates, City West Place, Rivercrest and Briargrove Park",18000,Sexual Assault,3,14,6,7,8,0,8,30,7.5,133.3,166.7,14.3,6.7,16.7,77.8,33.3,38.9,44.4,41.7,7
20G30,20,3.97953501,"West Houston Medical Center, Andrau Airport, Westchase and Westchase Mall",26000,Sexual Assault,13,32,31,30,26,2,26,106,26.5,130.8,100,-13.3,-1.9,50,123.1,119.2,115.4,100,101.9,30
20G40,20,4.16594899,"Lakeview Forest, Lakeside Place, Ashford Village and Southlake",28000,Sexual Assault,26,14,15,27,19,2,21,82,20.5,3.8,-19.2,-22.2,2.4,92.9,50,53.6,96.4,75,73.2,27
20G70,20,2.38283582,Westpark Village and Ashford Point,21000,Sexual Assault,15,17,12,20,12,1,12,64,16,33.3,-20,-40,-25,71.4,81,57.1,95.2,57.1,76.2,20
20G80,20,25.33626534,City Limits,37000,Sexual Assault,17,14,18,18,17,1,15,67,16.8,5.9,-11.8,-16.7,-10.7,45.9,37.8,48.6,48.6,40.5,45.4,18
21I10,21,0.00549966,Intercontinental Airport,0,Sexual Assault,0,0,0,0,1,0,1,0,0,NA,NA,NA,NA,NA,NA,NA,NA,NA,NA,0
21I20,21,0.01205019,Intercontinental Airport,0,Sexual Assault,0,0,0,0,0,0,0,0,0,NA,NA,NA,NA,NA,NA,NA,NA,NA,NA,0
21I30,21,0.01180375,Intercontinental Airport,0,Sexual Assault,0,0,0,0,0,0,0,0,0,NA,NA,NA,NA,NA,NA,NA,NA,NA,NA,0
21I40,21,0.00923163,Intercontinental Airport,0,Sexual Assault,0,0,0,0,2,0,2,0,0,NA,NA,NA,NA,NA,NA,NA,NA,NA,NA,0
21I50,21,14.61100076,Intercontinental Airport,0,Sexual Assault,2,0,3,1,2,0,1,6,1.5,-50,-50,0,-33.3,NA,NA,NA,NA,NA,NA,1
21I70,21,0.01945113,Intercontinental Airport,0,Sexual Assault,0,0,0,0,0,0,0,0,0,NA,NA,NA,NA,NA,NA,NA,NA,NA,NA,0
22B10,22,3.28874287,"Willowbrook, Willow Chase Park and Centerfield",8000,Sexual Assault,11,14,8,12,6,0,6,45,11.2,9.1,-45.5,-50,-46.4,137.5,175,100,150,75,140,12
5F20,5,5.94082911,Spring Branch and Schwartz Park,42000,Sexual Assault,31,25,31,19,32,4,31,106,26.5,-38.7,0,63.2,17,73.8,59.5,73.8,45.2,73.8,63.1,19
4F10,4,4.13606469,"Timber Oaks, Shadow Oaks and Long Point Acres",23000,Sexual Assault,21,11,18,22,16,2,15,72,18,4.8,-28.6,-31.8,-16.7,91.3,47.8,78.3,95.7,65.2,78.3,22
20G50,20,5.88593521,"Nottingham, Yorkshire, Wilchester, Town and Country Village and Memorial City Shopping Center",30000,Sexual Assault,12,10,13,15,14,1,14,50,12.5,25,16.7,-6.7,12,40,33.3,43.3,50,46.7,41.7,15
4F20,4,5.85840284,"Claymore Park, Westbranch, Spring Shadows and Kempwood Forest",28000,Sexual Assault,22,23,11,14,17,1,17,70,17.5,-36.4,-22.7,21.4,-2.9,78.6,82.1,39.3,50,60.7,62.5,14
20G60,20,4.54207617,"Barkers Landing, Fleetwood, Thornwood and Darrel Tully Stadium",23000,Sexual Assault,10,16,7,8,10,0,9,41,10.2,-20,-10,12.5,-11.8,43.5,69.6,30.4,34.8,39.1,44.3,8
4F30,4,26.30690179,"Addicks Reservoir Area, Claymore Park, Brittmore Village, Park Ten Place and Mayde Creek Farms",18000,Sexual Assault,19,17,11,14,19,0,18,61,15.2,-26.3,-5.3,28.6,18.4,105.6,94.4,61.1,77.8,100,84.4,14
24C10,24,5.44044978,Kingwood,13000,Sexual Assault,6,10,5,5,2,0,1,26,6.5,-16.7,-83.3,-80,-84.6,46.2,76.9,38.5,38.5,7.7,50,5
24C20,24,6.8291794,Kingwood,18000,Sexual Assault,6,4,7,2,6,0,6,19,4.8,-66.7,0,200,25,33.3,22.2,38.9,11.1,33.3,26.7,2
24C30,24,9.78735527,Kingwood,29000,Sexual Assault,5,3,8,5,3,0,2,21,5.2,0,-60,-60,-61.5,17.2,10.3,27.6,17.2,6.9,17.9,5
24C40,24,35.7992771,Kingwood,6000,Sexual Assault,6,1,1,1,2,1,3,9,2.2,-83.3,-50,200,36.4,100,16.7,16.7,16.7,50,36.7,1
24C50,24,7.51791807,Kingwood,5000,Sexual Assault,2,0,5,6,11,1,12,13,3.2,200,500,100,275,40,0,100,120,240,64,6
24C60,24,4.86823328,Kingwood,21000,Sexual Assault,2,3,5,1,2,0,2,11,2.8,-50,0,100,-28.6,9.5,14.3,23.8,4.8,9.5,13.3,1
21I60,21,0.01236886,Intercontinental Airport,0,Sexual Assault,1,0,1,0,0,0,0,2,0.5,-100,-100,NA,-100,NA,NA,NA,NA,NA,NA,0
