beat,district,area_sq_mi,placename,population,category_name,total22,total19,total20,total21,last12mos,total_prior3years,avg_prior3years,inc_19to21,inc_19tolast12,inc_21tolast12,inc_prior3yearavgtolast12,rate19,rate20,rate21,rate_last12,rate_prior3years
23J50,23,2.12389492,Intercontinental Airport,0,Sexual Assault,0,0,1,0,0,1,0.3,NA,NA,NA,-100,NA,NA,NA,NA,NA
1A10,1,1.74646692,Downtown Central Business District,17000,Sexual Assault,16,27,25,33,25,85,28.3,22.2,-7.4,-24.2,-12,158.8,147.1,194.1,147.1,166.5
1A20,1,2.44133075,"Fourth Ward, Avondale and Westmoreland",27000,Sexual Assault,20,31,24,27,27,82,27.3,-12.9,-12.9,0,-1,114.8,88.9,100,100,101.1
1A30,1,2.65916892,"Cherryhurst, Mandell Place and Montrose",27000,Sexual Assault,6,16,21,14,10,51,17,-12.5,-37.5,-28.6,-41,59.3,77.8,51.9,37,63
1A40,1,2.45016686,"Tall Timbers, Royden Oaks, River Oaks, Avalon Place and Oak Estates",7000,Sexual Assault,1,2,1,0,1,3,1,-100,-50,NA,0,28.6,14.3,0,14.3,14.3
1A50,1,3.04553452,"Post Oak Park, Afton Oaks, Highland Village, Weslayan, Greenway Plaza and The Compaq Center",26000,Sexual Assault,8,10,13,13,12,36,12,30,20,-7.7,0,38.5,50,50,46.2,46.2
2A10,2,3.30928608,Irvington and Ryon,18000,Sexual Assault,8,13,18,21,13,52,17.3,61.5,0,-38.1,-25,72.2,100,116.7,72.2,96.1
2A20,2,1.8876461,"Sunset Heights, Brooksmith and Stude",11000,Sexual Assault,4,5,5,5,5,15,5,0,0,0,0,45.5,45.5,45.5,45.5,45.5
2A30,2,4.65858171,"Houston Heights, Norhill and Studemont",31000,Sexual Assault,7,8,6,7,8,21,7,-12.5,0,14.3,14,25.8,19.4,22.6,25.8,22.6
2A40,2,1.60546103,Old Sixth Ward and the First Ward,8000,Sexual Assault,5,9,5,2,5,16,5.3,-77.8,-44.4,150,-6,112.5,62.5,25,62.5,66.2
2A50,2,5.4659844,"Memorial Park, West End, Ashbury and Cottage Grove",29000,Sexual Assault,8,15,14,15,15,44,14.7,0,0,0,2,51.7,48.3,51.7,51.7,50.7
2A60,2,4.67447346,"Westport, Holly Park, Lazy Brook, Citadel, Shady Acres and Timbergrove",21000,Sexual Assault,3,3,5,9,5,17,5.7,200,66.7,-44.4,-12,14.3,23.8,42.9,23.8,27.1
3B10,3,6.82068773,"Northwest Mall, Brookhollow, White Oak Acres, Oak Forest and Langwood",34000,Sexual Assault,19,24,43,33,28,100,33.3,37.5,16.7,-15.2,-16,70.6,126.5,97.1,82.4,97.9
3B30,3,5.310372,"White Oak Acres, Brook Hollow, Oak Forest, Garden Oaks and Shepherd Park Plaza",23000,Sexual Assault,2,8,2,7,3,17,5.7,-12.5,-62.5,-57.1,-47,34.8,8.7,30.4,13,24.8
3B40,3,3.40013561,"Independence Heights, Melrose and Graceland",13000,Sexual Assault,8,20,20,17,12,57,19,-15,-40,-29.4,-37,153.8,153.8,130.8,92.3,146.2
3B50,3,3.85259517,"Northline Mall, Stratton Place, Oakwood, Colonial Gardens, Lindale and Junction City",20000,Sexual Assault,14,27,18,18,20,63,21,-33.3,-25.9,11.1,-5,135,90,90,100,105
5F10,5,3.25978513,Afton Village and Pine Terrace,14000,Sexual Assault,5,10,5,11,8,26,8.7,10,-20,-27.3,-8,71.4,35.7,78.6,57.1,62.1
5F30,5,8.70689439,"Fairbanks, Carverdale, Fawndale and Northwest Crossing",17000,Sexual Assault,13,20,16,20,16,56,18.7,0,-20,-20,-14,117.6,94.1,117.6,94.1,110
6B10,6,5.50084827,"York Plaza, Pembrook Place and Hawthorne Place",33000,Sexual Assault,15,20,30,29,27,79,26.3,45,35,-6.9,3,60.6,90.9,87.9,81.8,79.7
6B20,6,6.12869477,"Highland Heights, Oakdale and Melrose Gardens",18000,Sexual Assault,9,27,19,19,14,65,21.7,-29.6,-48.1,-26.3,-35,150,105.6,105.6,77.8,120.6
6B30,6,7.2300685,"Woodland Trails, Oaks of Inwood, Bayou Bend, Cole Creek Manor and Inwood Forest",38000,Sexual Assault,11,19,30,11,12,60,20,-42.1,-36.8,9.1,-40,50,78.9,28.9,31.6,52.6
6B40,6,5.544689,"Highland Gardens, Highland Heights and North Plaza",20000,Sexual Assault,11,27,14,17,12,58,19.3,-37,-55.6,-29.4,-38,135,70,85,60,96.5
22B30,22,2.8264671,Aldine and Imperial Valley,19000,Sexual Assault,11,16,11,16,13,43,14.3,0,-18.8,-18.8,-9,84.2,57.9,84.2,68.4,75.3
22B20,22,4.61158268,Greenspoint,24000,Sexual Assault,23,39,34,39,33,112,37.3,0,-15.4,-15.4,-12,162.5,141.7,162.5,137.5,155.4
7C10,7,3.47828324,"Fifth Ward, North Park and Pinecrest",13000,Sexual Assault,6,12,17,18,10,47,15.7,50,-16.7,-44.4,-36,92.3,130.8,138.5,76.9,120.8
7C20,7,7.08575157,"Huntington Place, Willshire Place, Kashmere Gardens and Liberty Gardens",21000,Sexual Assault,13,50,41,33,17,124,41.3,-34,-66,-48.5,-59,238.1,195.2,157.1,81,196.7
7C30,7,4.51719841,"Camden Woods, Archers Acres and Croyden Gardens",18000,Sexual Assault,13,22,19,23,18,64,21.3,4.5,-18.2,-21.7,-15,122.2,105.6,127.8,100,118.3
7C40,7,3.36786526,Keith-Weiss Park and Farrington Place,8000,Sexual Assault,8,6,7,2,8,15,5,-66.7,33.3,300,60,75,87.5,25,100,62.5
22B40,22,13.03325001,"Intercontinental Airport, Northwood, Lakeview Park and Glen Lee",11000,Sexual Assault,9,11,14,15,15,40,13.3,36.4,36.4,0,13,100,127.3,136.4,136.4,120.9
8C10,8,3.69037316,"Tidwell Park, Shady Oak and Buckingham Place",12000,Sexual Assault,12,12,14,19,16,45,15,58.3,33.3,-15.8,7,100,116.7,158.3,133.3,125
8C20,8,3.36154214,"Houston Gardens, Rosewood and Homestead",7000,Sexual Assault,0,5,3,6,1,14,4.7,20,-80,-83.3,-79,71.4,42.9,85.7,14.3,67.1
8C30,8,4.6258259,"Parkhurst, East Houston and Clairmont Place",11000,Sexual Assault,4,4,10,10,5,24,8,150,25,-50,-38,36.4,90.9,90.9,45.5,72.7
8C40,8,4.97945551,"Lake Houston, Greenriver, Knoll and Lake Forest",8000,Sexual Assault,1,5,6,1,2,12,4,-80,-60,100,-50,62.5,75,12.5,25,50
8C50,8,3.31739498,"Park North, Forest Green, Kentshire Place, Glenwood Forest and Dorchester",8000,Sexual Assault,4,7,9,11,8,27,9,57.1,14.3,-27.3,-11,87.5,112.5,137.5,100,112.5
8C60,8,5.79693312,"Edgeworth, Northwood Manor and Scenic Woods",19000,Sexual Assault,7,18,14,17,8,49,16.3,-5.6,-55.6,-52.9,-51,94.7,73.7,89.5,42.1,85.8
9C10,9,5.21185619,"Port of Houston, Clinton Park, Pleasantville and Fidelity Manor",6000,Sexual Assault,2,4,4,10,4,18,6,150,0,-60,-33,66.7,66.7,166.7,66.7,100
9C20,9,7.5383173,Denver Harbor and Houston Harbor,16000,Sexual Assault,9,11,11,9,11,31,10.3,-18.2,0,22.2,7,68.8,68.8,56.2,68.8,64.4
9C30,9,8.13353768,"City Park East, Wynnewood Acres and Wallisville Gardens",9000,Sexual Assault,4,9,11,17,10,37,12.3,88.9,11.1,-41.2,-19,100,122.2,188.9,111.1,136.7
9C40,9,10.42549456,"Greens Bayou Estates, Shady Brook, Northshore",23000,Sexual Assault,19,20,15,15,23,50,16.7,-25,15,53.3,38,87,65.2,65.2,100,72.6
10H10,10,2.81830654,Oak Lawn and Ranger,11000,Sexual Assault,2,10,5,11,3,26,8.7,10,-70,-72.7,-66,90.9,45.5,100,27.3,79.1
10H20,10,1.75743169,Eastwood and Broadmoor,10000,Sexual Assault,3,5,6,3,3,14,4.7,-40,-40,0,-36,50,60,30,30,47
10H30,10,1.02691154,Near East End,4000,Sexual Assault,4,8,5,6,7,19,6.3,-25,-12.5,16.7,11,200,125,150,175,157.5
10H40,10,0.99627062,Midtown,8000,Sexual Assault,19,16,16,23,24,55,18.3,43.8,50,4.3,31,200,200,287.5,300,228.8
10H50,10,2.30843079,the University of Houston area,13000,Sexual Assault,6,14,11,12,7,37,12.3,-14.3,-50,-41.7,-43,107.7,84.6,92.3,53.8,94.6
10H60,10,3.08931006,"University Oaks, Riverside Terrace and the Texas Southern University area",20000,Sexual Assault,10,20,14,13,14,47,15.7,-35,-30,7.7,-11,100,70,65,70,78.5
10H70,10,3.52217952,"Texas Medical Center, Hermann Park, Houston Zoo and Miller Outdoor Theatre",16000,Sexual Assault,30,28,32,45,41,105,35,60.7,46.4,-8.9,17,175,200,281.2,256.2,218.8
10H80,10,2.73862779,"Southampton, Rice University area, Shadow Lawn and Broad Acres",19000,Sexual Assault,3,21,6,13,3,40,13.3,-38.1,-85.7,-76.9,-77,110.5,31.6,68.4,15.8,70
11H10,11,5.31502815,"Mason Park, Forest Hill, Sunnyland and Central Park",28000,Sexual Assault,17,24,23,28,22,75,25,16.7,-8.3,-21.4,-12,85.7,82.1,100,78.6,89.3
11H20,11,3.9311161,"Harrisburg, Manchester and Pecan Park",18000,Sexual Assault,4,8,9,20,11,37,12.3,150,37.5,-45,-11,44.4,50,111.1,61.1,68.3
11H30,11,2.84278059,Meadow Brook and Park Place,15000,Sexual Assault,10,15,12,9,11,36,12,-40,-26.7,22.2,-8,100,80,60,73.3,80
11H40,11,6.14001938,Allendale and Oak Meadows,8000,Sexual Assault,0,4,2,7,1,13,4.3,75,-75,-85.7,-77,50,25,87.5,12.5,53.8
11H50,11,2.09534157,"Meadow Creek, Ferndale Addition and Glenbrook Industrial",8000,Sexual Assault,2,4,18,8,5,30,10,100,25,-37.5,-50,50,225,100,62.5,125
12D10,12,8.55384717,"Almeda Mall, Southridge, Edgebrook and South Houston Gardens",44000,Sexual Assault,22,31,29,33,34,93,31,6.5,9.7,3,10,70.5,65.9,75,77.3,70.5
12D20,12,3.83700574,Sage,22000,Sexual Assault,3,12,14,10,6,36,12,-16.7,-50,-40,-50,54.5,63.6,45.5,27.3,54.5
12D30,12,3.99301158,Gulf Palms and Beamer,15000,Sexual Assault,1,3,3,9,6,15,5,200,100,-33.3,20,20,20,60,40,33.3
12D40,12,9.68663455,Scarsdale and Ellington Field,11000,Sexual Assault,10,10,7,8,11,25,8.3,-20,10,37.5,33,90.9,63.6,72.7,100,75.5
12D50,12,8.93327581,"Bay Glen, Bay Oaks, Brook Forest and Bay Forest",26000,Sexual Assault,3,4,8,5,3,17,5.7,25,-25,-40,-47,15.4,30.8,19.2,11.5,21.9
12D60,12,6.35832041,"NASA's Johnson Space Center, Meadow Green, Oakbrook West and Camino South",22000,Sexual Assault,3,15,9,23,7,47,15.7,53.3,-53.3,-69.6,-55,68.2,40.9,104.5,31.8,71.4
12D70,12,5.39156317,Baybrook Mall and Sterling Knoll,12000,Sexual Assault,10,8,7,8,13,23,7.7,0,62.5,62.5,69,66.7,58.3,66.7,108.3,64.2
13D10,13,5.2433708,"Gulfgate Mall, Bay Forest, Riverview, Hampshire, Golfcrest and Barnett Stadium",23000,Sexual Assault,15,30,20,25,18,75,25,-16.7,-40,-28,-28,130.4,87,108.7,78.3,108.7
13D20,13,6.66870859,"Fairlawn, Garden Villas, Glenbrook Valley and Santa Rosa",36000,Sexual Assault,26,31,31,22,29,84,28,-29,-6.5,31.8,4,86.1,86.1,61.1,80.6,77.8
13D30,13,3.07402543,"Allen Farms, Airport Gardens and the Hobby Airport area",2000,Sexual Assault,1,5,1,0,1,6,2,-100,-80,NA,-50,250,50,0,50,100
13D40,13,5.0688163,"Val Verde East, Gulf Meadows and Houston Skyscraper Shadows",13000,Sexual Assault,7,8,15,1,7,24,8,-87.5,-12.5,600,-12,61.5,115.4,7.7,53.8,61.5
14D10,14,3.66057918,McGregor Terrace and Riverside Terrace,17000,Sexual Assault,11,21,31,19,15,71,23.7,-9.5,-28.6,-21.1,-37,123.5,182.4,111.8,88.2,139.4
14D20,14,7.25646368,"Blueridge, Sunnyside, Brook Haven and Bayou Estates",28000,Sexual Assault,19,43,38,37,26,118,39.3,-14,-39.5,-29.7,-34,153.6,135.7,132.1,92.9,140.4
14D30,14,4.20537595,"Crestmont, Edgewood, Bellfort Park, Inwood Terrace and Southpark",21000,Sexual Assault,12,21,14,8,13,43,14.3,-61.9,-38.1,62.5,-9,100,66.7,38.1,61.9,68.1
14D40,14,6.61224595,"South Acres, Shamrock Manor, Hillwood and Cloverland",21000,Sexual Assault,12,23,18,13,14,54,18,-43.5,-39.1,7.7,-22,109.5,85.7,61.9,66.7,85.7
14D50,14,8.69627992,"Golden Glade Estates, Langston and Almeda Genoa",9000,Sexual Assault,2,3,7,4,3,14,4.7,33.3,0,-25,-36,33.3,77.8,44.4,33.3,52.2
15E10,15,4.34996776,"Meyerland Plaza, Robindell, Meyerland, Braeburn Terrace and Maplewood South",24000,Sexual Assault,5,5,8,10,9,23,7.7,100,80,-10,17,20.8,33.3,41.7,37.5,32.1
15E20,15,3.58384499,"Westbury, Park West and Willow Creek",18000,Sexual Assault,3,8,16,3,4,27,9,-62.5,-50,33.3,-56,44.4,88.9,16.7,22.2,50
15E30,15,6.29133294,"Meyer Park, Post Oak Manor, Westwood, Willow Bend and Linkwood",34000,Sexual Assault,9,17,9,16,14,42,14,-5.9,-17.6,-12.5,0,50,26.5,47.1,41.2,41.2
15E40,15,10.0079174,"The Astrodome, Six Flags Astroworld, Lakes at 610 and Plaza del Oro",30000,Sexual Assault,16,22,15,23,21,60,20,4.5,-4.5,-8.7,5,73.3,50,76.7,70,66.7
16E10,16,5.38940818,Canterbury Village and Monarch Estates,15000,Sexual Assault,1,9,6,4,1,19,6.3,-55.6,-88.9,-75,-84,60,40,26.7,6.7,42
16E20,16,8.15202134,"Almeda Plaza, South Glen, Dumbarton Oaks and Briarwick",35000,Sexual Assault,10,13,16,23,14,52,17.3,76.9,7.7,-39.1,-19,37.1,45.7,65.7,40,49.4
16E30,16,7.00932789,"Greenpark, Southwest Crossing and Windsor Village",22000,Sexual Assault,12,17,12,16,17,45,15,-5.9,0,6.2,13,77.3,54.5,72.7,77.3,68.2
16E40,16,7.49721482,"Chasewood, Willowpark, Briarwick, Ridgemont and Quail Run",35000,Sexual Assault,8,15,21,11,11,47,15.7,-26.7,-26.7,0,-30,42.9,60,31.4,31.4,44.9
17E10,17,3.3104034,"Southwest Memorial Hospital, Burnett Bayland Park and Westmoreland",51000,Sexual Assault,26,54,39,44,38,137,45.7,-18.5,-29.6,-13.6,-17,105.9,76.5,86.3,74.5,89.6
17E20,17,3.92767309,the Houston Baptist University area and Maplewood West,27000,Sexual Assault,21,37,19,38,30,94,31.3,2.7,-18.9,-21.1,-4,137,70.4,140.7,111.1,115.9
17E30,17,3.8060455,Braeburn Valley West and Glenshire,21000,Sexual Assault,7,17,30,24,9,71,23.7,41.2,-47.1,-62.5,-62,81,142.9,114.3,42.9,112.9
17E40,17,4.70920035,"Creekbend, Southwood and Fondren Southwest",46000,Sexual Assault,19,46,39,34,25,119,39.7,-26.1,-45.7,-26.5,-37,100,84.8,73.9,54.3,86.3
18F10,18,1.95881352,"Saddlebrook, Bayou Woods and Sherwood Forest",7000,Sexual Assault,1,6,4,2,2,12,4,-66.7,-66.7,0,-50,85.7,57.1,28.6,28.6,57.1
18F20,18,3.51641691,"The Galleria, Tanglewood, Riverway and Post Oak",24000,Sexual Assault,11,13,25,27,22,65,21.7,107.7,69.2,-18.5,1,54.2,104.2,112.5,91.7,90.4
18F30,18,3.80008564,"The Richmond Strip, Briargrove, Post Oak Estates and Westhaven",36000,Sexual Assault,21,20,27,33,36,80,26.7,65,80,9.1,35,55.6,75,91.7,100,74.2
18F40,18,2.9060249,"Rosewood General Hospital, Woodlake and Briarmeadow",35000,Sexual Assault,16,28,22,21,21,71,23.7,-25,-25,0,-11,80,62.9,60,60,67.7
18F50,18,2.96939217,"Tanglewild, Sharpstown Mall and Regency Square",20000,Sexual Assault,19,33,17,20,22,70,23.3,-39.4,-33.3,10,-6,165,85,100,110,116.5
18F60,18,3.62528697,Sharpstown Country Club and Southway Center,28000,Sexual Assault,6,27,13,17,10,57,19,-37,-63,-41.2,-47,96.4,46.4,60.7,35.7,67.9
19G10,19,2.74020376,Concourse South and Westwood Mall,31000,Sexual Assault,14,41,39,32,26,112,37.3,-22,-36.6,-18.8,-30,132.3,125.8,103.2,83.9,120.3
19G20,19,3.29219023,"Catalina Square, Bellaire West, Imperial Point",25000,Sexual Assault,9,14,22,10,9,46,15.3,-28.6,-35.7,-10,-41,56,88,40,36,61.2
19G30,19,2.49064202,"Rodeo Square, Wildflower Green, Braewood Glen",18000,Sexual Assault,3,10,12,5,5,27,9,-50,-50,0,-44,55.6,66.7,27.8,27.8,50
19G40,19,4.56425364,"Huntington Village, Wellington Park, Leawood, Keegans Glen",37000,Sexual Assault,12,34,18,27,21,79,26.3,-20.6,-38.2,-22.2,-20,91.9,48.6,73,56.8,71.1
19G50,19,2.30578624,"Forum Park, Stancliff and Southwest Park",18000,Sexual Assault,10,30,32,18,13,80,26.7,-40,-56.7,-27.8,-51,166.7,177.8,100,72.2,148.3
20G10,20,3.06600809,"Westchase, Woodchase Village and Point West",29000,Sexual Assault,15,22,20,24,19,66,22,9.1,-13.6,-20.8,-14,75.9,69,82.8,65.5,75.9
20G20,20,3.27621655,"Lakeside Estates, City West Place, Rivercrest and Briargrove Park",18000,Sexual Assault,6,3,14,6,7,23,7.7,100,133.3,16.7,-9,16.7,77.8,33.3,38.9,42.8
20G30,20,3.97953501,"West Houston Medical Center, Andrau Airport, Westchase and Westchase Mall",26000,Sexual Assault,18,13,32,31,28,76,25.3,138.5,115.4,-9.7,11,50,123.1,119.2,107.7,97.3
20G40,20,4.16594899,"Lakeview Forest, Lakeside Place, Ashford Village and Southlake",28000,Sexual Assault,18,26,14,15,21,55,18.3,-42.3,-19.2,40,15,92.9,50,53.6,75,65.4
20G70,20,2.38283582,Westpark Village and Ashford Point,21000,Sexual Assault,15,15,17,12,19,44,14.7,-20,26.7,58.3,29,71.4,81,57.1,90.5,70
20G80,20,25.33626534,City Limits,37000,Sexual Assault,14,17,14,18,17,49,16.3,5.9,0,-5.6,4,45.9,37.8,48.6,45.9,44.1
21I50,21,14.61100076,Hobby Airport,0,Sexual Assault,1,2,0,3,1,5,1.7,50,-50,-66.7,-41,NA,NA,NA,NA,NA
22B10,22,3.28874287,"Willowbrook, Willow Chase Park and Centerfield",8000,Sexual Assault,9,11,14,8,10,33,11,-27.3,-9.1,25,-9,137.5,175,100,125,137.5
5F20,5,5.94082911,Spring Branch and Schwartz Park,42000,Sexual Assault,11,31,25,31,15,87,29,0,-51.6,-51.6,-48,73.8,59.5,73.8,35.7,69
4F10,4,4.13606469,"Timber Oaks, Shadow Oaks and Long Point Acres",23000,Sexual Assault,13,21,11,18,16,50,16.7,-14.3,-23.8,-11.1,-4,91.3,47.8,78.3,69.6,72.6
20G50,20,5.88593521,"Nottingham, Yorkshire, Wilchester, Town and Country Village and Memorial City Shopping Center",30000,Sexual Assault,13,12,10,13,17,35,11.7,8.3,41.7,30.8,45,40,33.3,43.3,56.7,39
4F20,4,5.85840284,"Claymore Park, Westbranch, Spring Shadows and Kempwood Forest",28000,Sexual Assault,10,22,23,11,14,56,18.7,-50,-36.4,27.3,-25,78.6,82.1,39.3,50,66.8
20G60,20,4.54207617,"Barkers Landing, Fleetwood, Thornwood and Darrel Tully Stadium",22000,Sexual Assault,6,10,16,7,6,33,11,-30,-40,-14.3,-45,45.5,72.7,31.8,27.3,50
4F30,4,26.30690179,"Addicks Reservoir Area, Claymore Park, Brittmore Village, Park Ten Place and Mayde Creek Farms",18000,Sexual Assault,8,19,17,11,12,47,15.7,-42.1,-36.8,9.1,-24,105.6,94.4,61.1,66.7,87.2
24C10,24,5.44044978,Kingwood,13000,Sexual Assault,2,6,10,5,3,21,7,-16.7,-50,-40,-57,46.2,76.9,38.5,23.1,53.8
24C20,24,6.8291794,Kingwood,18000,Sexual Assault,1,6,4,7,2,17,5.7,16.7,-66.7,-71.4,-65,33.3,22.2,38.9,11.1,31.7
24C30,24,9.78735527,Kingwood,29000,Sexual Assault,1,5,3,8,1,16,5.3,60,-80,-87.5,-81,17.2,10.3,27.6,3.4,18.3
24C40,24,35.7992771,Kingwood,6000,Sexual Assault,1,6,1,1,1,8,2.7,-83.3,-83.3,0,-63,100,16.7,16.7,16.7,45
24C50,24,7.51791807,Kingwood,5000,Sexual Assault,3,2,0,5,5,7,2.3,150,150,0,117,40,0,100,100,46
24C60,24,4.86823328,Kingwood,21000,Sexual Assault,1,2,3,5,4,10,3.3,150,100,-20,21,9.5,14.3,23.8,19,15.7
21I60,21,0.01236886,Hobby Airport,0,Sexual Assault,0,1,0,1,0,2,0.7,0,-100,-100,-100,NA,NA,NA,NA,NA
01A10,NA,NA,NA,NA,Sexual Assault,2,0,0,0,2,0,0,NA,NA,NA,NA,NA,NA,NA,NA,NA
01A20,NA,NA,NA,NA,Sexual Assault,2,0,0,0,2,0,0,NA,NA,NA,NA,NA,NA,NA,NA,NA
01A50,NA,NA,NA,NA,Sexual Assault,1,0,0,0,1,0,0,NA,NA,NA,NA,NA,NA,NA,NA,NA
02A10,NA,NA,NA,NA,Sexual Assault,1,0,0,0,1,0,0,NA,NA,NA,NA,NA,NA,NA,NA,NA
02A50,NA,NA,NA,NA,Sexual Assault,2,0,0,0,2,0,0,NA,NA,NA,NA,NA,NA,NA,NA,NA
04F10,NA,NA,NA,NA,Sexual Assault,1,0,0,0,1,0,0,NA,NA,NA,NA,NA,NA,NA,NA,NA
04F30,NA,NA,NA,NA,Sexual Assault,2,0,0,0,2,0,0,NA,NA,NA,NA,NA,NA,NA,NA,NA
05F20,NA,NA,NA,NA,Sexual Assault,1,0,0,0,1,0,0,NA,NA,NA,NA,NA,NA,NA,NA,NA
06B10,NA,NA,NA,NA,Sexual Assault,1,0,0,0,1,0,0,NA,NA,NA,NA,NA,NA,NA,NA,NA
06B20,NA,NA,NA,NA,Sexual Assault,3,0,0,0,3,0,0,NA,NA,NA,NA,NA,NA,NA,NA,NA
06B30,NA,NA,NA,NA,Sexual Assault,2,0,0,0,2,0,0,NA,NA,NA,NA,NA,NA,NA,NA,NA
07C20,NA,NA,NA,NA,Sexual Assault,3,0,0,0,3,0,0,NA,NA,NA,NA,NA,NA,NA,NA,NA
07C30,NA,NA,NA,NA,Sexual Assault,1,0,0,0,1,0,0,NA,NA,NA,NA,NA,NA,NA,NA,NA
07C40,NA,NA,NA,NA,Sexual Assault,1,0,0,0,1,0,0,NA,NA,NA,NA,NA,NA,NA,NA,NA
08C30,NA,NA,NA,NA,Sexual Assault,1,0,0,0,1,0,0,NA,NA,NA,NA,NA,NA,NA,NA,NA
09C40,NA,NA,NA,NA,Sexual Assault,3,0,0,0,3,0,0,NA,NA,NA,NA,NA,NA,NA,NA,NA
HCSO,NA,NA,NA,NA,Sexual Assault,4,9,5,1,4,15,5,-88.9,-55.6,300,-20,NA,NA,NA,NA,NA
OOJ,NA,NA,NA,NA,Sexual Assault,3,29,12,3,4,44,14.7,-89.7,-86.2,33.3,-73,NA,NA,NA,NA,NA
Unknown,NA,NA,NA,NA,Sexual Assault,0,0,1,1,0,2,0.7,NA,NA,-100,-100,NA,NA,NA,NA,NA
