beat,district,area_sq_mi,placename,population,type,total19,total20,total21,total22,total23,last12mos,total_prior4years,avg_prior4years,inc_19to22,inc_19tolast12,inc_22tolast12,inc_prior4yearavgtolast12,rate19,rate20,rate21,rate22,rate_last12,rate_prior4years,previous_year
23J40,23,3.03933481,Ellington Field,0,Violent,0,0,0,3,1,2,3,0.8,NA,NA,-33.3,150,NA,NA,NA,NA,NA,NA,3
23J50,23,2.12389492,Hobby Airport,0,Violent,20,18,23,38,13,33,99,24.8,90,65,-13.2,33.1,NA,NA,NA,NA,NA,NA,38
1A10,1,1.74646692,Downtown Central Business District,17000,Violent,851,596,697,768,473,880,2912,728,-9.8,3.4,14.6,20.9,5005.9,3505.9,4100,4517.6,5176.5,4282.4,768
1A20,1,2.44133075,"Fourth Ward, Avondale and Westmoreland",27000,Violent,647,573,704,655,372,647,2579,644.8,1.2,0,-1.2,0.3,2396.3,2122.2,2607.4,2425.9,2396.3,2388.1,655
1A30,1,2.65916892,"Cherryhurst, Mandell Place and Montrose",27000,Violent,388,361,302,331,213,377,1382,345.5,-14.7,-2.8,13.9,9.1,1437,1337,1118.5,1225.9,1396.3,1279.6,331
1A40,1,2.45016686,"Tall Timbers, Royden Oaks, River Oaks, Avalon Place and Oak Estates",7000,Violent,30,23,34,30,18,31,117,29.2,0,3.3,3.3,6.2,428.6,328.6,485.7,428.6,442.9,417.1,30
1A50,1,3.04553452,"Post Oak Park, Afton Oaks, Highland Village, Weslayan, Greenway Plaza and The Compaq Center",26000,Violent,284,335,363,348,177,335,1330,332.5,22.5,18,-3.7,0.8,1092.3,1288.5,1396.2,1338.5,1288.5,1278.8,348
2A10,2,3.30928608,Irvington and Ryon,18000,Violent,743,702,579,535,340,580,2559,639.8,-28,-21.9,8.4,-9.3,4127.8,3900,3216.7,2972.2,3222.2,3554.4,535
2A20,2,1.8876461,"Sunset Heights, Brooksmith and Stude",11000,Violent,286,309,233,211,147,245,1039,259.8,-26.2,-14.3,16.1,-5.7,2600,2809.1,2118.2,1918.2,2227.3,2361.8,211
2A30,2,4.65858171,"Houston Heights, Norhill and Studemont",31000,Violent,281,243,232,224,128,225,980,245,-20.3,-19.9,0.4,-8.2,906.5,783.9,748.4,722.6,725.8,790.3,224
2A40,2,1.60546103,Old Sixth Ward and the First Ward,8000,Violent,121,126,128,118,84,129,493,123.2,-2.5,6.6,9.3,4.7,1512.5,1575,1600,1475,1612.5,1540,118
2A50,2,5.4659844,"Memorial Park, West End, Ashbury and Cottage Grove",29000,Violent,354,307,413,368,202,396,1442,360.5,4,11.9,7.6,9.8,1220.7,1058.6,1424.1,1269,1365.5,1243.1,368
2A60,2,4.67447346,"Westport, Holly Park, Lazy Brook, Citadel, Shady Acres and Timbergrove",21000,Violent,212,206,241,241,123,235,900,225,13.7,10.8,-2.5,4.4,1009.5,981,1147.6,1147.6,1119,1071.4,241
3B10,3,6.82068773,"Northwest Mall, Brookhollow, White Oak Acres, Oak Forest and Langwood",34000,Violent,957,1055,1016,977,531,959,4005,1001.2,2.1,0.2,-1.8,-4.2,2814.7,3102.9,2988.2,2873.5,2820.6,2944.7,977
3B30,3,5.310372,"White Oak Acres, Brook Hollow, Oak Forest, Garden Oaks and Shepherd Park Plaza",23000,Violent,221,230,227,223,125,230,901,225.2,0.9,4.1,3.1,2.1,960.9,1000,987,969.6,1000,979.1,223
3B40,3,3.40013561,"Independence Heights, Melrose and Graceland",13000,Violent,651,659,619,533,376,630,2462,615.5,-18.1,-3.2,18.2,2.4,5007.7,5069.2,4761.5,4100,4846.2,4734.6,533
3B50,3,3.85259517,"Northline Mall, Stratton Place, Oakwood, Colonial Gardens, Lindale and Junction City",20000,Violent,790,782,732,703,409,743,3007,751.8,-11,-5.9,5.7,-1.2,3950,3910,3660,3515,3715,3759,703
5F10,5,3.25978513,Afton Village and Pine Terrace,14000,Violent,292,248,287,299,170,300,1126,281.5,2.4,2.7,0.3,6.6,2085.7,1771.4,2050,2135.7,2142.9,2010.7,299
5F30,5,8.70689439,"Fairbanks, Carverdale, Fawndale and Northwest Crossing",17000,Violent,686,719,737,705,335,677,2847,711.8,2.8,-1.3,-4,-4.9,4035.3,4229.4,4335.3,4147.1,3982.4,4187.1,705
6B10,6,5.50084827,"York Plaza, Pembrook Place and Hawthorne Place",33000,Violent,919,1001,1002,857,502,924,3779,944.8,-6.7,0.5,7.8,-2.2,2784.8,3033.3,3036.4,2597,2800,2863,857
6B20,6,6.12869477,"Highland Heights, Oakdale and Melrose Gardens",18000,Violent,783,822,669,586,376,631,2860,715,-25.2,-19.4,7.7,-11.7,4350,4566.7,3716.7,3255.6,3505.6,3972.2,586
6B30,6,7.2300685,"Woodland Trails, Oaks of Inwood, Bayou Bend, Cole Creek Manor and Inwood Forest",38000,Violent,1026,1071,887,831,452,842,3815,953.8,-19,-17.9,1.3,-11.7,2700,2818.4,2334.2,2186.8,2215.8,2510,831
6B40,6,5.544689,"Highland Gardens, Highland Heights and North Plaza",20000,Violent,914,1025,852,710,489,817,3501,875.2,-22.3,-10.6,15.1,-6.6,4570,5125,4260,3550,4085,4376,710
22B30,22,2.8264671,Aldine and Imperial Valley,19000,Violent,713,640,647,611,336,594,2611,652.8,-14.3,-16.7,-2.8,-9,3752.6,3368.4,3405.3,3215.8,3126.3,3435.8,611
22B20,22,4.61158268,Greenspoint,24000,Violent,1488,1580,1388,1265,588,1170,5721,1430.2,-15,-21.4,-7.5,-18.2,6200,6583.3,5783.3,5270.8,4875,5959.2,1265
7C10,7,3.47828324,"Fifth Ward, North Park and Pinecrest",13000,Violent,647,674,563,622,335,617,2506,626.5,-3.9,-4.6,-0.8,-1.5,4976.9,5184.6,4330.8,4784.6,4746.2,4819.2,622
7C20,7,7.08575157,"Huntington Place, Willshire Place, Kashmere Gardens and Liberty Gardens",21000,Violent,1437,1363,1250,1172,665,1195,5222,1305.5,-18.4,-16.8,2,-8.5,6842.9,6490.5,5952.4,5581,5690.5,6216.7,1172
7C30,7,4.51719841,"Camden Woods, Archers Acres and Croyden Gardens",18000,Violent,697,770,800,627,332,618,2894,723.5,-10,-11.3,-1.4,-14.6,3872.2,4277.8,4444.4,3483.3,3433.3,4019.4,627
7C40,7,3.36786526,Keith-Weiss Park and Farrington Place,8000,Violent,246,225,219,206,95,187,896,224,-16.3,-24,-9.2,-16.5,3075,2812.5,2737.5,2575,2337.5,2800,206
22B40,22,13.03325001,"Intercontinental Airport, Northwood, Lakeview Park and Glen Lee",11000,Violent,373,385,490,500,204,445,1748,437,34,19.3,-11,1.8,3390.9,3500,4454.5,4545.5,4045.5,3972.7,500
8C10,8,3.69037316,"Tidwell Park, Shady Oak and Buckingham Place",12000,Violent,761,817,711,690,324,611,2979,744.8,-9.3,-19.7,-11.4,-18,6341.7,6808.3,5925,5750,5091.7,6206.7,690
8C20,8,3.36154214,"Houston Gardens, Rosewood and Homestead",7000,Violent,281,312,297,252,154,273,1142,285.5,-10.3,-2.8,8.3,-4.4,4014.3,4457.1,4242.9,3600,3900,4078.6,252
8C30,8,4.6258259,"Parkhurst, East Houston and Clairmont Place",11000,Violent,378,499,419,379,209,403,1675,418.8,0.3,6.6,6.3,-3.8,3436.4,4536.4,3809.1,3445.5,3663.6,3807.3,379
8C40,8,4.97945551,"Lake Houston, Greenriver, Knoll and Lake Forest",8000,Violent,176,202,175,136,84,133,689,172.2,-22.7,-24.4,-2.2,-22.8,2200,2525,2187.5,1700,1662.5,2152.5,136
8C50,8,3.31739498,"Park North, Forest Green, Kentshire Place, Glenwood Forest and Dorchester",8000,Violent,443,475,430,339,211,368,1687,421.8,-23.5,-16.9,8.6,-12.8,5537.5,5937.5,5375,4237.5,4600,5272.5,339
8C60,8,5.79693312,"Edgeworth, Northwood Manor and Scenic Woods",19000,Violent,639,713,545,518,322,538,2415,603.8,-18.9,-15.8,3.9,-10.9,3363.2,3752.6,2868.4,2726.3,2831.6,3177.9,518
9C10,9,5.21185619,"Port of Houston, Clinton Park, Pleasantville and Fidelity Manor",6000,Violent,180,216,171,129,85,140,696,174,-28.3,-22.2,8.5,-19.5,3000,3600,2850,2150,2333.3,2900,129
9C20,9,7.5383173,Denver Harbor and Houston Harbor,16000,Violent,402,447,348,362,154,315,1559,389.8,-10,-21.6,-13,-19.2,2512.5,2793.8,2175,2262.5,1968.8,2436.2,362
9C30,9,8.13353768,"City Park East, Wynnewood Acres and Wallisville Gardens",9000,Violent,222,293,278,237,153,255,1030,257.5,6.8,14.9,7.6,-1,2466.7,3255.6,3088.9,2633.3,2833.3,2861.1,237
9C40,9,10.42549456,"Greens Bayou Estates, Shady Brook, Northshore",23000,Violent,766,764,696,637,338,653,2863,715.8,-16.8,-14.8,2.5,-8.8,3330.4,3321.7,3026.1,2769.6,2839.1,3112.2,637
10H10,10,2.81830654,Oak Lawn and Ranger,11000,Violent,315,271,259,241,110,230,1086,271.5,-23.5,-27,-4.6,-15.3,2863.6,2463.6,2354.5,2190.9,2090.9,2468.2,241
10H20,10,1.75743169,Eastwood and Broadmoor,10000,Violent,190,200,197,223,102,191,810,202.5,17.4,0.5,-14.3,-5.7,1900,2000,1970,2230,1910,2025,223
10H30,10,1.02691154,Near East End,4000,Violent,171,158,173,169,77,165,671,167.8,-1.2,-3.5,-2.4,-1.7,4275,3950,4325,4225,4125,4195,169
10H40,10,0.99627062,Midtown,8000,Violent,751,638,567,527,276,519,2483,620.8,-29.8,-30.9,-1.5,-16.4,9387.5,7975,7087.5,6587.5,6487.5,7760,527
10H50,10,2.30843079,the University of Houston area,13000,Violent,753,691,609,582,299,555,2635,658.8,-22.7,-26.3,-4.6,-15.8,5792.3,5315.4,4684.6,4476.9,4269.2,5067.7,582
10H60,10,3.08931006,"University Oaks, Riverside Terrace and the Texas Southern University area",20000,Violent,544,520,496,528,269,504,2088,522,-2.9,-7.4,-4.5,-3.4,2720,2600,2480,2640,2520,2610,528
10H70,10,3.52217952,"Texas Medical Center, Hermann Park, Houston Zoo and Miller Outdoor Theatre",16000,Violent,421,435,458,432,220,434,1746,436.5,2.6,3.1,0.5,-0.6,2631.2,2718.8,2862.5,2700,2712.5,2728.1,432
10H80,10,2.73862779,"Southampton, Rice University area, Shadow Lawn and Broad Acres",19000,Violent,120,97,98,129,51,123,444,111,7.5,2.5,-4.7,10.8,631.6,510.5,515.8,678.9,647.4,584.2,129
11H10,11,5.31502815,"Mason Park, Forest Hill, Sunnyland and Central Park",28000,Violent,832,957,776,815,396,784,3380,845,-2,-5.8,-3.8,-7.2,2971.4,3417.9,2771.4,2910.7,2800,3017.9,815
11H20,11,3.9311161,"Harrisburg, Manchester and Pecan Park",18000,Violent,430,416,432,355,172,327,1633,408.2,-17.4,-24,-7.9,-19.9,2388.9,2311.1,2400,1972.2,1816.7,2267.8,355
11H30,11,2.84278059,Meadow Brook and Park Place,15000,Violent,404,481,409,448,214,411,1742,435.5,10.9,1.7,-8.3,-5.6,2693.3,3206.7,2726.7,2986.7,2740,2903.3,448
11H40,11,6.14001938,Allendale and Oak Meadows,8000,Violent,107,142,119,117,56,115,485,121.2,9.3,7.5,-1.7,-5.1,1337.5,1775,1487.5,1462.5,1437.5,1515,117
11H50,11,2.09534157,"Meadow Creek, Ferndale Addition and Glenbrook Industrial",8000,Violent,147,189,195,165,137,205,696,174,12.2,39.5,24.2,17.8,1837.5,2362.5,2437.5,2062.5,2562.5,2175,165
12D10,12,8.55384717,"Almeda Mall, Southridge, Edgebrook and South Houston Gardens",44000,Violent,1097,1337,1378,1243,522,1031,5055,1263.8,13.3,-6,-17.1,-18.4,2493.2,3038.6,3131.8,2825,2343.2,2872.3,1243
12D20,12,3.83700574,Sagemont,22000,Violent,359,427,375,362,170,335,1523,380.8,0.8,-6.7,-7.5,-12,1631.8,1940.9,1704.5,1645.5,1522.7,1730.9,362
12D30,12,3.99301158,Gulf Palms and Beamer,15000,Violent,201,206,204,176,85,164,787,196.8,-12.4,-18.4,-6.8,-16.7,1340,1373.3,1360,1173.3,1093.3,1312,176
12D40,12,9.68663455,Scarsdale and Ellington Field,11000,Violent,252,272,244,223,83,178,991,247.8,-11.5,-29.4,-20.2,-28.2,2290.9,2472.7,2218.2,2027.3,1618.2,2252.7,223
12D50,12,8.93327581,"Bay Glen, Bay Oaks, Brook Forest and Bay Forest",26000,Violent,96,80,94,101,47,98,371,92.8,5.2,2.1,-3,5.6,369.2,307.7,361.5,388.5,376.9,356.9,101
12D60,12,6.35832041,"NASA's Johnson Space Center, Meadow Green, Oakbrook West and Camino South",22000,Violent,199,269,242,188,125,213,898,224.5,-5.5,7,13.3,-5.1,904.5,1222.7,1100,854.5,968.2,1020.5,188
12D70,12,5.39156317,Baybrook Mall and Sterling Knoll,12000,Violent,223,255,221,223,128,226,922,230.5,0,1.3,1.3,-2,1858.3,2125,1841.7,1858.3,1883.3,1920.8,223
13D10,13,5.2433708,"Gulfgate Mall, Bay Forest, Riverview, Hampshire, Golfcrest and Barnett Stadium",23000,Violent,677,668,592,615,293,552,2552,638,-9.2,-18.5,-10.2,-13.5,2943.5,2904.3,2573.9,2673.9,2400,2773.9,615
13D20,13,6.66870859,"Fairlawn, Garden Villas, Glenbrook Valley and Santa Rosa",36000,Violent,1149,1148,918,1007,498,949,4222,1055.5,-12.4,-17.4,-5.8,-10.1,3191.7,3188.9,2550,2797.2,2636.1,2931.9,1007
13D30,13,3.07402543,"Allen Farms, Airport Gardens and the Hobby Airport area",2000,Violent,46,37,35,37,19,37,155,38.8,-19.6,-19.6,0,-4.6,2300,1850,1750,1850,1850,1940,37
13D40,13,5.0688163,"Val Verde East, Gulf Meadows and Houston Skyscraper Shadows",13000,Violent,166,222,183,170,71,146,741,185.2,2.4,-12,-14.1,-21.2,1276.9,1707.7,1407.7,1307.7,1123.1,1424.6,170
14D10,14,3.66057918,McGregor Terrace and Riverside Terrace,17000,Violent,1038,1096,892,809,451,809,3835,958.8,-22.1,-22.1,0,-15.6,6105.9,6447.1,5247.1,4758.8,4758.8,5640,809
14D20,14,7.25646368,"Sunnyside, Brook Haven and Bayou Estates",28000,Violent,1691,1763,1512,1476,769,1437,6442,1610.5,-12.7,-15,-2.6,-10.8,6039.3,6296.4,5400,5271.4,5132.1,5751.8,1476
14D30,14,4.20537595,"Crestmont, Edgewood, Bellfort Park, Inwood Terrace and Southpark",21000,Violent,821,750,660,693,380,684,2924,731,-15.6,-16.7,-1.3,-6.4,3909.5,3571.4,3142.9,3300,3257.1,3481,693
14D40,14,6.61224595,"South Acres, Shamrock Manor, Hillwood and Cloverland",21000,Violent,622,667,604,585,299,533,2478,619.5,-5.9,-14.3,-8.9,-14,2961.9,3176.2,2876.2,2785.7,2538.1,2950,585
14D50,14,8.69627992,"Golden Glade Estates, Langston and Almeda Genoa",9000,Violent,196,247,245,227,129,223,915,228.8,15.8,13.8,-1.8,-2.5,2177.8,2744.4,2722.2,2522.2,2477.8,2542.2,227
15E10,15,4.34996776,"Meyerland Plaza, Robindell, Meyerland, Braeburn Terrace and Maplewood South",24000,Violent,328,359,424,311,181,303,1422,355.5,-5.2,-7.6,-2.6,-14.8,1366.7,1495.8,1766.7,1295.8,1262.5,1481.2,311
15E20,15,3.58384499,"Westbury, Park West and Willow Creek",18000,Violent,265,323,244,228,106,204,1060,265,-14,-23,-10.5,-23,1472.2,1794.4,1355.6,1266.7,1133.3,1472.2,228
15E30,15,6.29133294,"Meyer Park, Post Oak Manor, Westwood, Willow Bend and Linkwood",34000,Violent,376,422,436,417,207,385,1651,412.8,10.9,2.4,-7.7,-6.7,1105.9,1241.2,1282.4,1226.5,1132.4,1214.1,417
15E40,15,10.0079174,"NRG Park, Astroworld, Lakes at 610 and Plaza del Oro",30000,Violent,943,882,1052,950,469,893,3827,956.8,0.7,-5.3,-6,-6.7,3143.3,2940,3506.7,3166.7,2976.7,3189.3,950
16E10,16,5.38940818,Canterbury Village and Monarch Estates,15000,Violent,220,226,202,216,114,225,864,216,-1.8,2.3,4.2,4.2,1466.7,1506.7,1346.7,1440,1500,1440,216
16E20,16,8.15202134,"Almeda Plaza, South Glen, Dumbarton Oaks and Briarwick",35000,Violent,623,687,675,638,343,619,2623,655.8,2.4,-0.6,-3,-5.6,1780,1962.9,1928.6,1822.9,1768.6,1873.7,638
16E30,16,7.00932789,"Greenpark, Southwest Crossing and Windsor Village",22000,Violent,498,491,451,455,223,416,1895,473.8,-8.6,-16.5,-8.6,-12.2,2263.6,2231.8,2050,2068.2,1890.9,2153.6,455
16E40,16,7.49721482,"Chasewood, Willowpark, Briarwick, Ridgemont and Quail Run",35000,Violent,585,654,610,515,246,462,2364,591,-12,-21,-10.3,-21.8,1671.4,1868.6,1742.9,1471.4,1320,1688.6,515
17E10,17,3.3104034,"Southwest Memorial Hospital, Burnett Bayland Park and Westmoreland",51000,Violent,1377,1498,1374,1279,642,1212,5528,1382,-7.1,-12,-5.2,-12.3,2700,2937.3,2694.1,2507.8,2376.5,2709.8,1279
17E20,17,3.92767309,the Houston Baptist University area and Maplewood West,27000,Violent,582,608,591,534,284,518,2315,578.8,-8.2,-11,-3,-10.5,2155.6,2251.9,2188.9,1977.8,1918.5,2143.7,534
17E30,17,3.8060455,Braeburn Valley West and Glenshire,21000,Violent,620,748,556,596,318,605,2520,630,-3.9,-2.4,1.5,-4,2952.4,3561.9,2647.6,2838.1,2881,3000,596
17E40,17,4.70920035,"Creekbend, Southwood and Fondren Southwest",46000,Violent,1352,1381,1304,1206,644,1150,5243,1310.8,-10.8,-14.9,-4.6,-12.3,2939.1,3002.2,2834.8,2621.7,2500,2849.6,1206
18F10,18,1.95881352,"Saddlebrook, Bayou Woods and Sherwood Forest",7000,Violent,80,72,73,80,37,74,305,76.2,0,-7.5,-7.5,-2.9,1142.9,1028.6,1042.9,1142.9,1057.1,1088.6,80
18F20,18,3.51641691,"The Galleria, Tanglewood, Riverway and Post Oak",24000,Violent,411,424,476,475,224,425,1786,446.5,15.6,3.4,-10.5,-4.8,1712.5,1766.7,1983.3,1979.2,1770.8,1860.4,475
18F30,18,3.80008564,"The Richmond Strip, Briargrove, Post Oak Estates and Westhaven",36000,Violent,810,922,886,843,477,852,3461,865.2,4.1,5.2,1.1,-1.5,2250,2561.1,2461.1,2341.7,2366.7,2403.3,843
18F40,18,2.9060249,"Rosewood General Hospital, Woodlake and Briarmeadow",35000,Violent,879,1003,976,972,475,886,3830,957.5,10.6,0.8,-8.8,-7.5,2511.4,2865.7,2788.6,2777.1,2531.4,2735.7,972
18F50,18,2.96939217,"Tanglewild, Sharpstown Mall and Regency Square",20000,Violent,690,710,810,825,380,748,3035,758.8,19.6,8.4,-9.3,-1.4,3450,3550,4050,4125,3740,3794,825
18F60,18,3.62528697,Sharpstown Country Club and Southway Center,28000,Violent,577,579,579,451,247,435,2186,546.5,-21.8,-24.6,-3.5,-20.4,2060.7,2067.9,2067.9,1610.7,1553.6,1951.8,451
19G10,19,2.74020376,Concourse South and Westwood Mall,31000,Violent,1231,1296,1237,1198,597,1090,4962,1240.5,-2.7,-11.5,-9,-12.1,3971,4180.6,3990.3,3864.5,3516.1,4001.6,1198
19G20,19,3.29219023,"Catalina Square, Bellaire West, Imperial Point",25000,Violent,456,442,478,326,195,347,1702,425.5,-28.5,-23.9,6.4,-18.4,1824,1768,1912,1304,1388,1702,326
19G30,19,2.49064202,"Rodeo Square, Wildflower Green, Braewood Glen",18000,Violent,308,282,308,256,125,238,1154,288.5,-16.9,-22.7,-7,-17.5,1711.1,1566.7,1711.1,1422.2,1322.2,1602.8,256
19G40,19,4.56425364,"Huntington Village, Wellington Park, Leawood, Keegans Glen",37000,Violent,795,783,775,681,359,663,3034,758.5,-14.3,-16.6,-2.6,-12.6,2148.6,2116.2,2094.6,1840.5,1791.9,2050,681
19G50,19,2.30578624,"Forum Park, Stancliff and Southwest Park",18000,Violent,695,649,644,548,255,506,2536,634,-21.2,-27.2,-7.7,-20.2,3861.1,3605.6,3577.8,3044.4,2811.1,3522.2,548
20G10,20,3.06600809,"Westchase, Woodchase Village and Point West",29000,Violent,820,948,867,813,371,706,3448,862,-0.9,-13.9,-13.2,-18.1,2827.6,3269,2989.7,2803.4,2434.5,2972.4,813
20G20,20,3.27621655,"Lakeside Estates, City West Place, Rivercrest and Briargrove Park",18000,Violent,274,305,260,267,147,270,1106,276.5,-2.6,-1.5,1.1,-2.4,1522.2,1694.4,1444.4,1483.3,1500,1536.1,267
20G30,20,3.97953501,"West Houston Medical Center, Andrau Airport, Westchase and Westchase Mall",26000,Violent,781,850,792,752,302,606,3175,793.8,-3.7,-22.4,-19.4,-23.7,3003.8,3269.2,3046.2,2892.3,2330.8,3053.1,752
20G40,20,4.16594899,"Lakeview Forest, Lakeside Place, Ashford Village and Southlake",28000,Violent,573,523,594,641,265,561,2331,582.8,11.9,-2.1,-12.5,-3.7,2046.4,1867.9,2121.4,2289.3,2003.6,2081.4,641
20G70,20,2.38283582,Westpark Village and Ashford Point,21000,Violent,428,481,462,469,248,440,1840,460,9.6,2.8,-6.2,-4.3,2038.1,2290.5,2200,2233.3,2095.2,2190.5,469
20G80,20,25.33626534,City Limits,37000,Violent,474,547,571,565,280,527,2157,539.2,19.2,11.2,-6.7,-2.3,1281.1,1478.4,1543.2,1527,1424.3,1457.3,565
21I10,21,0.00549966,Intercontinental Airport,0,Violent,17,9,29,32,20,35,87,21.8,88.2,105.9,9.4,60.6,NA,NA,NA,NA,NA,NA,32
21I20,21,0.01205019,Intercontinental Airport,0,Violent,0,0,0,1,0,0,1,0.2,NA,NA,-100,-100,NA,NA,NA,NA,NA,NA,1
21I30,21,0.01180375,Intercontinental Airport,0,Violent,0,0,0,0,0,0,0,0,NA,NA,NA,NA,NA,NA,NA,NA,NA,NA,0
21I40,21,0.00923163,Intercontinental Airport,0,Violent,3,2,2,8,6,10,15,3.8,166.7,233.3,25,163.2,NA,NA,NA,NA,NA,NA,8
21I50,21,14.61100076,Intercontinental Airport,0,Violent,68,49,62,84,33,74,263,65.8,23.5,8.8,-11.9,12.5,NA,NA,NA,NA,NA,NA,84
21I70,21,0.01945113,Intercontinental Airport,0,Violent,0,0,0,0,1,1,0,0,NA,NA,NA,NA,NA,NA,NA,NA,NA,NA,0
22B10,22,3.28874287,"Willowbrook, Willow Chase Park and Centerfield",8000,Violent,375,401,375,376,172,352,1527,381.8,0.3,-6.1,-6.4,-7.8,4687.5,5012.5,4687.5,4700,4400,4772.5,376
5F20,5,5.94082911,Spring Branch and Schwartz Park,42000,Violent,795,874,871,733,433,816,3273,818.2,-7.8,2.6,11.3,-0.3,1892.9,2081,2073.8,1745.2,1942.9,1948.1,733
4F10,4,4.13606469,"Timber Oaks, Shadow Oaks and Long Point Acres",23000,Violent,423,406,397,435,261,455,1661,415.2,2.8,7.6,4.6,9.6,1839.1,1765.2,1726.1,1891.3,1978.3,1805.2,435
20G50,20,5.88593521,"Nottingham, Yorkshire, Wilchester, Town and Country Village and Memorial City Shopping Center",30000,Violent,214,207,235,205,100,192,861,215.2,-4.2,-10.3,-6.3,-10.8,713.3,690,783.3,683.3,640,717.3,205
4F20,4,5.85840284,"Claymore Park, Westbranch, Spring Shadows and Kempwood Forest",28000,Violent,390,365,372,373,238,398,1500,375,-4.4,2.1,6.7,6.1,1392.9,1303.6,1328.6,1332.1,1421.4,1339.3,373
20G60,20,4.54207617,"Barkers Landing, Fleetwood, Thornwood and Darrel Tully Stadium",23000,Violent,254,325,314,266,128,224,1159,289.8,4.7,-11.8,-15.8,-22.7,1104.3,1413,1365.2,1156.5,973.9,1260,266
4F30,4,26.30690179,"Addicks Reservoir Area, Claymore Park, Brittmore Village, Park Ten Place and Mayde Creek Farms",18000,Violent,274,307,316,276,168,305,1173,293.2,0.7,11.3,10.5,4,1522.2,1705.6,1755.6,1533.3,1694.4,1628.9,276
24C10,24,5.44044978,Kingwood,13000,Violent,105,141,106,94,40,80,446,111.5,-10.5,-23.8,-14.9,-28.3,807.7,1084.6,815.4,723.1,615.4,857.7,94
24C20,24,6.8291794,Kingwood,18000,Violent,79,96,113,111,49,96,399,99.8,40.5,21.5,-13.5,-3.8,438.9,533.3,627.8,616.7,533.3,554.4,111
24C30,24,9.78735527,Kingwood,29000,Violent,101,88,97,95,66,123,381,95.2,-5.9,21.8,29.5,29.2,348.3,303.4,334.5,327.6,424.1,328.3,95
24C40,24,35.7992771,Kingwood,6000,Violent,59,64,78,61,30,59,262,65.5,3.4,0,-3.3,-9.9,983.3,1066.7,1300,1016.7,983.3,1091.7,61
24C50,24,7.51791807,Kingwood,5000,Violent,79,90,84,103,58,95,356,89,30.4,20.3,-7.8,6.7,1580,1800,1680,2060,1900,1780,103
24C60,24,4.86823328,Kingwood,21000,Violent,57,40,55,23,7,16,175,43.8,-59.6,-71.9,-30.4,-63.5,271.4,190.5,261.9,109.5,76.2,208.6,23
21I60,21,0.01236886,Intercontinental Airport,0,Violent,6,1,4,8,2,3,19,4.8,33.3,-50,-62.5,-37.5,NA,NA,NA,NA,NA,NA,8
