beat,district,area_sq_mi,placename,population,type,total22,total19,total20,total21,last12mos,total_prior3years,avg_prior3years,inc_19to21,inc_19tolast12,inc_21tolast12,inc_prior3yearavgtolast12,rate19,rate20,rate21,rate_last12,rate_prior3years
23J40,23,3.03933481,Intercontinental Airport,0,Violent,2,0,0,0,2,0,0,NA,NA,NA,NA,NA,NA,NA,NA,NA
23J50,23,2.12389492,Intercontinental Airport,0,Violent,28,20,18,23,32,61,20.3,15,60,39.1,58,NA,NA,NA,NA,NA
1A10,1,1.74646692,Downtown Central Business District,17000,Violent,481,851,596,697,634,2144,714.7,-18.1,-25.5,-9,-11,5005.9,3505.9,4100,3729.4,4204.1
1A20,1,2.44133075,"Fourth Ward, Avondale and Westmoreland",27000,Violent,462,647,573,704,619,1924,641.3,8.8,-4.3,-12.1,-3,2396.3,2122.2,2607.4,2292.6,2375.2
1A30,1,2.65916892,"Cherryhurst, Mandell Place and Montrose",27000,Violent,218,388,361,302,294,1051,350.3,-22.2,-24.2,-2.6,-16,1437,1337,1118.5,1088.9,1297.4
1A40,1,2.45016686,"Tall Timbers, Royden Oaks, River Oaks, Avalon Place and Oak Estates",7000,Violent,19,30,23,34,27,87,29,13.3,-10,-20.6,-7,428.6,328.6,485.7,385.7,414.3
1A50,1,3.04553452,"Post Oak Park, Afton Oaks, Highland Village, Weslayan, Greenway Plaza and The Compaq Center",26000,Violent,227,284,335,363,328,982,327.3,27.8,15.5,-9.6,0,1092.3,1288.5,1396.2,1261.5,1258.8
2A10,2,3.30928608,Irvington and Ryon,18000,Violent,365,743,702,579,512,2024,674.7,-22.1,-31.1,-11.6,-24,4127.8,3900,3216.7,2844.4,3748.3
2A20,2,1.8876461,"Sunset Heights, Brooksmith and Stude",11000,Violent,139,286,309,233,207,828,276,-18.5,-27.6,-11.2,-25,2600,2809.1,2118.2,1881.8,2509.1
2A30,2,4.65858171,"Houston Heights, Norhill and Studemont",31000,Violent,155,281,243,232,205,756,252,-17.4,-27,-11.6,-19,906.5,783.9,748.4,661.3,812.9
2A40,2,1.60546103,Old Sixth Ward and the First Ward,8000,Violent,92,121,126,128,122,375,125,5.8,0.8,-4.7,-2,1512.5,1575,1600,1525,1562.5
2A50,2,5.4659844,"Memorial Park, West End, Ashbury and Cottage Grove",29000,Violent,232,354,307,413,340,1074,358,16.7,-4,-17.7,-5,1220.7,1058.6,1424.1,1172.4,1234.5
2A60,2,4.67447346,"Westport, Holly Park, Lazy Brook, Citadel, Shady Acres and Timbergrove",21000,Violent,165,212,206,241,239,659,219.7,13.7,12.7,-0.8,9,1009.5,981,1147.6,1138.1,1046.2
3B10,3,6.82068773,"Northwest Mall, Brookhollow, White Oak Acres, Oak Forest and Langwood",34000,Violent,652,957,1055,1016,899,3028,1009.3,6.2,-6.1,-11.5,-11,2814.7,3102.9,2988.2,2644.1,2968.5
3B30,3,5.310372,"White Oak Acres, Brook Hollow, Oak Forest, Garden Oaks and Shepherd Park Plaza",23000,Violent,149,221,230,227,217,678,226,2.7,-1.8,-4.4,-4,960.9,1000,987,943.5,982.6
3B40,3,3.40013561,"Independence Heights, Melrose and Graceland",13000,Violent,377,651,659,619,528,1929,643,-4.9,-18.9,-14.7,-18,5007.7,5069.2,4761.5,4061.5,4946.2
3B50,3,3.85259517,"Northline Mall, Stratton Place, Oakwood, Colonial Gardens, Lindale and Junction City",20000,Violent,471,790,782,732,640,2304,768,-7.3,-19,-12.6,-17,3950,3910,3660,3200,3840
5F10,5,3.25978513,Afton Village and Pine Terrace,14000,Violent,204,292,248,287,288,827,275.7,-1.7,-1.4,0.3,4,2085.7,1771.4,2050,2057.1,1969.3
5F30,5,8.70689439,"Fairbanks, Carverdale, Fawndale and Northwest Crossing",17000,Violent,461,686,719,737,627,2142,714,7.4,-8.6,-14.9,-12,4035.3,4229.4,4335.3,3688.2,4200
6B10,6,5.50084827,"York Plaza, Pembrook Place and Hawthorne Place",33000,Violent,545,919,1001,1002,809,2922,974,9,-12,-19.3,-17,2784.8,3033.3,3036.4,2451.5,2951.5
6B20,6,6.12869477,"Highland Heights, Oakdale and Melrose Gardens",18000,Violent,403,783,822,669,537,2274,758,-14.6,-31.4,-19.7,-29,4350,4566.7,3716.7,2983.3,4211.1
6B30,6,7.2300685,"Woodland Trails, Oaks of Inwood, Bayou Bend, Cole Creek Manor and Inwood Forest",38000,Violent,555,1026,1071,887,745,2984,994.7,-13.5,-27.4,-16,-25,2700,2818.4,2334.2,1960.5,2617.6
6B40,6,5.544689,"Highland Gardens, Highland Heights and North Plaza",20000,Violent,471,914,1025,852,636,2791,930.3,-6.8,-30.4,-25.4,-32,4570,5125,4260,3180,4651.5
22B30,22,2.8264671,Aldine and Imperial Valley,19000,Violent,497,713,640,647,656,2000,666.7,-9.3,-8,1.4,-2,3752.6,3368.4,3405.3,3452.6,3508.9
22B20,22,4.61158268,Greenspoint,24000,Violent,925,1488,1580,1388,1234,4456,1485.3,-6.7,-17.1,-11.1,-17,6200,6583.3,5783.3,5141.7,6188.8
7C10,7,3.47828324,"Fifth Ward, North Park and Pinecrest",13000,Violent,420,647,674,563,567,1884,628,-13,-12.4,0.7,-10,4976.9,5184.6,4330.8,4361.5,4830.8
7C20,7,7.08575157,"Huntington Place, Willshire Place, Kashmere Gardens and Liberty Gardens",21000,Violent,803,1437,1363,1250,1098,4050,1350,-13,-23.6,-12.2,-19,6842.9,6490.5,5952.4,5228.6,6428.6
7C30,7,4.51719841,"Camden Woods, Archers Acres and Croyden Gardens",18000,Violent,433,697,770,800,616,2267,755.7,14.8,-11.6,-23,-18,3872.2,4277.8,4444.4,3422.2,4198.3
7C40,7,3.36786526,Keith-Weiss Park and Farrington Place,8000,Violent,134,246,225,219,202,690,230,-11,-17.9,-7.8,-12,3075,2812.5,2737.5,2525,2875
22B40,22,13.03325001,"Intercontinental Airport, Northwood, Lakeview Park and Glen Lee",11000,Violent,358,373,385,490,471,1248,416,31.4,26.3,-3.9,13,3390.9,3500,4454.5,4281.8,3781.8
8C10,8,3.69037316,"Tidwell Park, Shady Oak and Buckingham Place",12000,Violent,504,761,817,711,670,2289,763,-6.6,-12,-5.8,-12,6341.7,6808.3,5925,5583.3,6358.3
8C20,8,3.36154214,"Houston Gardens, Rosewood and Homestead",7000,Violent,162,281,312,297,223,890,296.7,5.7,-20.6,-24.9,-25,4014.3,4457.1,4242.9,3185.7,4238.6
8C30,8,4.6258259,"Parkhurst, East Houston and Clairmont Place",11000,Violent,257,378,499,419,356,1296,432,10.8,-5.8,-15,-18,3436.4,4536.4,3809.1,3236.4,3927.3
8C40,8,4.97945551,"Lake Houston, Greenriver, Knoll and Lake Forest",8000,Violent,104,176,202,175,131,553,184.3,-0.6,-25.6,-25.1,-29,2200,2525,2187.5,1637.5,2303.8
8C50,8,3.31739498,"Park North, Forest Green, Kentshire Place, Glenwood Forest and Dorchester",8000,Violent,237,443,475,430,339,1348,449.3,-2.9,-23.5,-21.2,-25,5537.5,5937.5,5375,4237.5,5616.2
8C60,8,5.79693312,"Edgeworth, Northwood Manor and Scenic Woods",19000,Violent,356,639,713,545,476,1897,632.3,-14.7,-25.5,-12.7,-25,3363.2,3752.6,2868.4,2505.3,3327.9
9C10,9,5.21185619,"Port of Houston, Clinton Park, Pleasantville and Fidelity Manor",6000,Violent,96,180,216,171,137,567,189,-5,-23.9,-19.9,-28,3000,3600,2850,2283.3,3150
9C20,9,7.5383173,Denver Harbor and Houston Harbor,16000,Violent,269,402,447,348,361,1197,399,-13.4,-10.2,3.7,-10,2512.5,2793.8,2175,2256.2,2493.8
9C30,9,8.13353768,"City Park East, Wynnewood Acres and Wallisville Gardens",9000,Violent,161,222,293,278,221,793,264.3,25.2,-0.5,-20.5,-16,2466.7,3255.6,3088.9,2455.6,2936.7
9C40,9,10.42549456,"Greens Bayou Estates, Shady Brook, Northshore",23000,Violent,410,766,764,696,593,2226,742,-9.1,-22.6,-14.8,-20,3330.4,3321.7,3026.1,2578.3,3226.1
10H10,10,2.81830654,Oak Lawn and Ranger,11000,Violent,181,315,271,259,238,845,281.7,-17.8,-24.4,-8.1,-16,2863.6,2463.6,2354.5,2163.6,2560.9
10H20,10,1.75743169,Eastwood and Broadmoor,10000,Violent,177,190,200,197,220,587,195.7,3.7,15.8,11.7,12,1900,2000,1970,2200,1957
10H30,10,1.02691154,Near East End,4000,Violent,118,171,158,173,168,502,167.3,1.2,-1.8,-2.9,0,4275,3950,4325,4200,4182.5
10H40,10,0.99627062,Midtown,8000,Violent,402,751,638,567,538,1956,652,-24.5,-28.4,-5.1,-17,9387.5,7975,7087.5,6725,8150
10H50,10,2.30843079,the University of Houston area,13000,Violent,448,753,691,609,592,2053,684.3,-19.1,-21.4,-2.8,-13,5792.3,5315.4,4684.6,4553.8,5263.8
10H60,10,3.08931006,"University Oaks, Riverside Terrace and the Texas Southern University area",20000,Violent,403,544,520,496,517,1560,520,-8.8,-5,4.2,-1,2720,2600,2480,2585,2600
10H70,10,3.52217952,"Texas Medical Center, Hermann Park, Houston Zoo and Miller Outdoor Theatre",16000,Violent,325,421,435,458,424,1314,438,8.8,0.7,-7.4,-3,2631.2,2718.8,2862.5,2650,2737.5
10H80,10,2.73862779,"Southampton, Rice University area, Shadow Lawn and Broad Acres",19000,Violent,87,120,97,98,110,315,105,-18.3,-8.3,12.2,5,631.6,510.5,515.8,578.9,552.6
11H10,11,5.31502815,"Mason Park, Forest Hill, Sunnyland and Central Park",28000,Violent,605,832,957,776,815,2565,855,-6.7,-2,5,-5,2971.4,3417.9,2771.4,2910.7,3053.6
11H20,11,3.9311161,"Harrisburg, Manchester and Pecan Park",18000,Violent,262,430,416,432,367,1278,426,0.5,-14.7,-15,-14,2388.9,2311.1,2400,2038.9,2366.7
11H30,11,2.84278059,Meadow Brook and Park Place,15000,Violent,342,404,481,409,452,1294,431.3,1.2,11.9,10.5,5,2693.3,3206.7,2726.7,3013.3,2875.3
11H40,11,6.14001938,Allendale and Oak Meadows,8000,Violent,85,107,142,119,110,368,122.7,11.2,2.8,-7.6,-10,1337.5,1775,1487.5,1375,1533.8
11H50,11,2.09534157,"Meadow Creek, Ferndale Addition and Glenbrook Industrial",8000,Violent,124,147,189,195,167,531,177,32.7,13.6,-14.4,-6,1837.5,2362.5,2437.5,2087.5,2212.5
12D10,12,8.55384717,"Almeda Mall, Southridge, Edgebrook and South Houston Gardens",44000,Violent,945,1097,1337,1378,1324,3812,1270.7,25.6,20.7,-3.9,4,2493.2,3038.6,3131.8,3009.1,2888
12D20,12,3.83700574,Sage,22000,Violent,276,359,427,375,364,1161,387,4.5,1.4,-2.9,-6,1631.8,1940.9,1704.5,1654.5,1759.1
12D30,12,3.99301158,Gulf Palms and Beamer,15000,Violent,125,201,206,204,167,611,203.7,1.5,-16.9,-18.1,-18,1340,1373.3,1360,1113.3,1358
12D40,12,9.68663455,Scarsdale and Ellington Field,11000,Violent,167,252,272,244,233,768,256,-3.2,-7.5,-4.5,-9,2290.9,2472.7,2218.2,2118.2,2327.3
12D50,12,8.93327581,"Bay Glen, Bay Oaks, Brook Forest and Bay Forest",26000,Violent,69,96,80,94,86,270,90,-2.1,-10.4,-8.5,-4,369.2,307.7,361.5,330.8,346.2
12D60,12,6.35832041,"NASA's Johnson Space Center, Meadow Green, Oakbrook West and Camino South",22000,Violent,135,199,269,242,189,710,236.7,21.6,-5,-21.9,-20,904.5,1222.7,1100,859.1,1075.9
12D70,12,5.39156317,Baybrook Mall and Sterling Knoll,12000,Violent,181,223,255,221,241,699,233,-0.9,8.1,9,3,1858.3,2125,1841.7,2008.3,1941.7
13D10,13,5.2433708,"Gulfgate Mall, Bay Forest, Riverview, Hampshire, Golfcrest and Barnett Stadium",23000,Violent,490,677,668,592,634,1937,645.7,-12.6,-6.4,7.1,-2,2943.5,2904.3,2573.9,2756.5,2807.4
13D20,13,6.66870859,"Fairlawn, Garden Villas, Glenbrook Valley and Santa Rosa",36000,Violent,783,1149,1148,918,1011,3215,1071.7,-20.1,-12,10.1,-6,3191.7,3188.9,2550,2808.3,2976.9
13D30,13,3.07402543,"Allen Farms, Airport Gardens and the Hobby Airport area",2000,Violent,22,46,37,35,27,118,39.3,-23.9,-41.3,-22.9,-31,2300,1850,1750,1350,1965
13D40,13,5.0688163,"Val Verde East, Gulf Meadows and Houston Skyscraper Shadows",13000,Violent,138,166,222,183,183,571,190.3,10.2,10.2,0,-4,1276.9,1707.7,1407.7,1407.7,1463.8
14D10,14,3.66057918,McGregor Terrace and Riverside Terrace,17000,Violent,599,1038,1096,892,798,3026,1008.7,-14.1,-23.1,-10.5,-21,6105.9,6447.1,5247.1,4694.1,5933.5
14D20,14,7.25646368,"Blueridge, Sunnyside, Brook Haven and Bayou Estates",28000,Violent,1120,1691,1763,1512,1439,4966,1655.3,-10.6,-14.9,-4.8,-13,6039.3,6296.4,5400,5139.3,5911.8
14D30,14,4.20537595,"Crestmont, Edgewood, Bellfort Park, Inwood Terrace and Southpark",21000,Violent,544,821,750,660,690,2231,743.7,-19.6,-16,4.5,-7,3909.5,3571.4,3142.9,3285.7,3541.4
14D40,14,6.61224595,"South Acres, Shamrock Manor, Hillwood and Cloverland",21000,Violent,465,622,667,604,616,1893,631,-2.9,-1,2,-2,2961.9,3176.2,2876.2,2933.3,3004.8
14D50,14,8.69627992,"Golden Glade Estates, Langston and Almeda Genoa",9000,Violent,185,196,247,245,232,688,229.3,25,18.4,-5.3,1,2177.8,2744.4,2722.2,2577.8,2547.8
15E10,15,4.34996776,"Meyerland Plaza, Robindell, Meyerland, Braeburn Terrace and Maplewood South",24000,Violent,251,328,359,424,362,1111,370.3,29.3,10.4,-14.6,-2,1366.7,1495.8,1766.7,1508.3,1542.9
15E20,15,3.58384499,"Westbury, Park West and Willow Creek",18000,Violent,174,265,323,244,217,832,277.3,-7.9,-18.1,-11.1,-22,1472.2,1794.4,1355.6,1205.6,1540.6
15E30,15,6.29133294,"Meyer Park, Post Oak Manor, Westwood, Willow Bend and Linkwood",34000,Violent,310,376,422,436,410,1234,411.3,16,9,-6,-0,1105.9,1241.2,1282.4,1205.9,1209.7
15E40,15,10.0079174,"The Astrodome, Six Flags Astroworld, Lakes at 610 and Plaza del Oro",30000,Violent,730,943,882,1052,995,2877,959,11.6,5.5,-5.4,4,3143.3,2940,3506.7,3316.7,3196.7
16E10,16,5.38940818,Canterbury Village and Monarch Estates,15000,Violent,163,220,226,202,205,648,216,-8.2,-6.8,1.5,-5,1466.7,1506.7,1346.7,1366.7,1440
16E20,16,8.15202134,"Almeda Plaza, South Glen, Dumbarton Oaks and Briarwick",35000,Violent,498,623,687,675,663,1985,661.7,8.3,6.4,-1.8,0,1780,1962.9,1928.6,1894.3,1890.6
16E30,16,7.00932789,"Greenpark, Southwest Crossing and Windsor Village",22000,Violent,360,498,491,451,466,1440,480,-9.4,-6.4,3.3,-3,2263.6,2231.8,2050,2118.2,2181.8
16E40,16,7.49721482,"Chasewood, Willowpark, Briarwick, Ridgemont and Quail Run",35000,Violent,406,585,654,610,531,1849,616.3,4.3,-9.2,-13,-14,1671.4,1868.6,1742.9,1517.1,1760.9
17E10,17,3.3104034,"Southwest Memorial Hospital, Burnett Bayland Park and Westmoreland",51000,Violent,959,1377,1498,1374,1262,4249,1416.3,-0.2,-8.4,-8.2,-11,2700,2937.3,2694.1,2474.5,2777.1
17E20,17,3.92767309,the Houston Baptist University area and Maplewood West,27000,Violent,406,582,608,591,549,1781,593.7,1.5,-5.7,-7.1,-8,2155.6,2251.9,2188.9,2033.3,2198.9
17E30,17,3.8060455,Braeburn Valley West and Glenshire,21000,Violent,437,620,748,556,546,1924,641.3,-10.3,-11.9,-1.8,-15,2952.4,3561.9,2647.6,2600,3053.8
17E40,17,4.70920035,"Creekbend, Southwood and Fondren Southwest",46000,Violent,934,1352,1381,1304,1207,4037,1345.7,-3.6,-10.7,-7.4,-10,2939.1,3002.2,2834.8,2623.9,2925.4
18F10,18,1.95881352,"Saddlebrook, Bayou Woods and Sherwood Forest",7000,Violent,61,80,72,73,83,225,75,-8.8,3.8,13.7,11,1142.9,1028.6,1042.9,1185.7,1071.4
18F20,18,3.51641691,"The Galleria, Tanglewood, Riverway and Post Oak",24000,Violent,362,411,424,476,482,1311,437,15.8,17.3,1.3,10,1712.5,1766.7,1983.3,2008.3,1820.8
18F30,18,3.80008564,"The Richmond Strip, Briargrove, Post Oak Estates and Westhaven",36000,Violent,643,810,922,886,842,2618,872.7,9.4,4,-5,-4,2250,2561.1,2461.1,2338.9,2424.2
18F40,18,2.9060249,"Rosewood General Hospital, Woodlake and Briarmeadow",35000,Violent,757,879,1003,976,994,2858,952.7,11,13.1,1.8,4,2511.4,2865.7,2788.6,2840,2722
18F50,18,2.96939217,"Tanglewild, Sharpstown Mall and Regency Square",20000,Violent,619,690,710,810,829,2210,736.7,17.4,20.1,2.3,13,3450,3550,4050,4145,3683.5
18F60,18,3.62528697,Sharpstown Country Club and Southway Center,28000,Violent,351,577,579,579,474,1735,578.3,0.3,-17.9,-18.1,-18,2060.7,2067.9,2067.9,1692.9,2065.4
19G10,19,2.74020376,Concourse South and Westwood Mall,31000,Violent,943,1231,1296,1237,1275,3764,1254.7,0.5,3.6,3.1,2,3971,4180.6,3990.3,4112.9,4047.4
19G20,19,3.29219023,"Catalina Square, Bellaire West, Imperial Point",25000,Violent,245,456,442,478,369,1376,458.7,4.8,-19.1,-22.8,-20,1824,1768,1912,1476,1834.8
19G30,19,2.49064202,"Rodeo Square, Wildflower Green, Braewood Glen",18000,Violent,184,308,282,308,246,898,299.3,0,-20.1,-20.1,-18,1711.1,1566.7,1711.1,1366.7,1662.8
19G40,19,4.56425364,"Huntington Village, Wellington Park, Leawood, Keegans Glen",37000,Violent,519,795,783,775,712,2353,784.3,-2.5,-10.4,-8.1,-9,2148.6,2116.2,2094.6,1924.3,2119.7
19G50,19,2.30578624,"Forum Park, Stancliff and Southwest Park",18000,Violent,407,695,649,644,566,1988,662.7,-7.3,-18.6,-12.1,-15,3861.1,3605.6,3577.8,3144.4,3681.7
20G10,20,3.06600809,"Westchase, Woodchase Village and Point West",29000,Violent,628,820,948,867,842,2635,878.3,5.7,2.7,-2.9,-4,2827.6,3269,2989.7,2903.4,3028.6
20G20,20,3.27621655,"Lakeside Estates, City West Place, Rivercrest and Briargrove Park",18000,Violent,209,274,305,260,263,839,279.7,-5.1,-4,1.2,-6,1522.2,1694.4,1444.4,1461.1,1553.9
20G30,20,3.97953501,"West Houston Medical Center, Andrau Airport, Westchase and Westchase Mall",26000,Violent,582,781,850,792,765,2423,807.7,1.4,-2,-3.4,-5,3003.8,3269.2,3046.2,2942.3,3106.5
20G40,20,4.16594899,"Lakeview Forest, Lakeside Place, Ashford Village and Southlake",28000,Violent,471,573,523,594,614,1690,563.3,3.7,7.2,3.4,9,2046.4,1867.9,2121.4,2192.9,2011.8
20G70,20,2.38283582,Westpark Village and Ashford Point,21000,Violent,376,428,481,462,489,1371,457,7.9,14.3,5.8,7,2038.1,2290.5,2200,2328.6,2176.2
20G80,20,25.33626534,City Limits,37000,Violent,421,474,547,571,536,1592,530.7,20.5,13.1,-6.1,1,1281.1,1478.4,1543.2,1448.6,1434.3
21I10,21,0.00549966,Hobby Airport,0,Violent,24,17,9,29,33,55,18.3,70.6,94.1,13.8,80,NA,NA,NA,NA,NA
21I20,21,0.01205019,Hobby Airport,0,Violent,1,0,0,0,1,0,0,NA,NA,NA,NA,NA,NA,NA,NA,NA
21I40,21,0.00923163,Hobby Airport,0,Violent,7,3,2,2,7,7,2.3,-33.3,133.3,250,204,NA,NA,NA,NA,NA
21I50,21,14.61100076,Hobby Airport,0,Violent,63,68,49,62,81,179,59.7,-8.8,19.1,30.6,36,NA,NA,NA,NA,NA
22B10,22,3.28874287,"Willowbrook, Willow Chase Park and Centerfield",8000,Violent,268,375,401,375,352,1151,383.7,0,-6.1,-6.1,-8,4687.5,5012.5,4687.5,4400,4796.2
5F20,5,5.94082911,Spring Branch and Schwartz Park,42000,Violent,448,795,874,871,656,2540,846.7,9.6,-17.5,-24.7,-23,1892.9,2081,2073.8,1561.9,2016
4F10,4,4.13606469,"Timber Oaks, Shadow Oaks and Long Point Acres",23000,Violent,288,423,406,397,393,1226,408.7,-6.1,-7.1,-1,-4,1839.1,1765.2,1726.1,1708.7,1777
20G50,20,5.88593521,"Nottingham, Yorkshire, Wilchester, Town and Country Village and Memorial City Shopping Center",30000,Violent,141,214,207,235,194,656,218.7,9.8,-9.3,-17.4,-11,713.3,690,783.3,646.7,729
4F20,4,5.85840284,"Claymore Park, Westbranch, Spring Shadows and Kempwood Forest",28000,Violent,258,390,365,372,359,1127,375.7,-4.6,-7.9,-3.5,-4,1392.9,1303.6,1328.6,1282.1,1341.8
20G60,20,4.54207617,"Barkers Landing, Fleetwood, Thornwood and Darrel Tully Stadium",22000,Violent,202,254,325,314,265,893,297.7,23.6,4.3,-15.6,-11,1154.5,1477.3,1427.3,1204.5,1353.2
4F30,4,26.30690179,"Addicks Reservoir Area, Claymore Park, Brittmore Village, Park Ten Place and Mayde Creek Farms",18000,Violent,169,274,307,316,238,897,299,15.3,-13.1,-24.7,-20,1522.2,1705.6,1755.6,1322.2,1661.1
24C10,24,5.44044978,Kingwood,13000,Violent,72,105,141,106,92,352,117.3,1,-12.4,-13.2,-22,807.7,1084.6,815.4,707.7,902.3
24C20,24,6.8291794,Kingwood,18000,Violent,90,79,96,113,116,288,96,43,46.8,2.7,21,438.9,533.3,627.8,644.4,533.3
24C30,24,9.78735527,Kingwood,29000,Violent,66,101,88,97,87,286,95.3,-4,-13.9,-10.3,-9,348.3,303.4,334.5,300,328.6
24C40,24,35.7992771,Kingwood,6000,Violent,46,59,64,78,63,201,67,32.2,6.8,-19.2,-6,983.3,1066.7,1300,1050,1116.7
24C50,24,7.51791807,Kingwood,5000,Violent,80,79,90,84,104,253,84.3,6.3,31.6,23.8,23,1580,1800,1680,2080,1686
24C60,24,4.86823328,Kingwood,21000,Violent,18,57,40,55,31,152,50.7,-3.5,-45.6,-43.6,-39,271.4,190.5,261.9,147.6,241.4
21I60,21,0.01236886,Hobby Airport,0,Violent,8,6,1,4,8,11,3.7,-33.3,33.3,100,116,NA,NA,NA,NA,NA
01A10,NA,NA,NA,NA,Violent,62,0,0,0,62,0,0,NA,NA,NA,NA,NA,NA,NA,NA,NA
01A20,NA,NA,NA,NA,Violent,53,0,0,0,53,0,0,NA,NA,NA,NA,NA,NA,NA,NA,NA
01A30,NA,NA,NA,NA,Violent,23,0,0,0,23,0,0,NA,NA,NA,NA,NA,NA,NA,NA,NA
01A40,NA,NA,NA,NA,Violent,1,0,0,0,1,0,0,NA,NA,NA,NA,NA,NA,NA,NA,NA
01A50,NA,NA,NA,NA,Violent,30,0,0,0,30,0,0,NA,NA,NA,NA,NA,NA,NA,NA,NA
02A10,NA,NA,NA,NA,Violent,50,0,0,0,50,0,0,NA,NA,NA,NA,NA,NA,NA,NA,NA
02A20,NA,NA,NA,NA,Violent,16,0,0,0,16,0,0,NA,NA,NA,NA,NA,NA,NA,NA,NA
02A30,NA,NA,NA,NA,Violent,14,0,0,0,14,0,0,NA,NA,NA,NA,NA,NA,NA,NA,NA
02A40,NA,NA,NA,NA,Violent,7,0,0,0,7,0,0,NA,NA,NA,NA,NA,NA,NA,NA,NA
02A50,NA,NA,NA,NA,Violent,33,0,0,0,33,0,0,NA,NA,NA,NA,NA,NA,NA,NA,NA
02A60,NA,NA,NA,NA,Violent,15,0,0,0,15,0,0,NA,NA,NA,NA,NA,NA,NA,NA,NA
03B10,NA,NA,NA,NA,Violent,64,0,0,0,64,0,0,NA,NA,NA,NA,NA,NA,NA,NA,NA
03B30,NA,NA,NA,NA,Violent,17,0,0,0,17,0,0,NA,NA,NA,NA,NA,NA,NA,NA,NA
03B40,NA,NA,NA,NA,Violent,41,0,0,0,41,0,0,NA,NA,NA,NA,NA,NA,NA,NA,NA
03B50,NA,NA,NA,NA,Violent,47,0,0,0,47,0,0,NA,NA,NA,NA,NA,NA,NA,NA,NA
04F10,NA,NA,NA,NA,Violent,30,0,0,0,30,0,0,NA,NA,NA,NA,NA,NA,NA,NA,NA
04F20,NA,NA,NA,NA,Violent,25,0,0,0,25,0,0,NA,NA,NA,NA,NA,NA,NA,NA,NA
04F30,NA,NA,NA,NA,Violent,22,0,0,0,22,0,0,NA,NA,NA,NA,NA,NA,NA,NA,NA
05F10,NA,NA,NA,NA,Violent,22,0,0,0,22,0,0,NA,NA,NA,NA,NA,NA,NA,NA,NA
05F20,NA,NA,NA,NA,Violent,74,0,0,0,74,0,0,NA,NA,NA,NA,NA,NA,NA,NA,NA
05F30,NA,NA,NA,NA,Violent,43,0,0,0,43,0,0,NA,NA,NA,NA,NA,NA,NA,NA,NA
06B10,NA,NA,NA,NA,Violent,53,0,0,0,53,0,0,NA,NA,NA,NA,NA,NA,NA,NA,NA
06B20,NA,NA,NA,NA,Violent,53,0,0,0,53,0,0,NA,NA,NA,NA,NA,NA,NA,NA,NA
06B30,NA,NA,NA,NA,Violent,72,0,0,0,72,0,0,NA,NA,NA,NA,NA,NA,NA,NA,NA
06B40,NA,NA,NA,NA,Violent,52,0,0,0,52,0,0,NA,NA,NA,NA,NA,NA,NA,NA,NA
07C10,NA,NA,NA,NA,Violent,49,0,0,0,49,0,0,NA,NA,NA,NA,NA,NA,NA,NA,NA
07C20,NA,NA,NA,NA,Violent,81,0,0,0,81,0,0,NA,NA,NA,NA,NA,NA,NA,NA,NA
07C30,NA,NA,NA,NA,Violent,38,0,0,0,38,0,0,NA,NA,NA,NA,NA,NA,NA,NA,NA
07C40,NA,NA,NA,NA,Violent,12,0,0,0,12,0,0,NA,NA,NA,NA,NA,NA,NA,NA,NA
08C10,NA,NA,NA,NA,Violent,40,0,0,0,40,0,0,NA,NA,NA,NA,NA,NA,NA,NA,NA
08C20,NA,NA,NA,NA,Violent,14,0,0,0,14,0,0,NA,NA,NA,NA,NA,NA,NA,NA,NA
08C30,NA,NA,NA,NA,Violent,31,0,0,0,31,0,0,NA,NA,NA,NA,NA,NA,NA,NA,NA
08C40,NA,NA,NA,NA,Violent,3,0,0,0,3,0,0,NA,NA,NA,NA,NA,NA,NA,NA,NA
08C50,NA,NA,NA,NA,Violent,29,0,0,0,29,0,0,NA,NA,NA,NA,NA,NA,NA,NA,NA
08C60,NA,NA,NA,NA,Violent,37,0,0,0,37,0,0,NA,NA,NA,NA,NA,NA,NA,NA,NA
09C10,NA,NA,NA,NA,Violent,5,0,0,0,5,0,0,NA,NA,NA,NA,NA,NA,NA,NA,NA
09C20,NA,NA,NA,NA,Violent,16,0,0,0,16,0,0,NA,NA,NA,NA,NA,NA,NA,NA,NA
09C30,NA,NA,NA,NA,Violent,17,0,0,0,17,0,0,NA,NA,NA,NA,NA,NA,NA,NA,NA
09C40,NA,NA,NA,NA,Violent,43,0,0,0,43,0,0,NA,NA,NA,NA,NA,NA,NA,NA,NA
HCC1,NA,NA,NA,NA,Violent,3,0,1,0,3,1,0.3,NA,NA,NA,900,NA,NA,NA,NA,NA
HCC5,NA,NA,NA,NA,Violent,0,1,0,0,0,1,0.3,-100,-100,NA,-100,NA,NA,NA,NA,NA
HCC7,NA,NA,NA,NA,Violent,0,1,10,0,0,11,3.7,-100,-100,NA,-100,NA,NA,NA,NA,NA
HCSO,NA,NA,NA,NA,Violent,39,162,156,18,40,336,112,-88.9,-75.3,122.2,-64,NA,NA,NA,NA,NA
OOJ,NA,NA,NA,NA,Violent,41,216,169,24,42,409,136.3,-88.9,-80.6,75,-69,NA,NA,NA,NA,NA
UH-3PD,NA,NA,NA,NA,Violent,0,0,1,1,0,2,0.7,NA,NA,-100,-100,NA,NA,NA,NA,NA
Unknown,NA,NA,NA,NA,Violent,6,14,10,5,6,29,9.7,-64.3,-57.1,20,-38,NA,NA,NA,NA,NA
